84702336,真的很震撼的一个景点，感受历史韵味的同时，还能体会网红景点，看着菩提树感受心静。最好穿着汉服或唐装，更美！,/Date(1569829488000+0800)/,0
33963088,很棒的景点，游玩了4个多小时。文创出乎意料的丰富，价格也公道。会向朋友推荐大报恩寺景点，下次晚上来体验一下,/Date(1568188687000+0800)/,0
1512358,有实物，有影像，也有文字介绍，还可上塔远望南京市景。但总感觉不是太到位，缺少了人文和历史。要是再增加一些历史方面的东西会更好！,/Date(1567298478000+0800)/,1
153406539,景区分合理，灯光很漂亮，只是电梯突然故障，怪吓人的，希望引起注意。,/Date(1566476789000+0800)/,0
183668526,现代科技和佛寺文化的完美结合，里面的场景在灯光下真的很美，女孩子最好穿着汉服、古风打扮过来拍照，很有感觉。,/Date(1565690617000+0800)/,0
1312994,一路行来，跨越千年，感受到古时寺庙盛况和佛教的鼎盛风采，值得去看。,/Date(1559918845000+0800)/,0
98979519,来南京，值得进去看一下！,/Date(1619290076000+0800)/,0
32540493,可以景色不错，有趣好玩，,/Date(1613957354000+0800)/,0
268798110,超赞景色不错，有趣好玩，,/Date(1608618403000+0800)/,0
18949042,这是在大报恩寺遗址上重建的，所以能看到遗址的断壁残垣。但我喜欢历史本来遗留的东西，后来建的有点网红的感觉,/Date(1607645379000+0800)/,0
56334114,科技现代感十足，美伦美幻,/Date(1606807019000+0800)/,0
183303469,不知为何，戴耳塞无法收听,/Date(1606742293000+0800)/,0
3998859,非常值得，古代寺院的新生,/Date(1605584315000+0800)/,0
31507802,非常值得一去，租个汉服拍,/Date(1604629004000+0800)/,0
246490297,性价比高，可能还没完善，空地较多，略显空旷，琉璃塔现在是玻璃塔.,/Date(1603846452000+0800)/,0
12673091,非常非常棒！一定要去看！,/Date(1600854021000+0800)/,0
7516463,晚上去的，人不多，很艳丽,/Date(1599095786000+0800)/,0
3269453,很值得去的地方，古今结合,/Date(1598349430000+0800)/,0
47849513,占地面积大，文创的东西多,/Date(1597216154000+0800)/,0
5202620,南京的大报恩寺真的如网上说的，漂亮！美！是真的值得一去的好地方。,/Date(1579012731000+0800)/,0
1707557,不错～成人直接身份证刷证进入～属于网红打卡地～可能年轻人比较喜欢去～但报恩寺的门框，真不愧是南博的宝物～,/Date(1570421311000+0800)/,0
240730866,佛教徒打卡圣地，内部布景很美丽，打字打卡拍照，很大很值得慢慢逛逛,/Date(1568248303000+0800)/,0
107909730,大报恩寺遗址公园将古代佛教文化与现代科技相互融合非常值得前往欣赏,/Date(1566876788000+0800)/,0
232679280,游玩体验很好！推荐体验汉服，良心商家，服务态度很好！出片质量很高！提供全套服饰，包括鞋子。细节处理特棒。,/Date(1566013882000+0800)/,0
197926716,超级好看&#x20;很好玩的&#x20;里面很好看&#x20;尤其门口的风铃&#x20;还有可以写邮件的地方&#x20;超级喜欢&#x20;如果有机会的话&#x20;想带家人一起来玩！站在塔上&#x20;看外面的风景也很好&#x20;很舒服&#x20;下次还会再来,/Date(1563811350000+0800)/,0
15473093,带孩子了解一下历史文化，馆内陈列现在和历史的融合，值得推荐的景点,/Date(1562934858000+0800)/,0
265450031,琉璃宝塔，文化走廊很好,/Date(1621395138000+0800)/,0
300680708,非常震撼值得推荐大明寺,/Date(1613985338000+0800)/,0
49023962,本地旅游多次总体超赞，,/Date(1611697732000+0800)/,0
3341907,人少，科技感强，不错~,/Date(1609657760000+0800)/,0
1063500,值得一看，历史文化遗产,/Date(1608190395000+0800)/,0
66436174,就在市内，值得去的地方,/Date(1605084631000+0800)/,0
67548911,非常震撼，适合拍照纪念,/Date(1604038502000+0800)/,0
275114366,高端大气上档次&#x20;值得游玩,/Date(1603627789000+0800)/,0
46402800,有趣好玩，值得推荐，一,/Date(1602511637000+0800)/,0
59407956,里面很大，像一个博物馆,/Date(1602235915000+0800)/,0
13568190,出票特别快，下次还会用,/Date(1599970712000+0800)/,0
604797,虽然打着遗址公园的名字，但是其实是个大型宗教主题摄影棚。从这点来说，气氛烘托不错，装修和设计也属上乘。,/Date(1599431289000+0800)/,0
7232031,蛮不错一家人玩得很开心,/Date(1599382961000+0800)/,0
25216724,纯娱乐，没有感觉是寺庙,/Date(1599028241000+0800)/,0
193479718,拍照好看&#x20;但是票价有点贵,/Date(1597717182000+0800)/,0
48148277,门票很贵，性价比不高。,/Date(1596418740000+0800)/,0
3798630,最大的败笔就是报恩寺塔。既然做钢结构，好歹装饰上也搞的像木结构。全玻璃加钢结构，我是真佩服设计的人了。,/Date(1596041583000+0800)/,0
6624375,不错的说，门票使用方便,/Date(1595648360000+0800)/,0
239861410,还是不错的，值得去看看,/Date(1594172020000+0800)/,0
2639062,博物馆很震撼！点个赞！,/Date(1591426509000+0800)/,0
97221766,大报恩寺遗址公园也是当地比较有名的景区之一，原来的大报恩寺是按照皇宫的标准来造的，金碧辉煌，昼夜通明。现在复建的是由轻钢结构和玻璃构成共九层。,/Date(1581709157000+0800)/,0
34390052,这个真的好玩！！！！无敌推荐，玩的几天就觉得这个地方最有意思，和朋友一起去了解文物和拍拍照真的特别的不错，地址不远过去很方便，玩一下午绰绰有余,/Date(1577681649000+0800)/,0
24159223,大报恩寺里面很精美&#x20;而且运用科技手段更加惊艳&#x20;可以登塔远眺南京市景,/Date(1576064952000+0800)/,0
243487932,主要是以佛教为主题，走在内部如同在穿越，行程走完大概一个半小时,/Date(1575711428000+0800)/,0
55694608,我以为是寺庙，没想到是在遗址上建的类似于博物馆展览厅之类的建筑。虽然肯定花了很多钱，也有很多看起来很好科技的东西，但是我觉得不是我想象中的寺！,/Date(1568812737000+0800)/,0
190509946,携程团票很方便，里面景真的好美好美呀，遗憾的是下雨不让登塔，有机会再去，不过别的景就已经很值得一看了！,/Date(1565542990000+0800)/,0
173605058,很凉快，让人心旷神怡，不错的体验。还有毕加索的画展，值得一看。,/Date(1564295118000+0800)/,0
182142592,佛主顶骨舍利的出土处，非常长知识的一个博物馆，下次一定会再来！,/Date(1563769163000+0800)/,0
330536,总体超赞，性价比高，,/Date(1621303211000+0800)/,0
245144104,总体超赞，性价比高，,/Date(1620625257000+0800)/,0
280515125,总体超赞，有趣好玩，,/Date(1620557044000+0800)/,0
20569613,总体超赞，景色不错，,/Date(1620355965000+0800)/,0
102646708,性价比高，景色不错，,/Date(1620125268000+0800)/,0
23841363,性价比高，总体超赞，,/Date(1619303220000+0800)/,0
17565261,景点不错，值得游玩。,/Date(1619250812000+0800)/,0
250629667,环境很好，游客不算多,/Date(1617510024000+0800)/,0
35143691,值得一游，科技感很炫,/Date(1617324123000+0800)/,0
1849633,有趣好玩，景色不错，,/Date(1616687246000+0800)/,0
195974108,有趣好玩，景色不错，,/Date(1616565519000+0800)/,0
13469036,有趣好玩，总体超赞，,/Date(1615565677000+0800)/,0
234546100,有趣好玩，性价比高，,/Date(1614731871000+0800)/,0
62217729,总体超赞，景色不错，,/Date(1613612534000+0800)/,0
5629509,总体超赞，有趣好玩，,/Date(1611586956000+0800)/,0
74214147,总体超赞，景色不错，,/Date(1608563572000+0800)/,0
232620169,真的很不错有趣好玩，,/Date(1608377496000+0800)/,0
192082174,总体超赞，景色不错，,/Date(1607569744000+0800)/,0
841514,性价比高，总体超赞，,/Date(1607353979000+0800)/,0
271061431,有趣好玩，总体超赞，,/Date(1607238518000+0800)/,0
85889604,有趣好玩，性价比高，,/Date(1606182313000+0800)/,0
4073350,总体超赞，景色不错，,/Date(1605237182000+0800)/,0
80783966,有趣好玩，性价比高，,/Date(1604908519000+0800)/,0
170532116,性价比高，总体超赞，,/Date(1604732772000+0800)/,0
16965833,景色不错，总体超赞，,/Date(1604717438000+0800)/,0
157138782,景色不错，有趣好玩，,/Date(1604668764000+0800)/,0
9467708,挺好的，设计挺美观的,/Date(1604574646000+0800)/,0
261049045,服务周到，态度诚恳。,/Date(1604565061000+0800)/,0
158605599,总体超赞，性价比高，,/Date(1603805104000+0800)/,0
156045668,景色不错，有趣好玩，,/Date(1603703891000+0800)/,0
102491945,景色不错，总体超赞，,/Date(1603539392000+0800)/,0
1155482,总体超赞，性价比高，,/Date(1603250473000+0800)/,0
54578722,人文景观！值得一看！,/Date(1602115285000+0800)/,0
166403311,第一次看vr挺好玩的,/Date(1602089211000+0800)/,0
61960862,值得推荐，景色不错，,/Date(1602067494000+0800)/,0
16306777,景色不错，体验很好，,/Date(1601900639000+0800)/,0
,景色不错，值得推荐，,/Date(1601849056000+0800)/,0
5595329,还是很赞的，值得一去,/Date(1601808709000+0800)/,0
38101539,陪爸妈去的，都说不错,/Date(1600691943000+0800)/,0
264280244,体验很好，景色不错，,/Date(1600404384000+0800)/,0
234701899,景色不错，体验很好，,/Date(1600348367000+0800)/,0
42437047,体验很好，值得推荐，,/Date(1600223433000+0800)/,0
160265489,体验很好，景色不错，,/Date(1599732903000+0800)/,0
20179750,景色不错，体验很好，,/Date(1599715459000+0800)/,0
3269453,感恩之情，古今永流传,/Date(1599350917000+0800)/,0
47340265,值得推荐，体验很好，,/Date(1599055521000+0800)/,0
63443950,景色不错，值得推荐，,/Date(1599042414000+0800)/,0
31273483,不错不错，值得拥有！,/Date(1599026549000+0800)/,0
9386962,南京值得一去景点圣地,/Date(1598892536000+0800)/,0
220785861,很震撼，非常值得一游,/Date(1598848241000+0800)/,0
27859572,值得推荐，景色不错，,/Date(1598583593000+0800)/,0
251936158,体验很好，景色不错，,/Date(1597727528000+0800)/,0
187621318,景色不错，有趣好玩，,/Date(1597726010000+0800)/,0
156045668,景色不错，体验很好，,/Date(1597331929000+0800)/,0
6041901,体验很好，景色不错，,/Date(1597315710000+0800)/,0
170537671,体验很好，有趣好玩，,/Date(1597026972000+0800)/,0
5005151,有趣好玩，体验很好，,/Date(1596809578000+0800)/,0
2557617,千年对望，撼动我心！,/Date(1596804530000+0800)/,0
68104722,值得推荐，体验很好，,/Date(1596516813000+0800)/,0
156045668,值得推荐，体验很好，,/Date(1596318803000+0800)/,0
183095098,景色不错，有趣好玩，,/Date(1596018697000+0800)/,0
156045668,体验很好，值得推荐，,/Date(1595585332000+0800)/,0
199189620,景色不错，值得推荐，,/Date(1595501404000+0800)/,0
3030509,景色不错，体验很好，,/Date(1595428133000+0800)/,0
266224934,挺不错的，逛了两小时,/Date(1595245356000+0800)/,0
19327120,有趣好玩，体验很好，,/Date(1595223460000+0800)/,0
32232444,体验很好，有趣好玩，,/Date(1595127171000+0800)/,0
593827,值得推荐，有教育意义,/Date(1594893397000+0800)/,0
60286123,有趣好玩，景色不错，,/Date(1594872619000+0800)/,0
40206544,挺好的。感觉物超所值,/Date(1594392059000+0800)/,0
268844229,值得推荐，体验很好，,/Date(1594014072000+0800)/,0
175164119,环境很好，放松心情。,/Date(1593575545000+0800)/,0
151943972,体验很好，景色不错，,/Date(1593092262000+0800)/,0
3825071,值得推荐，有趣好玩，,/Date(1592994245000+0800)/,0
3452481,体验很好，景色不错，,/Date(1592961167000+0800)/,0
4216703,有趣好玩，值得推荐，,/Date(1590911890000+0800)/,0
99949771,去过牛首山就觉得大报恩寺一般了。看你行程安排，去过牛首山可以不用来这里了。如果时间充裕半天以上安排就去牛首山，不想太累时间紧凑就来报恩寺遗址,/Date(1578316788000+0800)/,0
362624,大报恩寺晚上的夜景还是很美的。最好是黄昏的时候去，再到晚上。,/Date(1575860359000+0800)/,0
87842020,今天来南京，第一站来这边玩，确实感觉很大很美观，很有历史感。,/Date(1575028320000+0800)/,0
2517784,总体感受还是不错的，占地也很广，地宫出土的石匣、阿育王塔、银椁和金棺都一一陈列，虽然重新修建的塔是现代造型，可是是故意的哦，夜晚灯光漂亮的。,/Date(1574316668000+0800)/,0
2129898,一个网红打卡的地方，里面以佛教为主题的景区，很精致漂亮！大赞,/Date(1569762407000+0800)/,0
33226510,很震撼很好看！家人都很开心！！拍了很多照片！南京值得去！上图,/Date(1569563414000+0800)/,0
80924090,历史景点，是孙权最早建立的，太平天国时期毁坏。太可惜了真是，,/Date(1568966082000+0800)/,0
6274694,艺术唯美，历史和现代的完美结合，是看到过的设计最好的宗教建筑,/Date(1568635088000+0800)/,0
11742363,文物精美丰富，佛塔现代气息有点重，去的时候人不多，值得一看。,/Date(1566267930000+0800)/,0
187463861,交通很方便，第一次来南京玩，大报恩寺琉璃塔很雄伟，馆内也很先进，介绍了大报恩寺塔的由来和发展，是朱棣报答马皇后和朱元璋而建，学习了南京的历史,/Date(1564480033000+0800)/,0
5701622,大报恩寺是中国历史上最悠久的弗教之地，现在是大报恩寺遗址博物馆。修建的很漂亮，展馆内的摆设很有讲究，不虚此行。在塔顶上可以观光秦淮河风光。门票价格120一个人有些贵，但很值得推荐！,/Date(1515822497000+0800)/,6
78783682,非常值得去，新建的馆，各项设施很新，一进门有储存柜，行李方便寄存，网上订票，取票很方便，里面景色很好看，同时最人性化的是，里面还有免费的沙池，拼插积木和海洋池可以供小孩子玩耍，夏天南京温度很高，这个景点相对来说既凉快人也少,/Date(1501408484000+0800)/,5
167724820,景点很好&#x20;佛像很庄严,/Date(1614599675000+0800)/,0
111046921,南京大报恩寺遗址公园悬重建的，修的挺好！游玩挺赏心悦目的。,/Date(1563551106000+0800)/,0
229357405,很好，历史文化积淀深厚佛教文化遗产虽被战乱毁坏但遗址很不错,/Date(1561510768000+0800)/,0
32219222,非常喜欢&#x20;值得打卡,/Date(1614587634000+0800)/,0
20831977,景色不错，里面的餐饮只有两家，吃的东西没啥挑的，有点贵，,/Date(1599568361000+0800)/,0
207554162,距中华门瓮城很近，挺有特色的，既能够了解大报恩寺的由来，又了解了佛教的历史文化，还有佛教一些珍贵文物的展示，游人不太多，可以慢慢游览。距离老门东又近，出来后可以去哪里逛吃逛吃。,/Date(1575629284000+0800)/,0
203728871,非常喜欢的一个地方，又酷又文艺，现代感和文化完美的结合。,/Date(1566378884000+0800)/,0
34084592,很久以前就知道的，那时还只是真的遗址，几年前修茸开放了，加上前不久刚读了一篇朱棣的小说，就来看看吧，院墙很有威势，夜晚的宝塔会更漂亮吧。,/Date(1560732203000+0800)/,0
3995231,很值得去&#x20;，很好,/Date(1606007999000+0800)/,0
71674182,可以说是艺术博物馆，和遗址景区。&#x20;可以了解报恩寺前世今生，&#x20;顺时针绕一圈，不错。&#x20;很多拍照的地方。&#x20;还比较值，慢慢逛，可以逛一下午快点2小时。,/Date(1576499696000+0800)/,0
20968778,浓浓的佛教氛围，身处其中，心境仿佛也得到了洗礼和升华。,/Date(1576377726000+0800)/,0
155364805,非常好的景点，虽然旧址，新建融入高科技，挺震撼的效果。,/Date(1573872593000+0800)/,0
2607932,先后来了两次，南京网红打卡地年轻学生很多，很美啊门票价格高啊，感觉江苏省对传统文化遗址保护利用得很好，故事讲得好，投入大，产出也非常棒,/Date(1559977334000+0800)/,0
8966095,不错&#x20;值得一去,/Date(1620090008000+0800)/,0
113094286,挺好玩的&#x20;推荐,/Date(1608039532000+0800)/,0
267926900,太美啦&#x20;震撼！,/Date(1598276231000+0800)/,0
38854654,文化底蕴深厚，内容丰富。文物保存完好，可以登塔瞭望。,/Date(1588498633000+0800)/,0
24401772,大报恩寺，一定要去的地方，很震撼,/Date(1577536484000+0800)/,1
230276275,效果很震撼，很满意的一次出行，在塔顶几户能俯瞰整个南京，值得一去，但历史氛围感觉不是特别厚重,/Date(1573455018000+0800)/,0
31929346,场馆很有特色&#x20;美轮美奂&#x20;慕名而来&#x20;门口体验汉服的地方租了件美服&#x20;女儿穿上&#x20;很仙&#x20;很美&#x20;,/Date(1566384125000+0800)/,1
100295234,古代与现代艺术的结合，带着小朋友没有细品，代下次再探,/Date(1565335568000+0800)/,0
49776692,没有修图，纯实景拍摄，感觉不错～,/Date(1564994656000+0800)/,1
19177674,景点内容很特别，很喜欢，主题是感恩！冰淇淋非常好吃。,/Date(1563887335000+0800)/,0
1710782,值得一去的景点！古今艺术大碰撞！相信孩子们会喜欢的！,/Date(1563767345000+0800)/,0
26161233,进去景区大门就是两串风铃，摇曳作响。走进大厅，巨大的地基遗址让人不禁感叹古人的智慧。仔细观看展览，一点点了解大报恩寺的历史故事，感受琉璃塔的光辉，更是让人心情久久不能平复。,/Date(1561964831000+0800)/,0
64251663,报父母恩，报天地恩[玫瑰]&#x0A;一千七百年佛脉，感应舍利，阿育王塔&#x0A;大报恩寺琉璃塔是四百年**最高建筑，中世纪世界七大奇迹，东方宝塔[强],/Date(1587461299000+0800)/,0
59364272,利用灯光艺术，场景美轮美奂，门口有租衣服，可以穿汉服拍照打卡，仙气满满的地方。具有教育意义和历史意义，里面还有吃饭的地方，值得去。,/Date(1574826753000+0800)/,0
51441080,强烈推荐，建在遗址上的报恩寺，十一跟家人去了，人虽然多，但是不是太热，历史与现代的碰撞，不仅可以感受历史的浮沉还可以领略现代科技。,/Date(1571669504000+0800)/,0
41860864,通过《国家宝藏》了解到了这个地方。总体下来感觉有些失望。新建的塔主题是钢筋和玻璃，无法想象当年的样子，太现代了。不会再去第二次。,/Date(1602560075000+0800)/,0
59364272,具有教育意义，充分利用了光影效果，场景美轮美奂，一步一景，门口有提供租衣服头饰的，可以穿汉服拍照，仙气满满的地方，非常值得一去。,/Date(1574654902000+0800)/,0
239427867,全程在里面，还是挺凉快的，景点也不错，让人震撼！,/Date(1566550570000+0800)/,0
39195156,小朋友看下古遗址，增长见识，这个地方还是值得一看,/Date(1563958975000+0800)/,0
60201414,现代博物馆，知识和艺术共同学习，喜欢，推荐！！！,/Date(1563028267000+0800)/,0
3490643,报着很大的期望来到这里:佛像文物都不能拍，全琉璃的佛塔都被保护起来了。感觉能看到的并不多，文物很多都是仿的。看到的都是金钱堆砌的,/Date(1562640788000+0800)/,0
15068493,感受一下大报恩寺昔日的辉煌，光看那扇幸存的门就觉得以前真的太美了。现在的玻璃塔太丑了！还有很多光影效果的展厅，来逛逛还是不错的,/Date(1573786530000+0800)/,0
189112213,惊艳到了，融合了很多科技元素和主题，非常值得。,/Date(1572969163000+0800)/,0
236158526,去过南京很多馆，还是觉得报恩寺比较安静。去了两次，一次是去游景点，一次去拍汉服。推荐有时间和机会的小姐姐一定要去拍一次汉服呀。,/Date(1565234914000+0800)/,0
7333824,非常值得一去，沒二个小时玩不下来，参观环境舒适,/Date(1564195299000+0800)/,0
16319528,位置很好找，门口有公交车站也比较方便里面很大，我买的是汉服加门票比较划算，里面有空调不用担心里面里面很热！逛逛也要两三个小时的,/Date(1560507990000+0800)/,0
2116776,国庆节前人还是蛮多的，这个是历史遗址上新建的，把新和旧融合起来，还是比较成功的。旧址在地下，用玻璃地面铺设，参观起来很有趣。,/Date(1570945988000+0800)/,0
28263170,很值得一去的城市景点，可以登塔俯瞰或者远眺，别有意境。遗址设计精美，环境优雅，充满浓郁文化氛围，不同年龄段人群都会有所获益。,/Date(1570420369000+0800)/,0
156348933,里面是真的做的很漂亮，可以当美术馆参观，只是国庆人实在多，所以体验感有所下降，下次如果有机会，可以穿着汉服来，千万不要节假日,/Date(1570184922000+0800)/,0
908505,虽说都是重建，也还是逛了一下，没那么好。有些灯光秀、艺术装置、雕塑和佛教影片，算是当年佛光的一道回响，但深度太浅，佛法的微妙和当初大报恩寺的影响力岂止这点。对阿育王塔的介绍可以再多些。,/Date(1566168358000+0800)/,1
76504925,大报恩寺很值得去，很震撼。去了不愿意出来了。,/Date(1562166128000+0800)/,0
161760097,喜欢佛教文化的可以去感受一下&#x20;参观场所也不是很大&#x20;正方形逛两遍也就2个小时 性价比低，,/Date(1619769598000+0800)/,0
220550372,郎骑竹马来，绕床弄青梅。同居长千里，两小无猜。”报恩圣地，就坐落于李白笔下浪漫的长干里。南京大报恩寺曾经亚洲最大的佛教寺院,/Date(1585732348000+0800)/,0
151517841,大慈恩寺，大雁塔。我觉得是需要安静的慢慢体会的地方，意外的惊喜是可以登塔瞭望。整个景区连同南北广场还是很不错的，值得一游！,/Date(1567610579000+0800)/,0
221207825,很好，来南京出差，也就去了这几个地方，真心不错，值得去的一个地方，推荐大家去看看，,/Date(1566737031000+0800)/,0
18690130,遗迹，现代感交相辉影，很美，值得带孩子游玩,/Date(1566345580000+0800)/,0
50592613,网上买票，直接刷身份证进入，省去换票环节，十分方便。寺内各种建筑图案，很美很壮观，佛像看着让人震撼。很好，值得出行，参观。,/Date(1565677576000+0800)/,0
49629802,值回票价&#x20;历史与现实交织&#x20;世界微尘里&#x20;吾宁爱与憎,/Date(1564843094000+0800)/,0
8698756,下单便捷，即付即用，很迅速方便；景区内挺大的，最少需要1-2小时马马虎虎逛完，细细观赏可以带点食物进去逛到下午再出来，虽然是复建的，但是还是很有历史感的，值得一去,/Date(1563525844000+0800)/,0
225524130,美轮美奂，景色超漂亮。虽然只是遗址，但修复后的大报恩寺还是很值得一看的。了解了更多南京的历史发展和演变，非常适合孩子学习。,/Date(1562580006000+0800)/,0
265879052,体验很好，值得推荐，有趣好玩，景色不错，,/Date(1590377552000+0800)/,0
6442509,真是打卡圣地，很多年轻人是专门去拍照的。虽然历史沉淀有点感受不到，但作为景点也是很值得看看了。有些地方也很吸引孩子，不错,/Date(1574758322000+0800)/,0
152628301,大报恩寺遗址于南京秦淮区中华门外，大报恩寺历史悠久是南京和整个江南历史上的第一座寺塔，也是中国继洛阳白马寺之后的第二座寺庙。它是明代金陵三大寺首寺，原址毁于太平天国战火，令人不胜唏嘘，现在看到的是2014年重建。雨花台离大报恩寺不远，骑辆单车几分钟就到了，不过要拐几个弯注意导航。,/Date(1572561859000+0800)/,0
32094188,很好的体验，&#x20;传统与创新的结合，&#x20;有时间值得一去的地方.&#x20;推荐一下***********************************************************************************************************,/Date(1569772825000+0800)/,0
162413026,父母养育之恩，终生难报，而明君朱棣也用自己的实际行动做到了这一点。尽管因为政治原因，朱棣无法与自己的亲身母亲相认，但他仍斥巨资建造了这座宏伟的建筑—大报恩寺，以纪念自己的母亲。尽管由于后世战争的原因，它惨遭战火屠戮，导致今日无法以其原本的面目呈现于人们面前，然而今日的遗迹却仍能向人们诉说一二，向人们展示其昔日之宏伟与壮观。而大报恩塔更是奇妙无比，建造的如此巧妙，这难道不是我国古代工匠智慧的体现吗？正是通过这座绝无仅有的大报恩寺，朱棣寄托了对母亲的哀思，而他或许不是一个好人，但却确确实实地是一位明君孝子。,/Date(1566285257000+0800)/,0
117999,个人是想补充了解大报恩寺遗址才来参观的，对遗迹，文物以及历史背景感兴趣。对于网红拍摄地，都是用科技手段搭建出来的，没啥太大感觉，给女儿应景拍个照而已。整体逛，用了两个小时不到，没有上塔，一个重建的，特别现代的玻璃塔，没啥意思。如果特地跑南京看就没必要了，作为对琉璃拱门的延伸了解，可以去逛逛。另，有地方免费寄托行李，在地下一层的游客中心，到服务台登记信息拿号牌就行！,/Date(1566197321000+0800)/,0
