4437741,逛大报恩寺就有一种穿越的感觉，了解到它的前世今生，它的繁华它的繁华落尽，无不心怀一种庄严肃穆，做为一个出土释迦牟尼佛顶舍利的古寺，主要以展览为主，少了一份香火的气息，却多了不少文创的周边，来南京一定要参观一下大报恩寺，这为上篇，而下篇就是位于牛首山的佛顶宫,/Date(1572771045000+0800)/,0
249747884,买的套票可以一路从大报恩寺玩过去，要先去负一层领票，里面挺大，景观和灯光效果做的非常好，出门右拐走几百米就是游船，散客最好半点去，据开船的大叔说他们是半点发船，全程大概半小时到四十分钟左右，下船过桥就是中华门，去的时候好像有在修还是建什么东西有些地方被围起来了。,/Date(1572756576000+0800)/,0
56878908,这是一个特别值得推荐的景点，如果有时间建议游玩2小时左右，细细品味历史的韵味。这次前往有幸瞻礼从大报恩寺地宫出土并供奉于寺中的感应舍利，甚为殊胜，该地宫同时出土的还有佛顶骨舍利（世界上已出土的唯一一枚顶骨舍利，现供奉于牛首山）、玄奘顶骨舍利和诸圣舍利，是出土文物最多的寺院，大报恩寺的前身是长干寺和天禧寺，在明永乐改为现名，是朱棣为纪念父亲朱元璋和母亲马皇后的养育之恩，在宋代天禧寺原址上重建的，寺院内写着“人生若有大事必来大报恩寺”，此次成行非常殊胜，当跪拜在地宫感应舍利前默念南无阿弥陀佛并诚心祈愿时眼泪如注，内心久久不能平静，愿佛保佑家人平安健康，愿老父亲顺遂。,/Date(1572167965000+0800)/,0
33475241,大报恩寺遗址公园位于南京中华门外，北邻外秦淮河，南接雨花台，东至1865园区，西至雨花路，整个园区占地面积200亩！这是江南佛教圣地，素有“佛陀里”之美誉。东吴时期建起，供奉舍利而有名。宋初兴长干寺，不久改名天禧寺，供奉佛祖顶骨舍利、感应舍利、诸圣舍利和玄奘大师顶骨舍利。永乐年间弘拓旧址、度越前代，以玻璃塔巨构殊型，壮丽东南。可惜太平年间被毁！在门口，记得要拿免费的地图噢！里面也有一些短片可以欣赏，声光电的运用蛮酷炫的！总游玩时间建议2小时，不光是拍照，还可以看注释、来源等，可以学习到很多知识！琉璃塔可以上去噢，8层，可以俯瞰南京！里面也有餐厅的。,/Date(1571669151000+0800)/,0
37162220,佛教寺庙，大报恩寺是明成祖朱棣为了纪念明太祖朱元璋和马皇后而建，之前的寺庙遭到毁坏，现在的塔是按照之前的重新建造，据说晚上夜景很美，我们是白天去的；里面很多文物，很精美；重修后的大报恩塔，有专门的上行通道，和下行通道，还有单独的电梯通道。,/Date(1570849579000+0800)/,0
6723227,从南京博物院出来，打了个车去了大报恩寺遗址。说是遗址，真的只是遗址啦，只有一些土堆，一口清朝的井，一小段宋代的石砖路。其他都是灯光打造的佛教世界。讲解器还是租了，说实话内容也不多。但总归要听听吧，否则谁知道那么多灯代表啥意思呢。除了门票贵，去转转还是可以的。,/Date(1570459368000+0800)/,0
179197539,因为形成安排，国庆假期第5天来的大报恩寺，行李随身方便返程去火车站。景区地下一楼游客服务中心可以大件行李寄存，服务不错。一个大厅就可以完成入园所有流程。景区也是很大，涨了不少知识。在里面影院可以了解到大报恩塔的前世今生。南京的历史文化传承做的非常棒，南京周也是走向世界！是中国的骄傲！品，细品，你会觉得不虚此行！,/Date(1570329691000+0800)/,0
160407299,报恩寺有“中国之大古董，永乐之大窑器”之誉，被称为“天下第一塔。虽然原塔早已不复存在，但展馆里有复原图可以体会当时的宏伟壮观，金碧辉煌！保存下来的国宝级琉璃拱门一定值得一看，充分展示了古代人的聪明智慧和超高技艺！我们也可以登上后来修建的塔，里面有电梯直达八楼，可以眺望不一样的南京城。,/Date(1570094960000+0800)/,0
4002039,大报恩寺是非常棒的地方！人也不多，但是很值得一去！虽然是佛教文化，但也体现了从三国到晚清的历史，还是挺震撼的！场景也做的很好！晚上的琉璃塔特别美！从大报恩寺出来就可以坐游船，半个多小时，还有两岸景物的讲解，上了岸就可以去中华门，上城墙！秋天真的是出游的好时节！,/Date(1569294891000+0800)/,0
56396607,大报恩寺前身市建初寺，金陵得第一座佛教寺庙。&#x0A;朱棣为了报恩，修建了琉璃塔和大报恩寺。&#x0A;琉璃塔蔚为壮观，是中古七大奇迹，安徒生作品中都有描写，可惜毁于太平天国。&#x0A;2008年打开塔基下地宫发掘出宋代铁函，佛祖顶骨舍利。现在存放在牛首山佛顶宫。&#x0A;万达接手以后，修建了一座玻璃的塔。上面贴了一些玻璃纸冒充琉璃瓦。&#x0A;现在其实就是文旅公园，里面除了遗址，其他都是复制品。,/Date(1568883905000+0800)/,0
17640563,首先要明确大报恩寺遗址公园的定位是公园，从遗址保护的角度来看是做的到位的，基本原位保留了当年考古发现的建筑遗存、构件、出土文物并有明确的参观路线和历史说明，可以感受到明代建寺后的恢弘大气和悲凉过往，体会到从宋代长干寺到明清、民国长达千年的历史变迁。在国内遗址公园范围内属于特点鲜明，主题突出，华丽而不浮躁的存在。从此角度看它并非复建的大报恩寺，如果执意以佛教寺庙标准来看那是与其定位不符了，当年的世界奇迹已消逝于历史之中，复建一座也无多少意义，不如现在的作为遗址公园更可让我们凭栏追忆，发挥想象，感受历史。,/Date(1568682813000+0800)/,0
72191775,终于来到了大报恩寺❤️&#x20;之前在****、***上看到很多人推荐过，千年对望和树下的场景已经快变成“网红景点”了。&#x20;很喜欢这个遗迹景区，想了很久大概是以下几个原因：1.&#x20;历史和现代的完美结合。&#x20;把千年悠悠历史以一种别样的现代感方式呈现在当代人眼前。真的很特别。&#x20;2.&#x20;语音导览很方便，方便了观展&#x20;，也不影响他人。3.&#x20;千年对望佛祖呈现的太神圣&#x20;太让人惊叹了。很多人在拍照&#x20;也有摆拍的。但展馆的用意应该不只是想给大家看到科技感吧？&#x20;更希望能通过此情此景诉说一段历史，让人去感悟&#x20;去体会吧。个人之鉴。&#x20;4.&#x20;祈福圣地，美好的心愿呀，&#x20;希望实现。,/Date(1568525935000+0800)/,0
233168320,我们是一家人早上去的南博，下午就来到了大报恩寺。景点就在中华门附近，步行5分钟就可以到。景区里面很大，空调非常凉快，适合炎热的夏天游玩。里面有许多不同主题的展览，灯光非常梦幻，很好看！七步生莲，琉璃塔拱门，都非常精致！还有各种佛像设计，让人震撼！值得游玩！,/Date(1567156424000+0800)/,0
18321077,因国家宝藏被大报恩寺的琉璃塔门种草。和女儿两个人的南京四日游第三天，当天早晨决定去大报恩寺遗址公园转转，携程购票实在方便，学生享受的优待票需要到窗口换票，成人票直接刷身份证入园，园区内汉服租赁和自助语音导览器都在一个柜台，好多漂亮的小姐姐穿汉服拍照。,/Date(1566918166000+0800)/,0
63335201,大报恩寺遗址公园位于南京中华门外&#x20;可以乘坐地铁1号线中华门站下车&#x20;从2号口出来骑共享单车2分钟即可到达&#x20;门票可以在网上购买有优惠&#x20;因为不是休息日&#x20;所以游客不是很多&#x20;这里明成祖朱棣为纪念其母修建&#x20;大报恩寺琉璃宝塔非常壮观&#x20;登塔最高可到8层&#x20;可以看到秦淮河和中华门大报恩寺遗址公园以遗址奇观&#x20;千年佛光&#x20;报恩圣地为特色&#x20;展示了佛教文化和地宫出土文物&#x20;千年对望是玄奘法师面对佛陀&#x20;仿佛在聆听佛的谆谆教诲&#x20;杜牧名句南朝四百八十寺&#x20;多少楼台烟雨中即描写了南朝盛况&#x20;舍利佛光如梦如幻&#x20;感觉这里是必须要去的景点之一,/Date(1566471494000+0800)/,0
192529436,非常不错的地方，历史气息浓重，领略了佛教文化的源远流长，还有好多网红打卡地，美丽的不可方物，好多穿汉服小姐姐，都好漂亮啊，唯一可惜的是抄佛经花了太久时间，不知道登塔时间限制，错过了登塔时间，美中不足啊；南朝四百八十寺，多少楼台烟雨中,/Date(1566187816000+0800)/,0
51187135,大报恩寺这个景点我们走的很慢，因为精彩的景致太多了，每一处景致都会让我们停下脚步细细的体会欣赏。光影幽静震撼、迷幻，来了就不想走都难以形容，景致之美让人不得不叹服，设计者的心思精妙，并遵循着色彩、光线、佛教文化及现代科技，能巧妙的把这几点结合，真的非常的了不起。&#x0A;,/Date(1566127386000+0800)/,0
21881151,大报恩寺遗址本来不在行程之内的，因为她太网红。&#x0A;可是后来因为酒店要下午两点后才能入住，它又离南京南站和我第一站去的景点近，就提个购票参观了这个景点，&#x0A;大报恩寺曾经无比辉煌，南京博物院在《国家宝藏》中拿出的三件国宝之一就是大报恩寺的琉璃塔门。&#x0A;整个景区在遗址上建造，室内参观，不用接受暴晒，简直太好评了。&#x0A;里面的分布合理，设计美观。&#x0A;海盐冰淇淋特别好吃。,/Date(1566009247000+0800)/,0
108136990,大报恩寺——是中国历史最为悠久，规模最大，规格最的寺庙，中的佛教中心，继洛阳白马寺之后中国的第二座寺庙，也是中国南方建立的第一座佛寺，与灵谷寺、天界寺并称为陵三大寺，为百寺之首，有“中国之大董，永乐之大窑器”之誉，被称为“天下一塔”。&#x0A;大报恩寺里面建筑风格和装修确实很好看，而且面有些场里的灯光变化超级震撼。不愧是高科技的寺庙，令人耳目一新！,/Date(1565223429000+0800)/,0
79028345,这绝对是我去过的最时尚，最高大上的寺庙。古老神秘的佛教文化和历史，与现代科技手段碰撞，加上绝美的设计，让你在游览中，不断发出惊叹，每一个场馆都给你叹为观止的感受，如果让我推荐，南京必游地绝对是大报恩寺，没有之一！,/Date(1563969586000+0800)/,0
19426347,南朝四百八十寺，多少楼台烟雨中”，杜牧这两句诗中“四百八十寺”的起源就是大报恩寺，跨年夜的时候去的大报恩寺，外面的灯光秀真的是太漂亮了，零点撞钟祈福的人太多了，就没有排队，在里面看到了琉璃拱门，真是精致。,/Date(1562472776000+0800)/,0
5118731,一开始还不太愿意来，觉得就是个寺庙遗址，谁知道一进来，就被满满的佛教文化和艺术风格震撼，特别是馆内的设计，千年对望——佛祖头像是由无数玻璃晶管错落有致呈现出来的，七步生莲——一步一莲花，整个馆内也随处可见莲花的点缀。,/Date(1561610605000+0800)/,2
42674171,"读万卷书,行万里路,胸中脱去尘浊,自然丘壑内营,立成鄄鄂。去名胜古迹可以看看古人在这块土地上留下的各种遗迹，了解了解我们中华文化的博大精深，学到更多的知识。去自然风景区，能够直接面对自然界的奇异景观，陶冶情操增长见闻。",/Date(1561440067000+0800)/,0
170177862,周六下午去的，天有点热，但是还是抵挡不住我去大报恩寺踩点，带着老人小孩一起。去藏经阁观摩了一下，非常崇拜仙人们的智慧，只是觉得逛两三个小时都无法看完。这次也去网红地踩点，景观不错，只是有点眩晕，总之无需此行,/Date(1560589032000+0800)/,0
73563094,&#x20;&#x20;这是个集人文历史宗教为一体的景点，博物馆内有许多有趣又好看的场馆和藏品，最珍贵的就是舍利了。大报恩寺外观宏伟，由于排队电梯的人太多，所以我们是一层层走楼梯上去，也一层层看着风景越来越美，是很值得体验的一个事情。,/Date(1560266350000+0800)/,0
957782,无数次路过南京，这次终于有时间可以逛逛南京了。大报恩寺遗址公园，非常值得一看。,/Date(1593947580000+0800)/,0
85356084,真的太棒了，巨推荐大家一定要去逛逛，超美，里面的内容相当丰富，让你的见识大大增长，了解舍利了解佛，了解报恩寺的框架&#x20;里面还有免费的画展，还可以让你免费作画涂色鱼，然后应用科技放入它的海洋，太棒了！！！,/Date(1564753697000+0800)/,0
35819700,展馆很大&#x20;也很有灵气&#x20;在市中心交通方便&#x20;如果来不及去佛顶宫瞻仰&#x20;很推荐来大报恩寺辗转,/Date(1619321351000+0800)/,0
24585228,上塔顶看南京城全景不输绿地洲际，标志性建筑和钟山基本都能看到，就是展出的东西有点少，票价有点小贵，不过相比之下还是隔壁那个城墙好多了，提前一天买套票会划算些,/Date(1605274232000+0800)/,0
65870585,别样的寺，刷新了我对寺的理解！很震撼,/Date(1591713507000+0800)/,0
112270022,大报恩寺遗址公园是明朱棣为报母恩恩修建，后毁于太平天国战火。公园面积很大，外广场仿琉璃建了新塔晚上发光变色，非常漂亮！室内有遗址坑土，抬基，还有多个展览，现在还有雍和宫佛像专展，很多都是稀世珍宝！,/Date(1572492381000+0800)/,0
248173295,这是一次非常棒的游览，景点都非常棒，我们去的时候，人不是太多，拍照也非常好看。还有许多藏品的展览，这个公园是在以前的遗址地基上建的，有点现代与古典的结合，非常值得大家去游玩（当然人少的时候更好）。,/Date(1571709907000+0800)/,0
30555498,感觉性价比比较低，东西还可以，门票比较贵。假如小几十块的门票倒可以去看看。,/Date(1634426020000+0800)/,0
1486511,去南京应该去报恩寺看看，值得一看。,/Date(1632913856000+0800)/,0
2155979,在塔上看看蓝鲸古城的风景着实不错，设计还挺合理的，正好绕一圈，不用出去晒！,/Date(1627052588000+0800)/,0
63979809,整体不错，内部设计适合游客拍照留念,/Date(1624341953000+0800)/,0
12131506,很壮观，建筑辉煌大气，文物很珍贵！,/Date(1624266846000+0800)/,0
627651,喜欢这里的琉璃作品。&#x0A;票价有点高了。,/Date(1615544558000+0800)/,0
19363007,现代修复历史的成功案例，值得一游。,/Date(1605937249000+0800)/,0
22132453,不错不错不错，很有意思，下次还要去,/Date(1594399051000+0800)/,0
31769182,值得一去的地方&#x20;进门口一排风铃&#x20;被风轻轻带过后的轻吟&#x20;超动听&#x20;配上蓝天白云真的太美好了&#x20;离开南京前匆匆而过&#x20;但一点也没舍得错过任何一出景&#x20;时间足够的可以慢慢逛慢慢拍照&#x20;有兴趣的还可以体验一下汉服&#x20;感觉拍照超美肯定&#x20;,/Date(1567908824000+0800)/,0
166865335,东西还是不错的，人也不是特别多，,/Date(1634313378000+0800)/,0
257101740,很棒诶，大报恩寺，照片拍的很美哟,/Date(1623819774000+0800)/,0
22590637,人不多，还是蛮惊艳的地方，有点像博物馆还有有一个座舍利子塔～推荐去看看！,/Date(1621697186000+0800)/,0
439918,很有老南京的历史气息，值得观赏,/Date(1635384875000+0800)/,0
15809088,在遗址上复建了塔，夜景挺漂亮。,/Date(1631189199000+0800)/,0
36592041,景色不错，性价比高，总体超赞，,/Date(1623591588000+0800)/,0
236084955,有趣好玩，总体超赞，性价比高，,/Date(1623406996000+0800)/,0
84636617,总体超赞，性价比高，有趣好玩，,/Date(1622536656000+0800)/,0
19697419,景色不错，性价比高，有趣好玩，,/Date(1622027011000+0800)/,0
23598021,景色不错，性价比高，总体超赞，,/Date(1614081194000+0800)/,0
268082987,不错哦，停车场很大，很值得游玩,/Date(1601993845000+0800)/,0
24871931,景色不错，体验很好，值得推荐，,/Date(1601441948000+0800)/,0
157419214,值得推荐，体验很好，景色不错，,/Date(1596803263000+0800)/,0
217217374,总体感觉还不错，走马观花2小时足够了，门口保安不让带饮料和吃的，其实放包里就行了，也没x光机来查。不过在暑假里，有一点不好就是人太多了，所以一些经典场景没有拍到心仪的照片，因为人一波一波的。,/Date(1566209918000+0800)/,0
560088,传说中的大报恩寺，新晋网红打卡地，还有汉服出租供体验，来的比较晚，虽是新开发的，创意点较多，围绕大报恩寺的历史来做主题展示，不过有一部分由于一些原因没有展出原件，仅为仿品有些遗憾哈，其他OK,/Date(1560876051000+0800)/,0
171456416,很新颖，带孩子看看，很不错哦,/Date(1632362137000+0800)/,0
40269972,有历史，有文化，很舒服人不多,/Date(1631772838000+0800)/,0
12217160,非常新，琉璃塔也让人眼前一亮,/Date(1627976196000+0800)/,0
119785840,很好，科技感很强，地宫很震撼,/Date(1627060167000+0800)/,0
37293125,很现代化的寺庙，很美，很震撼,/Date(1624871458000+0800)/,0
48228260,有趣好玩，体验很好，感受文化,/Date(1599538189000+0800)/,0
167817458,大报恩寺遗址公园紧挨着中华门，跟着手机导航去的，走了很多冤枉路，不过也不错，顺带逛了逛周围的秦淮河，风光无限好。大报恩寺遗址公园里面很美，看了很多网友的上传照片慕名而去的，真不错，我喜欢。,/Date(1565123763000+0800)/,0
309222046,很独特，现代感与寺庙的结合,/Date(1624521418000+0800)/,0
58351896,大报恩寺yybs!拍照绝佳,/Date(1624364983000+0800)/,0
222055905,娃非要去，天气忒热的一天，里面倒是挺庄严肃穆的，但是小伙子没啥兴趣，爸爸也不是很懂，所以走马观花了一下，性价比不是很高，指望溜娃的话请慎重一点吧。,/Date(1620543979000+0800)/,0
1967481,灯光效果很不不哦&#x0A;比想象中的有看点&#x0A;我们还做了祈福 &#x20; 希望有机会能还愿,/Date(1605419497000+0800)/,0
33272682,绝对高于预期的一趟旅行。曾经辉煌无比的琉璃塔在战乱中化为灰烬，只留下一些夯土、石块……重建的琉璃塔可以登上最高层，俯瞰整个南京城。场馆里设施齐全，可以了解报恩寺的历史,/Date(1565921614000+0800)/,1
2971529,怒刷一波大报恩寺，美cry～&#x0A;逛完一圈赶脚自己是发达国家了，天花板、墙面、地板上各种细节，无障碍通道一流，我膨胀了[呲牙][呲牙][呲牙]&#x0A;这里绝对比网红照片还美100倍！强推强推！[嘿哈],/Date(1563609544000+0800)/,0
295074716,有趣好玩，总体超赞，很好,/Date(1622432585000+0800)/,0
2771751,遗址公园气势恢宏，古老传承与现代科技相德益彰，晚上的夜色美轮美奂,/Date(1618879517000+0800)/,0
15475112,看过国家宝藏后特意来大报恩寺看看，出乎意料的好，古典与现代交织，文物很精美，了解了很多佛教知识，晚上的灯光效果很好，即使是十一假期人也不是很多。,/Date(1608818610000+0800)/,0
167447386,非常棒的一次体验，棒棒哒,/Date(1591525984000+0800)/,0
119749657,好，非常好，值得推荐。,/Date(1636879977000+0800)/,0
116713105,大报恩寺位于南京市秦淮区中华门外，是中国历史上最为悠久的佛教寺庙，是继洛阳白马寺之后中国的第二座寺庙，2015年底，大报恩寺遗址公园正式开放。,/Date(1620091364000+0800)/,0
190600184,大报恩寺，国家宝藏第一季秦海璐演过。琉璃塔的拱门，关于琉璃塔还有个很凄美的爱情故事。说是修塔人的故事。英国还有个仿照它的塔,/Date(1610682925000+0800)/,1
95871900,值得一去地方，感觉心灵都得到了满满的正能量,/Date(1608384725000+0800)/,1
51518308,原以为毁于明代战火的大报恩寺遗址公园是残砖烂瓦，现今重新修建成为古代文明与现代高科技于一体，并供奉感应舍利等千年国宝…非常值得一去！值得推荐，,/Date(1597559604000+0800)/,0
49480097,不错的人文和亲子游胜地，因为实在是留存的遗迹不多，所有又很多声光电结合的展示，还有亲子娱乐，其实也不错,/Date(1592272850000+0800)/,0
23939147,来过很多次南京，也是第一来报恩寺，里面有几个景点真的是惊艳到了，灯光真的是美轮美奂，古老的气息与现代科技的结合，给人视觉上的全新体验。个人觉得比别的景点更值得去。而且携程订票很方便。,/Date(1561789856000+0800)/,0
857847,非常值得，性价比高。,/Date(1632909276000+0800)/,0
60436618,带妈妈旅游，非常好！,/Date(1629104760000+0800)/,0
21308730,总体超赞，景色不错，,/Date(1624268941000+0800)/,0
37184449,总体超赞，去了还想去,/Date(1624264499000+0800)/,0
277833689,有趣好玩，景色不错，,/Date(1623911463000+0800)/,0
15951202,二维码入园十分方便。,/Date(1623077738000+0800)/,0
316181438,园区环境挺好，细节比较人性化，小景点设计也很棒，拍照出来好看,/Date(1618648195000+0800)/,0
20749513,虽然是新建的，但是真得有种金碧辉煌的感觉，灯光效果绝对一级。,/Date(1611031494000+0800)/,0
6034283,比较现代化的科技风，不但古典，而且现代，把佛文化展示的较好。,/Date(1605491602000+0800)/,0
263052903,总体超赞，有趣好玩，,/Date(1603290479000+0800)/,0
110387791,外面天气越差 &#x20;里面玩的越嗨 &#x20;空间大 &#x20;空调足 &#x20;大气 &#x20;时髦还能了解历史 &#x20; 建议:&#x20;天气不好其它景点不方便去的时候来 值得推荐，有趣好玩，景色不错，,/Date(1597138982000+0800)/,0
53109226,大报恩寺遗址公园展出的两座明代琉璃窑，均呈不规则马蹄形，由窑门、火墙、窑室和烟道组成，窑门外有砖砌挡火墙，窑床上分布有若干吸火孔，以防止火焰倒流，使得整个窑室温度更均匀，大大提高烧造成功率。大报恩寺塔用的琉璃配件即由这样的窑口出产。,/Date(1568078851000+0800)/,1
70151876,周末带家人去参观了一下，交通也很方便，地铁，公交都有，景区没内整体感觉不错，景区对遗址的保护很到位，个人认为，如果在每个景点，添加上还原的历史照会更好，这样能让游客更了解历史原貌。,/Date(1566724452000+0800)/,0
95760831,以科技加持遗址公园，沉浸式体验，还可在新建的塔上登高望远。,/Date(1611226321000+0800)/,0
24728791,建的还不错，同事推荐一起去的，希望以后还有机会和她一起转转,/Date(1601268462000+0800)/,0
34351235,在原来大报恩寺遗址上重建的公园，科技感十足，也有遗址出土的宝物，古老与现代的完美结合哦！非常好看！&#x0A;景区不太大，预留两个小时逛看够了，如果喜欢摆拍的话就另加时啦,/Date(1573823515000+0800)/,1
1081389,大报恩寺重建于明初，现在地面以上的建筑几乎都是新建的，可见大部分遗迹，特别是天王殿，环廊，库房等的遗址。重建的琉璃塔采用现代工艺，非常漂亮！地宫出土众多宝物，非常精美，参观重点。,/Date(1572938467000+0800)/,0
237824698,闻名已久，终于成行。&#x0A;特别喜欢这么开阔的景观，仿佛穿越到几百年前，依稀体验到古人的热闹与虔诚。公园设计大气磅礴，相比传统古寺庙更增了几分新意。&#x0A;各看各的景，各怀各的情，各自释怀宁静。,/Date(1568887786000+0800)/,0
82877247,还不错&#x20;就是有点热,/Date(1627888007000+0800)/,0
123172,风景不错&#x20;值得一游,/Date(1626017399000+0800)/,0
4009712,很不错的一个历史景点，历史悠久，典故奇多，非常引人入胜！,/Date(1613748541000+0800)/,0
3464554,很不错的景点，都是后造的，但是有很多科技元素，值得一看。,/Date(1607092371000+0800)/,0
5804888,很值得一看！！在梧桐叶里，细细品味时间，在斜阳若影中，感受佛陀的智慧，特别是门口那几块斑驳草印的大青石板，仿佛可以见到，千年来的过往烟云,/Date(1603186905000+0800)/,0
47603536,非常惊艳&#x20;值得一去,/Date(1597455134000+0800)/,0
219432933,景点内很好，就是汉服体验的小姐姐，头髮留最长的，因为推销不到300元套餐，梳头时给我用扯的，特别疼，臭脸可以理解，但是粗暴对待就不能理解,/Date(1594858126000+0800)/,0
95760831,科技加持遗址公园，让参观者有着身临其境的体验，推荐一游。,/Date(1594019555000+0800)/,0
22924286,参观拍照两相宜，打卡必去之地，场景布置的美轮美奂，可以学习到很多知识。看到遗址能想象出当初设计的惊艳，建成后的宏伟和投入的大量财力人力劳力，可惜了毁之一旦。,/Date(1570238561000+0800)/,1
