31589500,现代与历史的结合～很有特色～登塔后可眺城墙与秦淮河～另一面可眺望到雨花台,/Date(1568606149000+0800)/,0
202113023,景点里面很美，环境很好，很适合拍照，现场买票立马就可以使用，非常方便，爸爸妈妈玩呢很开心，塔顶可以看南京景色，美,/Date(1567737160000+0800)/,0
238983778,很好玩，大报恩塔可以坐直达电梯(只在8F和2F停靠)到8F，然后走下来。,/Date(1566984298000+0800)/,0
29482541,非常适合拍照的景点&#x20;&#x20;&#x20;遗址公园也很美,/Date(1566882715000+0800)/,0
190828362,值得一去，感受菩提树下，真的很美,/Date(1566619111000+0800)/,0
44143203,值得一去，就是拍了很多照片，手机上相册找起来实在也太麻烦了吧，一点不人性化，总之，已不是一个寺庙，是个非常好看有深度的博物馆，推荐！,/Date(1508220958000+0800)/,3
33410640,环境不错，里面很大很宽敞，因为不信佛，所以也就走马观花转转，没有牛首山那么壮观，爬上那个塔结果到了顶门没开，累死了，底下也没有人告知,/Date(1478082376000+0800)/,3
19226012,虽说塔为玻璃所制，但登塔还是值得一观，可以俯瞰南京新城旧城全景。&#x0A;各大展厅不同主题的叙述让人不觉乏味。&#x0A;人与自然的展厅采用CR技术使人置身于梦幻中，很美。,/Date(1580563929000+0800)/,0
207230451,还可以，跟期待的一样，价格合适,/Date(1570859485000+0800)/,0
49618,买票倒是很方便，里面一般般吧！买票倒是很方便，里面一般般吧！买票倒是很方便，里面一般般吧！买票倒是很方便，里面一般般吧！买票倒是很方便，里面一般般吧！,/Date(1570557404000+0800)/,0
185305855,里面挺大的，非常好，很值得去呢,/Date(1568525008000+0800)/,0
4662882,景区挺大的，很多东西看，很漂亮,/Date(1568123771000+0800)/,0
36011289,当宗教遭遇当代艺术。有点意思。,/Date(1567933429000+0800)/,0
,还不错了，爬楼好累啊。。。。。,/Date(1567844723000+0800)/,0
64491730,很不错的体验，下次会再去游玩。,/Date(1567176136000+0800)/,0
207493497,超美der！！！！！非常推荐去,/Date(1565437085000+0800)/,0
236957092,环境优美，名胜古迹保护的非常好,/Date(1565125127000+0800)/,0
235571958,感受历史，沐浴恩慈，静化灵魂。,/Date(1564617215000+0800)/,0
153693902,和传统映像中寺庙不同，很现代很美！传统文化与现代科技的结合！挺震撼的。,/Date(1564314712000+0800)/,0
48413188,互动体验很好，置身之中很震撼！,/Date(1560591934000+0800)/,0
102286615,景点比想象的大很多，值得一来！,/Date(1560411545000+0800)/,0
46805888,非常好，不错啊，来看看吧圣地啊，哈哈哈还好还好哈哈哈还好还好哈哈哈还好还好哈哈哈还好还好哈哈哈还好还好哈哈哈还好还好哈哈哈还好还好,/Date(1498955389000+0800)/,3
601960,公司搞接待去过两次&#x20;&#x20;总体来说不错&#x20;那个塔总是被人诟病不够漂亮&#x20;实际是为了保护地宫&#x20;只能用轻质材料。展览手段比较新颖&#x20;但是没有突出佛顶骨舍利被发掘的过程&#x20;实际发掘过程真的可以说是奇迹啊,/Date(1473204266000+0800)/,5
314207012,景色一般，性价比低，可玩性低，有待改进，感觉不值票价，都是现代的东西,/Date(1620356579000+0800)/,0
13515135,值得一去，感觉整个人都祥和了,/Date(1575102170000+0800)/,0
13902788,展示非常精心，值得慢慢游览。,/Date(1573120395000+0800)/,0
120886775,挺好的，老公很喜欢，里面的科技感还是挺足的，值得找个导游讲解，这样能更好的提升游玩愉悦感，毕竟很多遗址都是和文化挂钩的。旁边还有个古城墙，也很雄伟。,/Date(1570322859000+0800)/,0
3506313,很好玩，刷码进门很方便，里面吃的很多，布置很上心，总体体验很好。塔顶过去有点累，排队了半个小时。里面吃的很好,/Date(1570188083000+0800)/,0
35575944,太平天国起义全部废了，真是可恨可惜。尽管如此，现有遗址还是值得一去！,/Date(1569067675000+0800)/,0
259694252,有待改进，性价比低，景色一般，可玩性低，东西太贵了，水都2040的,/Date(1611139682000+0800)/,0
531545,值得去看看，就是门票贵了点，性价比低性价比低，可玩性低，景色一般，,/Date(1605095680000+0800)/,0
26482562,挺好的，慢慢欣赏2-3小时,/Date(1571726486000+0800)/,0
21621497,很不错，历史遗址和人文景观相结合，值得一去的网红打卡地，涉及很巧妙,/Date(1568377731000+0800)/,0
48726491,网上购买成人票，只要刷身份证就可以进入，非常方便的哦，不过里面不可以带有颜色饮料哦，放外面的寄存箱里，矿泉水可以我家小朋友1米4不到，还免费参观呢,/Date(1566575844000+0800)/,0
231032358,一开始觉得票价贵，进去觉得还是值得的。艺术设计的新颖别致，能够传达精神。也是网红打卡很好的选择，拍照好地方,/Date(1566559822000+0800)/,0
220095434,比较现在化的寺庙，还挺不错的，逛了两个小时，拍了很多美美的照片哈哈,/Date(1566467983000+0800)/,0
72866399,第三次来南京，第一次走近大报恩寺，感受这座历史悠久的古代寺庙，“遗址奇观、报恩圣地”，受益匪浅，不虚此行！,/Date(1564198614000+0800)/,0
64870154,气势澎湃、精雕细刻让人不虚此行。就是停车太费时间了。夜景让人迷醉！,/Date(1560849913000+0800)/,0
3209156,很有意思的遗址保护方式，很现代，又不失气氛烘托，南京行的意外收获！,/Date(1560088059000+0800)/,0
3978718,这是一个反映南京佛教文化的遗址公园，有新建的大报恩寺、佛骨舍利，还有考察发掘的遗址、历史介绍、文物和文化展览，再现了南朝四百八十寺盛世时期佛教建筑的辉煌，值得去看看。,/Date(1535002742000+0800)/,1
8656335,了解金陵六朝古都历史的好地方，值得细细品味。,/Date(1580383481000+0800)/,1
39900485,方便购买，使用简便，直接扫码入场，快捷方便，方便快捷，值得推荐。,/Date(1567948047000+0800)/,0
110781489,真的好好玩，小朋友学到很多书本上学不到的知识，寓教于乐，很好的选择。下次还要带着老人和小孩过来再玩一趟。,/Date(1566183434000+0800)/,0
490640,很多文物虽是仿制品，但是很值得学习，尤其是各种出土阿育王塔的集合，以及保持原样的遗址近距离接触。祈福地宫的地方看不到地宫的。但是，整体场景很棒！,/Date(1565663062000+0800)/,0
5979995,类似于博物馆，里面运用现代光电科技展示历史，效果比较好。里面还有讲座。值得好好看看、听听，是很好的历史教育和了解佛教的地方。,/Date(1565144251000+0800)/,1
230220722,今天参观了大报恩寺，被里面宏观的景象所深深的吸引，绝对值得一游！,/Date(1564754718000+0800)/,0
41664596,9年前来的时候，还是一片废墟，如今成为很宏大的一座遗址博物馆了。有许多报恩寺文物和建筑构件，展厅规划也模拟了当年的建筑格局。宝塔可以逐级攀登也可以坐电梯到顶楼，俯瞰整个南京市区的南部。,/Date(1499230795000+0800)/,0
90666474,安静的地方，感受佛文化,/Date(1589534489000+0800)/,0
170358945,文化气息很浓厚，游览内容很丰富，场景布置很巧妙，很不错的体验。,/Date(1588427851000+0800)/,0
77137760,大报恩寺遗址公园有很多讲究，想要了解历史的故事，来这里就对了。,/Date(1584275845000+0800)/,0
9200872,在旧址上重建的，一般般,/Date(1572170410000+0800)/,0
36092195,超级美，超级美，超级美，超级美，超级美，超级美，超级美，超级美,/Date(1570345324000+0800)/,0
238758538,文化底蕴比较丰富，对历史知识有一定的加深，挺好的！千年地宫很美，美轮美奂，绚烂多彩！很值得一看！我们还爬上了塔顶，站在塔顶可以俯瞰整个南京城！,/Date(1566743330000+0800)/,0
237737122,千年古寺的遗址，里面灯光秀很棒，一进门左手边有个汉服体验馆，建议不赶时间的妹子可以尝试一下，衣服很干净,/Date(1566053711000+0800)/,0
1659145,挺好的，建议有时间可以去看看，就是停车场关门，时间紧，看到好多车停在车场外面，我们就也停了，出来较迟，被罚款，希望停车场指示明确，而且能开放。,/Date(1563867779000+0800)/,0
228953693,里面很漂亮的，很多人在里面拍照片。就算不拍照去看看也是很有必要的。登塔远眺可以看到南京城墙。值得去看。,/Date(1561424847000+0800)/,0
211041331,大人老人小孩都适合的景点，一点也不沉闷，古典结合高科技，让人收到很大的视觉冲击，感触也很深，景区活动很多，体验性强。真的是超值，可以穿汉服去拍照哦，也可以现场租。,/Date(1557028078000+0800)/,1
8656828,网上购票比门口方便&amp;便宜。刷二维码或者身份证都可以。&#x0A;打车去的，路况还行。地铁&#x2F;公交可能还有一段距离要走。&#x0A;场馆有点新，2015年12月才开放。至今不超过5年。&#x0A;想法比较新，为了各年龄层都能够找到乐趣，有不少新奇的点。&#x0A;大报恩寺前身是东吴赤乌年间（238─250年）建造的建初寺及阿育王塔，是继洛阳白马寺之后中国的第二座寺庙，也是中国南方建立的第一座佛寺，中国的佛教中心，与灵谷寺、天界寺并称为金陵三大寺，下辖百寺。&#x0A;杜牧说的“南朝四百八十寺”，起源就是大报恩寺。&#x0A;寺塔屡建屡毁，大报恩寺的修造，由郑和等人担任监工官。最终毁于太平天国。&#x0A;2004年起开始复建，2008年出土七宝阿育王塔和佛顶舍利。,/Date(1572089255000+0800)/,1
1513011,公园很有特色，据说是巨资修建的，与传统的遗址公园相比很有特色。&#x0A;建议租个讲解器，边走边听还是有点收获的。&#x0A;景区离老门东很近，步行可达，可一起刷～,/Date(1571923909000+0800)/,0
533920,现代和历史的结合，光影技术的优秀呈现，非常不错。令人惊喜的是，单独开辟了一块儿童娱乐区，有滑梯，秋千，沙堡，小朋友挺喜欢,/Date(1570927970000+0800)/,1
13128316,很好了解历史，很新很现代化，值得去看看，地方不算很大，很舒服,/Date(1567168662000+0800)/,0
38394004,收获了很多知识和快乐！据说这是我们国家当年第二大寺庙，占地面积好几十万平方公里呢！很喜欢！细节完美！,/Date(1566530628000+0800)/,0
111766,今夕何夕。。千年对望。。六朝古都及大报恩寺与佛之不解之缘。。遗址之上建造博物馆设计创意极具科技感！！,/Date(1560096424000+0800)/,0
10598951,总的来说还是不错的，有点艺术馆，博物馆和遗址结合的感觉，新建的建筑所以很多科技感的东西，很多位置都特别适合拍照，很多网红小姐姐。就是太有现代感了，少了一些佛家的庄严，和报恩寺的威严宏伟感觉少了一点，还是在南京很值得一去的地方,/Date(1559977529000+0800)/,1
30743165,想来很久了&#x20;终于来了今天&#x20;地方很大&#x20;玩得很开心&#x20;几个网红点拍照人太多了&#x20;幸好我喜欢的许愿长廊还好哈哈哈哈&#x20;也登塔了&#x20;最上面那层封闭了&#x20;不怎么透气&#x20;很快就下来了&#x20;每一层的菩萨不一样&#x20;地藏菩萨回家整理照片才发现&#x20;手里的宝珠怎么没了要是天气好&#x20;观赏的感觉会更好&#x20;可以看到中华门城堡和老门东那边&#x20;很是不错,/Date(1555753929000+0800)/,3
18437859,大报恩寺位于南京市秦淮区中华门外，是中国历史上最为悠久的佛教寺庙，其前身是东吴赤乌年间（238─250年）建造的建初寺及阿育王塔，是继洛阳白马寺之后中国的第二座寺庙，也是中国南方建立的第一座佛寺，中国的佛教中心，与灵谷寺、天界寺并称为金陵三大寺，下辖百寺。,/Date(1513603811000+0800)/,3
50668777,家门口的大报恩寺，说多了都是泪，进去了时候觉得原的太宏伟了，原来这里都是居民楼，现在是遗址公园，这一切就感觉昨天没发生一样，我为中华门自豪！,/Date(1489031059000+0800)/,2
200840035,不值这个价格，还不如去牛首山。看完牛首山，这个就是蚂蚁一样,/Date(1608980952000+0800)/,0
246981502,去年十月份的时候去过一次，门票有点贵，里面的东西一般般吧。,/Date(1581045002000+0800)/,0
41487108,塔里面没有什么看的，四周的景点&#x20;灯光&#x20;还是很不错，可以去看一下,/Date(1567160917000+0800)/,0
235310372,挺不错的，因为天气炎热，外景没有多参观，但是室内还是不错的,/Date(1564400609000+0800)/,0
181740517,可以说是非常好玩了&#x20;塔不错&#x20;舍利看不到&#x20;就是有一些过于现代化&#x20;没有故乡古色的感觉&#x20;还是可以吧&#x20;如果有空可以来玩,/Date(1560753844000+0800)/,0
31517585,遗址不要报很高希望，就是一个大公园，慢慢逛就当休息放松了,/Date(1591586777000+0800)/,0
1940373,很想再去一趟，等疫情过去后再去一趟，里面的东西都很漂亮的,/Date(1588170385000+0800)/,0
249449291,天气不适宜飞行的时候，可以先到酒店办理入住了，晚上如果只想在酒店休闲的，五星酒店一般都有自助餐，环境都是临湖的，一边看夕阳，一边吃美食！,/Date(1586512108000+0800)/,0
51880149,一般般&#x20;一般般&#x20;一般般&#x20;一般般&#x20;一般般&#x20;一般般&#x20;一般般&#x20;一般般&#x20;一般般&#x20;一般般&#x20;一般般&#x20;一般般&#x20;一般般&#x20;一般般&#x20;一般般&#x20;一般般,/Date(1571318818000+0800)/,0
80578803,很方便，直接刷身份证，可惜天气原因没上塔，里面拍照很美很美哦！！！！！！！！！！！！！！！！！！！！！！！！！！！！,/Date(1571034359000+0800)/,1
3798156,视觉享受，了解历史和佛教文化，一个夏天避暑旅游的极佳选择,/Date(1566822650000+0800)/,0
60979232,值得一游，202直达，就是儿童票需要去游客中心取票，不能直接刷2维码，比较麻烦，其他都很不错，出来后可安排去老门东走路大概10分钟左右！,/Date(1566642702000+0800)/,0
149193375,挺好的！！！！！！！！！！！！！！！！！！！！！！！！！！！！！！！！得好好，非常好！！！！！！！！！！！！！！！！！！！！！！！！！！,/Date(1566120102000+0800)/,0
27974189,历史丰富，佛教意义重大。演出集声，光，电遥控等现代科技手段一体，故事生动，有新意。值得一看。讲解员声音很柔美，讲解细致。主题餐厅也很好。,/Date(1495975862000+0800)/,4
1288630,算是南京的新景点，陪朋友一起去，又咬牙花了几十块大洋的门票进去了一下。虽然修的富丽堂皇，里面也的确是值得一看，但是还是觉得门票贵了一些。,/Date(1477319002000+0800)/,6
80394505,整体不错，值得去一次。特别是带孩子，应该去看一看，很有意义的！南京旅游景点各种设施，包括指路标志，很完备，卫生间也比较干净，确实不错！,/Date(1579592664000+0800)/,0
250052458,很适合和家人、朋友一起来参观游览。地铁中华门站下车后有公交可到达，选择步行的话，十来分钟即可到达景区。网上购票直接刷二维码，不用取票。,/Date(1574915917000+0800)/,0
167106258,票价略贵，没有觉得受到视觉冲击等。可能自己不是佛系人吧,/Date(1572159172000+0800)/,0
183107451,里面很壮观，尤其是信佛的人，建议你们来看，馆藏精品，灯光，科技，还能学到好多知识，历史渊源很深，不虚此行，就是门票稍贵些75元有点贵。,/Date(1565502335000+0800)/,0
70267038,大报恩寺遗址，中华门，外秦淮河，联票还是很划算的，景点也离的跟进，行程安排很合理，只是感觉外秦淮河，白天景色确实一般，没有内秦淮河景色好看，总体还是很值得,/Date(1556587975000+0800)/,1
4299095,一个现代化景区&#x20;搞得相当不错&#x20;规划和设施都设计得很是不错的地方。大报恩寺源于宋代的长干寺，但是后来改成千禧寺，明初毁于火灾，明成祖重建。,/Date(1589705978000+0800)/,0
263947915,可以去看看，不过我是晚上去的，晚上塔不开，不能上塔。,/Date(1588892595000+0800)/,0
95760831,汇集现代科技，文物遗址，人文历史，特色餐饮的博物馆。,/Date(1585471446000+0800)/,0
13254810,很美的地方，兼具观赏与文化的公园,/Date(1578565851000+0800)/,1
120869753,环境优美，值得去一游，尤其是地宫里面很有看头，想要去的可以去看看！公园里有各种各样的雨花石很精美，有的简直就是无法形容让人流连忘返！,/Date(1573233008000+0800)/,0
62919892,很大很有收获！报恩塔爬到一半没劲了很可惜，电梯难等！,/Date(1566611110000+0800)/,0
118430980,挺值得游览的景点，交通方便，喜欢历史人文的可以去看看,/Date(1563768431000+0800)/,0
205979606,文化底蕴非常浓厚，时代更迭，他依然在哪里。远古的脚步到了现在的时光。古废墟的黄土破砖与现代的钢筋玻璃相互冲突却又相互包容，非常震撼。,/Date(1560605606000+0800)/,0
109215444,展厅布置得很具设计感，肃穆而不拘谨。玻璃地板设计为游客显示了发掘后的样貌。阿育王塔灿烂夺目值得一看。塔区，地宫显示布置得很好，但塔就在外面看看吧，没有登的必要，塔上没看的。,/Date(1497333768000+0800)/,0
372984,设计感尚可，现代感太重，经不起时间～，对不起票价。,/Date(1594706412000+0800)/,0
12742111,大报恩寺，近几年新建，公园面积不大，离中华门很近。,/Date(1587554394000+0800)/,0
4730936,通过携程预订，随买随用，未使用还可以随时退，非常方便快捷，价格也非常实惠，性价比非常高，以后会继续使用携程预订，也会推荐给朋友们。,/Date(1574692926000+0800)/,0
92442571,塔及展品多为复制品，不过还可以感受一下当年的气势。几个展馆现代科技一些，里面还有电影院和小吃。去拍照的好去处。,/Date(1571100302000+0800)/,1
93401592,大报恩寺遗址公园重新开放，一座玻璃与钢结构结合的新塔，在塔基上重新修建起来。&#x0A;历史遗迹的再现，重新唤起了人们对这座琉璃塔的久远记忆。,/Date(1561713001000+0800)/,0
78707402,很不错，很多文物可以看也有很多的文字介绍所以能学到很多东西！而且也用了很多高科技手段让参观者能更好的感受个中的文化！建议可以用3到4小时慢慢参观游览！,/Date(1558374354000+0800)/,1
2837563,大报恩寺是中国的佛教中心。与灵谷寺，天界寺并列为金陵三大寺。大报恩寺位于南京秦淮区中华门外。是为了纪念朱元璋和马皇后而建的。大报恩寺的琉璃宝塔有78米多，是建筑界的奇迹。,/Date(1507344114000+0800)/,2
72766820,性价比较低，在南京这样的城市门票90元比较贵了…,/Date(1594172769000+0800)/,0
35064924,大报恩寺的故事也是很多的，也是我喜欢来转转的地方,/Date(1582556904000+0800)/,0
3548097,大报恩寺在老门东附近，前几年发现了舍利后新建的。,/Date(1581918789000+0800)/,0
7491844,元宵看灯，大报恩寺是大明第一寺，现在复建了。也没什么特别的，只是总要来的一个地方。中华门城墙外，离老门东不远，可以一起溜达溜达。,/Date(1579020740000+0800)/,0
16704173,南京第一站就是大报恩寺，玄奘法师和佛祖面对面对话挺震撼的。登塔可以远眺整个南京城，离得最近的是明城墙，再过去就是网红景点老门东。,/Date(1572946395000+0800)/,0
4182690,一定要听讲解，否则很多历史知识不了解也就看不明白,/Date(1570874607000+0800)/,0
22558296,炎炎夏日，这是个好地方，去之前以为要晒太阳结果进去以后全在室内，，除一些玻璃里的古迹，其于的全是以现代化的方式进行展示，值得一去,/Date(1568296356000+0800)/,0
175675747,很漂亮的景点啊，就是要走不少路，真的很值得来打卡一次，现代化的灯光配上古代的文物，好美！欢迎大家都来打卡，毕竟是一场视觉盛宴……,/Date(1557563953000+0800)/,2
152781086,中午12点多开完会了&#x20;下午要赶高铁5点多的&#x20;&#x20;觉得附近只有这个地方还不错&#x20;就带这一家老小去转一圈&#x20;总体还是不错&#x20;&#x20;超级震撼&#x20;&#x20;主寺还可以坐电梯直达上边&#x20;对老人来说太好了&#x20;&#x20;整体转下来两个多小时&#x20;,/Date(1509953829000+0800)/,0
1847499,奢华有内涵。门票60&#x20;我感觉挺好的，因为是遗址，奢华的建了个历史展顺着走，能了解到很多历史。淡季登塔只能走楼梯，电梯没开。一共10层楼高。去的时候没有人，登到顶有点瘆人。,/Date(1486481530000+0800)/,2
25250721,不是遗迹，没有公园的景色，也没有博物馆的藏品。,/Date(1599351379000+0800)/,0
4009712,真是不错的好地方，值得一去游览！很赞很有故事！,/Date(1585436462000+0800)/,0
2623505,去年秋天的时候去的，票价有点贵，其实一般般吧。,/Date(1582329959000+0800)/,0
30481388,网红打卡地点，里面可以穿汉服拍照，里面很大，分为很多个区，可以个家人朋友一起来玩一玩。登上园区里塔可以看到南京古城墙的庄丽景观,/Date(1572921587000+0800)/,0
68490024,带老人小孩去的，里面很大，逛的时间比较久，里面的建筑也很有特色，而且从一楼一层层的爬到塔上面顶层没有做电梯，小孩老人一起锻炼。,/Date(1571016224000+0800)/,0
7662802,值得一看，还是不错的，跟老婆孩子去的，适合拍照，算是一个网红打卡地吧，是佛文化旅游景点，个人觉得跟牛首山差不多，没去的值得一去,/Date(1570857345000+0800)/,0
11933159,大报恩寺塔“九级内外，篝灯一百四十有六”，“—日夜费油六十四斤四两零”，使之“昼夜长明”来看，大报恩寺设钟不设鼓当有一定寓意。,/Date(1567207328000+0800)/,0
94144056,太震撼了，就是票价太贵了！里面的佛教陈列，太好了！尤其是阿育王塔和感应舍利太牛了，我个人觉得大报恩寺塔爬上去需要点体力，可以一览南京城，中华门瓮城，秦淮河，很好看的！,/Date(1542632671000+0800)/,0
19760778,怀着一颗感恩的心去，接受洗礼。最爱那个生肖馆,/Date(1584801247000+0800)/,0
3476076,建设的非常好，里面很漂亮，登高望远景色很美。,/Date(1575803432000+0800)/,0
152899459,本以为寺庙都是烧香拜佛的地方，可是大报恩寺的设计让人眼前一亮，非常的现代化，很多炫酷的场景，也很有宗教文化氛围，很值得一去!,/Date(1563181358000+0800)/,0
42929436,里面有些国宝级的宝物，没事去看看也挺好的！,/Date(1586325074000+0800)/,0
1312459,网红景点，人不多，体验感很好。最好能蹭导游，不然看的不是很明白。景区还是蛮大的，整个参观下来要2个小时左右。总体感觉很值！,/Date(1576835997000+0800)/,0
233980064,很大很广&#x20;室内空调简直救命&#x20;有几处绝美灯光&#x20;比较粗略的打卡逛了大概一个半小时&#x20;还好今天不算很多人&#x20;总体来说比较文艺的朋友可以来逛一逛,/Date(1564380185000+0800)/,0
70802999,买票很方面，下单后刷二维码直接入园就可以了,/Date(1561970395000+0800)/,0
21761965,景色一般，里边有些还可以，不过性价比一般,/Date(1616914567000+0800)/,0
59301436,体验不佳，性价比低，景色一般，可玩性低，,/Date(1597508920000+0800)/,0
19172147,体验不佳，可玩性低，性价比低，景色一般，,/Date(1595908937000+0800)/,0
8656335,有历史的的地方，见证六朝古都的沧海桑田。,/Date(1588563353000+0800)/,0
249449291,"如今,大报恩寺的原身建初寺再度扩建，大报恩塔重新落成，长干寺地宫奉舍利供众生瞻仰，千年佛光又一次闪耀在世人面前。来玩吧。",/Date(1587351085000+0800)/,0
75213609,非常好玩，东西很不错。优秀的景点，大家可以去看看，绝对不会后悔。冲啊**************************,/Date(1575885874000+0800)/,0
9260625,不错，值得一看哦&#x0A;里面有不少可以仔细观摩的物件，不过感觉现代科技气息过于浓厚了&#x0A;地址就在中华门外，登上塔顶可以鸟瞰整个城市。,/Date(1574759877000+0800)/,0
219668959,环境非常幽静，佛寺里面的塔很高，爬上去还是需要时间体力的，里面的纪念品很好看，忍不住买了好多，去的时候淡季，玩的非常愉快,/Date(1574565802000+0800)/,0
155079983,在携程订票很方便，便宜了一些，但里面可玩的地方不多，感觉拍出来的图片好看，自己去看看也就一般吧，人也不多，东西很多不是真品，最恢宏的塔也是后期的，可能晚上有灯光会好看一些，适合穿汉服拍照吧，带孩子去看看也不错,/Date(1573741519000+0800)/,0
