49016084,1.这个博物馆虽然不以藏品见长，但是整体建筑由著名建筑学家、两院院士吴良镛担纲设计建造，所追求的正是江宁织造府或者说是红楼梦中大观园的意境，也算是一个园林艺术佳作；&#x0A;2.说实话，喜欢红楼梦的朋友都应该来看看，有专门两个展厅是关于红楼梦的，此外有两个展厅关于江宁织造府，还有一个关于旗袍的展览；&#x0A;3.这个博物馆作为南京市博物馆的一个分馆，是收费的，涨价后成人30元。,/Date(1511617564000+0800)/,2
65837321,大行宫地铁站出来即可去江宁织造博物馆，曹雪芹家曾在江宁织造府任职，所以在设计上融入了很多红楼梦的元素，在中庭制造了一个微观的大观园。展览中既有传统的云锦的巧夺天工的技法，也有民国旗袍精美妩媚的剪裁设计。展厅很多地方都用暖黄的灯光和丝状的材料营造出千丝万缕的感觉。,/Date(1507386995000+0800)/,2
1652598,江宁织造博物馆位于南京大行宫地区，是在江宁织造旧址上建造的一座现代博物馆，由著名建筑学家、两院院士吴良镛先生担纲设计。&#x0A;博物馆占地面积1.87万平方米，建筑面积3.7万平方米。建筑整体风格是取中国山水画中深远、高远、平远之意境，将北高南低的建筑群尽可能用园林手法加以覆盖。建筑内复建了织造署中原有的西池、楝亭、萱瑞堂、西堂等建筑，从南望北叠叠高起，如同一幅江南山水画，是现代建筑的语言和传统园林建筑结合的经典之作。&#x0A;2013年5月1日南京江宁织造博物馆正式对外开放，是展示《红楼梦》历史和文化的新型博物馆。,/Date(1491965582000+0800)/,6
77589552,大美之地，本来不知道有这个地方，无意间发现，惊艳!票价2O，进去先在红楼梦馆内看了一会86版的红楼梦，看了一下鸡的各种表现形色，画，雕，玉，窗花……非常棒，了解一下织造的历史和古老的藏品，非常漂亮。二楼的旗袍馆把旗袍的历史一一介绍，美极了!,/Date(1487596040000+0800)/,2
3908954,江宁织造府，位于如今南京的市中心大行宫地区，地铁2、3号线大行宫站2号口出来就是，交通很方便。&#x0A;门票20元&#x2F;人，公园年卡可用。&#x0A;藏品一般，比起其他博物馆，可看性略逊。&#x0A;清朝康熙皇帝6次下江南，有5次就住在江宁织造府内。这里的地名大行宫的称呼即由于康熙和乾隆两个皇帝在此住过而得名。据史料记载，曹雪芹于康熙50年公元1711年就诞生在江宁织造府内。计划重建的江宁织造府，将恢复江宁织造府原貌，内设曹雪芹诞生处、曹雪芹故居陈列馆和现场织造南京云锦博物馆，专门研究文学巨著《红楼梦》的红楼梦文学馆也将设在其中。&#x0A;2009年重建江宁织造府完工。被定名为江宁织造博物馆。&#x0A;江宁织造府为《红楼梦》作者曹雪芹之曾祖父（曹玺）、祖父（曹寅）、父辈（曹頫、曹颙）三代袭官居住地。康熙二年，曹雪芹的曾祖父曹玺被康熙从北京派遣到南京任江宁织造，以后历经祖父、伯父、父辈，先后达65年。曹雪芹曾在此生活了17年。织造府始建在清初江宁府上元县地界（即今大行宫一带），康熙南巡时，以织造府为行宫，后乾隆游江南又经粉饰，正式作为行宫，到同治年间命名为大行宫。其西花园原有楝亭一座，作曹家聚会文人学士的重要场所。《红楼梦》中的大观园以此为原型。&#x0A;红楼梦图书馆&#x0A;南京市文广新局的专家们从海内外征集文物。三大块内容不变：江宁织造衙署、《红楼梦》、云锦。《红楼梦》是一部文学作品，未来，江宁织造博物馆会有《红楼梦》的相关信息，会有多个版本的《红楼梦》，同时会成立“小红楼图书馆”，市民可以在图书馆里查阅《红楼梦》的资料。&#x0A;康熙南巡图&#x0A;从海外征集到了几批文物，有清代的龙袍，有民国的旗袍等等。尤其是云锦织造的龙袍，绝大多数是从海外回流的。江宁织造博物馆将以图片、实物一起构成展出内容，展示有元、明、清三代和唐代云锦。&#x0A;博物馆还将再现江宁织造的历史，这次《康熙南巡图》也将会展出，它将是数字动态版的，效果可比上海世博会上的《清明上河图》。&#x0A;旗袍展示&#x0A;征集到的云锦有100多件，而民国的旗袍有好几百件。江宁织造博物馆开馆后，将定期展出旗袍，同时，还将成立时尚发布中心。&#x0A;同时按照织造的线，搞了中国旗袍展，从清代到民国，旗袍被视为华人女星的国服。专家已经在和台湾一些收藏家洽谈征集事宜，还征集了南京收藏家手中的一批旗袍。&#x0A;时装发布舞台&#x0A;江宁织造博物馆正在修建一个中国一流的时装发布T台，未来这里将成为时装发布、时尚走秀的舞台。,/Date(1470714697000+0800)/,12
7849816,离市中心新街口非常近，从新街口步行首先看到的就是江宁织造博物馆，气势磅礴，喜欢红学的更要来感受织造府的气息，进大门的右手边便是江宁织造的介绍，来龙去脉非常一目了然，一楼可以看到很多雕刻精细的作品，二楼是南京民国服饰、街道展示，负一楼是古代织造全解，值得一游……,/Date(1450545004000+0800)/,2
100295944,很小的博物馆&#x20;走得太累了&#x20;红学部分值得一看,/Date(1600093086000+0800)/,0
13427459,江南丝绸，苏绣以及传统的纺织方法独具魅力，供应清皇室使用的珍品的确精湛，但是到这参观的却是外国人居多，似乎他们更欣赏中国的传统文化。还是应该推荐广大的游客朋友，祖国传统文化需要继承，发展和创新。,/Date(1561954029000+0800)/,0
44623516,里面不算是很大&#x20;但是小院儿&#x20;景色很漂亮&#x20;错落有致&#x20;里面有旗袍馆&#x20;里面的旗袍都很漂亮&#x20;。还有一个云锦馆，云锦真的非常非常的迷人，非常漂亮，里面还有一个红楼梦馆，介绍的&#x20;曹雪芹书写红楼梦&#x20;的场景,/Date(1510644569000+0800)/,3
225026115,随时买票随时进，里面有一个很好的小园子，人不多，可以安安静静慢慢的浏览。,/Date(1568179176000+0800)/,0
97904953,展品太少了，博物馆本身建得不错,/Date(1608118858000+0800)/,0
64031957,新景点，有特色的园林建筑，设计大师的构想别具匠心，美中不足的是无法避免的周围高楼，施工草率（节约成本？）的太水泥化的假山。有幸是博物馆内容的丰富，形式新颖多样，弥补了不足,/Date(1487822785000+0800)/,3
64533553,还不错吧，就是十一人太多了。,/Date(1601882503000+0800)/,0
13841926,本来是去总统府后顺便去的，但之后发现很值得，长了不少见识，值得推荐。,/Date(1564925119000+0800)/,0
276240731,这是一个设计非常美的博物馆,/Date(1605010274000+0800)/,0
50630179,江宁织造本不在本次行程计划中，但是离总统府特别近，时间富裕，就来了，没想到令人眼前一亮，博物馆展厅内环境优美，展厅外园林也设计精巧，颇具江南园林风韵，出人意料的好，而且人不多，适合拍照！,/Date(1563506777000+0800)/,0
19032631,如果你喜欢丝绸，这里可以去看看；&#x0A;如果你喜欢建筑，这里一定要看看；&#x0A;如果你喜欢历史，这里一定得看看；&#x0A;如果你喜欢南京，这里必须要看看；&#x0A;如果你喜欢风景，这里必须要看看,/Date(1505556374000+0800)/,3
149826333,感觉还行吧，手工纺织不错,/Date(1604997384000+0800)/,0
23657052,介绍曹公和红楼梦很详细～,/Date(1595071675000+0800)/,0
21201052,还不错，整体上就是大观园的建筑风格的缩影，能够了解一些历史知识，面积不是很大，建筑设计错落有致，是把原来东南角的江宁织造总局搬迁总建，最大限度保留了原建筑的一砖一瓦,/Date(1518530836000+0800)/,3
266734993,挺好找的，离总统府不远,/Date(1604410035000+0800)/,0
161574,博物馆就是一个一眼可以看到头的小花园，没什么景致。就是地下一层的红楼梦馆还值回点票价。特地来就不必了。,/Date(1596807687000+0800)/,0
2116795,总的来说，蛮不错的～,/Date(1616943154000+0800)/,0
1579080,景色不错，有趣好玩，,/Date(1609386721000+0800)/,0
43862296,展品不多，性价比还行,/Date(1604844553000+0800)/,0
57591003,景色不错，性价比高，,/Date(1604819925000+0800)/,0
52456353,江宁织造博物馆，距离总统府和南图很近，主要描述南京云锦和曹雪芹的家族兴衰。内有红楼影院在播放红楼梦，挺有感觉的地方。看云锦的演变还是很佩服古代人的智慧与勤劳。最后楼上有个旗袍收藏管好像没有啥意思，电子试衣也不是很灵便。现在去的人并不多。,/Date(1480508160000+0800)/,5
4936365,江宁织造博物馆，建于清代江宁织造署遗址上，是以江宁织造和红楼梦为主题的专题博物馆。&#x20;博物馆设江宁织造、云锦天衣、红楼梦曲、中国旗袍四个展览。,/Date(1565757751000+0800)/,0
24347880,与总统府临街相隔，博物馆与园林融合的城市中心别致景色。,/Date(1573132426000+0800)/,0
6818547,选择周末的时间来的，整体感觉不错，游客不是很多，周末的时间去也不会拥挤！可以不紧不慢的好好参观，感受历史的变迁。园内景色也很美，春天来的话一定是满园春色!,/Date(1506175798000+0800)/,7
986338,有很多高科技设施，展现了江宁织造的历史和红楼梦，喜欢的人可以逛蛮久的,/Date(1588573979000+0800)/,1
110056662,门票便宜，参观环境很好，空调舒服，展馆很大，值得一看。最可恨的是最后一个卖衣服的地方，*眼看人低，态度恶劣，素质低下，实在影响心情，本来准备投诉她们的，饶她们一命算了,/Date(1566919295000+0800)/,0
3840538,欣赏了下午场的越剧、昆曲表演，很有江南味道，第一次近距离看剧，幸而旁边有字幕，理解起来就不费劲了，另有苏绣表演，叹为观止！,/Date(1570098332000+0800)/,0
4841881,这个点是和总统府套票一起的，顺路游玩，就在总统府斜对面，很有江宁织造府的感觉，在现代博物馆建筑的上方创造性的建起仿古的江宁织造府，不愧是建筑大师的手笔。值得一游。,/Date(1459777764000+0800)/,4
3389315,江宁织造博物馆在南京市大行宫（长江路123号）、原江宁织造署旧址，这里曾经是曹雪芹的家，康熙、乾隆下江南曾住过这里。建筑风格北高南低，具有江南园林特色；2013年对外开放。里面有元明清历代云锦、织品的展览，还有红楼梦相关历史和文化的展览。现场有织锦技艺表演，南京云锦是世界非物质文化遗产，十分珍贵。门票30元。地铁3#线、2#线大行宫站2#出口可达。,/Date(1547262147000+0800)/,0
110512049,南京最值得去的红楼文化景区，就是江宁织造博物馆（&#x20;&#x20;学生票门票15元，成人票30元）。乌龙潭公园的曹雪芹纪念馆不常开，中山陵景区内的红楼艺文苑红楼元素太少。&#x0A;&#x20;&#x20;&#x20;&#x20;&#x20;&#x20;江宁织造博物馆是吴良镛先生在江宁织造旧址上建造的一座现代博物馆。吴先生以“核桃模式”和“盆景模式”的设计理念，使古典园林与现代建筑相结合，&#x20;以山水格局形成园林的总体骨架，以绿水环绕湖心岛隐喻白鹭洲，并配以西园、随园等园林建筑。&#x20;&#x20;&#x0A;&#x20;&#x20;&#x20;&#x20;&#x20;在江宁博物馆里，我们不仅能够深度了解了曹雪芹的身世背景，&#x20;各种文献复制品也能够让我们了解红楼梦的不同版本&#x20;。还可以看到江宁织造所辖之江宁织造局的具有历史意义的生产活动——云锦的生产历史。到江宁织造看云锦旗袍真的很享受!&#x0A;&#x20;&#x20;&#x20;&#x20;不过江宁织造博物馆里本来是有一家脂砚斋茶馆，但是在我们去的那天已经关门了。,/Date(1535282544000+0800)/,0
2352641,非常推荐去的地方，特别是对《红楼梦》有兴趣的可以全面地了解曹雪芹的生平，《红楼梦》的故事更概里面还有全息电影可以看，内院是一个亭台楼阁，里面的风景特别的别致，外面看是现代建筑，里面是古代亭台楼阁，感觉别有洞天的样子，感觉很值,/Date(1534077588000+0800)/,0
39879365,原址复建的江宁织造府也就是曾经的大行宫，现在已经被改建为江宁织造博物馆了。其中的园林虽小，却借用了大观园的理念，展品围绕织造这一支撑起江南的支柱产业以及江宁织造这个职位上相关家族的命运。特别开辟的红楼梦馆，影厅里循环放映景点的老版《红楼梦》，三层还有个旗袍展。巨大的纺织机最吸引人。复杂的工艺，诞生了转为达官贵族享用的云锦。,/Date(1525830112000+0800)/,0
8681608,我是5月18号去的，正好是世界博物馆日，免费，平时门票20元，但是这20元绝对是花的值，很好看，个人感觉比六朝博物馆更有意思。里面除了可以看到云锦，旗袍，曹雪芹的生平以及红楼梦的研究，还有个小剧场放一些相关的电影，那天去的时候正好有安徒生童话百年展，原来安徒生不仅擅长写故事，还酷爱旅行，并爱剪纸，且他的剪纸技术也达到了一定的水平。整体分负一层，一层和二层，另外进去还有个园林，里面有红楼茶馆等等，有假山，有小桥流水，建筑很有特色，很适合拍照哦。,/Date(1432975934000+0800)/,0
265207864,云锦龙袍，旗袍，织造云锦的工艺现场展示，红楼电影院，是不可多得的一个重要内容。,/Date(1590074078000+0800)/,0
13459988,馆比较小。但是喜欢红楼梦的朋友不可错过,/Date(1572973754000+0800)/,0
121264884,总体布局不错，古典园林与地铁站上的现代建筑融为一体。斜对面的那栋建筑就是。,/Date(1588146473000+0800)/,0
76722513,非常值得一看，了解历史发展文化传承。希望大家都可以关注,/Date(1587720642000+0800)/,1
193684331,性价比非常高，展馆分好几部分，内容精彩丰富，还有园林假山，可以慢慢欣赏😊,/Date(1585865147000+0800)/,0
12255967,优惠不多，即买即用还是比较不错的,/Date(1564385564000+0800)/,0
52904351,携程和江宁织造博物馆都是不错的&#x0A;期待下次再去江宁织造博物馆，看看红楼文化,/Date(1577183472000+0800)/,0
2946619,人不多，大概一个半小时能逛完。,/Date(1562381519000+0800)/,0
59099910,很好的地方&#x20;人超少&#x20;去总统府时买的联票&#x20;以为在总统府里&#x20;后来发现不是&#x20;但离总统府很近&#x20;主要介绍了清朝年间江宁织造&#x20;少不了曹雪芹和红楼梦&#x20;里面环境优雅&#x20;喜欢红楼梦的会喜欢,/Date(1468752293000+0800)/,2
164281527,很不错的好地方。孩子下学期学校主要学习四大名著之红楼梦，里面的红楼梦馆很好，真好，满足了我们的学习梦想，发给了老师，觉得特别好。,/Date(1519010475000+0800)/,3
220889514,总体来说还可以，25块买张门票进去参观下，主要还是看曹雪芹那段故事,/Date(1588646400000+0800)/,0
5253796,网上买票方便快捷，但还是要取纸质票；馆内游客少，可以安静地慢慢看，了解到云锦的历史和工艺发展过程；有红楼梦系列研究展示，红迷们看得更加有滋有味吧。,/Date(1574155316000+0800)/,0
32956180,有了总统府糟糕观感，对比起来，织造博物馆简直太好了，人不算多，还有微信讲解，参观非常方便，园林设计也美。,/Date(1568646278000+0800)/,0
112921864,挺美，环境优美，有点看头，就是周一闭馆，算好时间，旗袍很有特点。可以试一试玩一下，雨天有特色，值得去玩,/Date(1562126286000+0800)/,0
222477291,建设设计很有特色，最喜欢里面的红楼馆和云锦馆。云锦太漂亮了，不愧是我国的瑰宝级非物质文化遗产，其中的部分工艺依然是现代科技所不能取代的，充分体现了中华民族的智慧。值得一看，细细体味!,/Date(1556712489000+0800)/,0
53839125,对于江宁织造博物馆印象最深刻的是红楼梦展区&#x20;个人对红楼梦颇有兴趣&#x20;很喜欢红学&#x20;所以当看到红楼梦展区的时候激动万分&#x20;&#x20;有志同道合的朋友不妨去看一看&#x20;绝不后悔,/Date(1495998808000+0800)/,2
1127955,五一去的，完全是计划之外，因为总统府排队的人实在是太多了。进去之后发现真的不白来，对曹雪芹家族及当时的历史背景都有了很深入的了解。&#x0A;【性价比】,/Date(1571145705000+0800)/,0
1520087,位于长江路历史文化街区，地铁二号线或三号线至【大行宫站】即到。&#x0A;江宁织造博物馆主要介绍织造文化和红楼梦的文化，除了丰富的博物馆知识以外，还可以在户外的园子里欣赏到很多精美构思的建筑以及与之相辅相成的植物，虽然面积不算大，但是参观之后可以学到很多知识，还让心灵得到了放松~,/Date(1553167456000+0800)/,1
18596584,江宁织造府博物馆是近年来南京市博物馆路线中的精品，位于大行宫地区，是在原江宁织造府遗址上重建的。博物馆面积不是特别大，属于中等型博物馆。江宁织造是中国古代丝织技术的代表，更是皇家御用贡品，皇室的礼服都是由这里产生。南京云锦是江宁织造的精华，更是人类首批非物质文化遗产。在这里，可以深入了解云锦知识。同时，江宁织造与清代一个大家族的命运息息相关，那边是《红楼梦》作者曹雪芹背后的曹氏家族六十年的沉浮。这里也是红学爱好者的基地，地下一层堪称是中国红楼梦博物馆。博物馆门票30元，交通特别便利，入口处就有地铁直达，在南京的市中心内。,/Date(1528777928000+0800)/,7
752046,江南织造博物馆位于江苏省南京市的总统府&#x20;靠近新街口&#x20;是一个完全复古的建筑群&#x20;重现了当年织造府的场景&#x20;馆内能让回到古代生产锦绣的生产及织造工艺&#x20;值得分享,/Date(1488969579000+0800)/,2
34635771,特别好，真的很有看的价值，我拍了好多好看的照片，那还能连总统府的门票一起买了，人不多，很方便，对于我们这种喜欢美丽服饰的人来说真的很不错。,/Date(1486435957000+0800)/,2
242189897,非常值得一次的地点，服务中心可以领到免费讲解器，学到很多,/Date(1570273449000+0800)/,0
80965759,这次主要去了红楼馆，旗袍馆和云锦馆，这几个都有各自的特色，如果要细细的看的话至少得三个小时，外面建筑是苏州园林的风格，感觉不错，下次可以细细的再看看，喜欢红楼的朋友们不要错过。,/Date(1540215762000+0800)/,0
36062385,参观南京江宁织造，可以了解南京以前的繁华，看到皇帝的高级订制龙袍，不由得叹为观止，里面三四十年代订制的高级旗袍，更是让我想占有的欲望……,/Date(1482413503000+0800)/,2
60184210,很有年代感，代入感超强，让你近距离感受当年的江陵织造,/Date(1578457760000+0800)/,0
1312459,就在总统府旁边，小众景点，但是很网红。人不多，可以慢慢看。里面还有个后花园，天气好的时候，坐坐很舒服。有些文创很有特色，可以入手。,/Date(1576834909000+0800)/,0
34856278,是个需要挺多时间来好好参观的博物馆。除展品外，还有织布的现场演示，语音介绍略显简单了些。&#x0A;对面就是总统府，早晨人不多，可以悠闲地逛。,/Date(1574004020000+0800)/,0
1096133,去的不是时候，有两个展厅不知什么原因没有开放。,/Date(1598091225000+0800)/,0
84893489,值得一去的地方，能了解中国织造业的发展和技术。,/Date(1575438138000+0800)/,0
52326705,比起南京众多的历史类景点这个不算突出&#x20;介绍云锦等丝织品的历史&#x20;专项博物馆在中国也只会越来越多&#x20;大城市尤其密集&#x20;作为历史爱好者当然都会去,/Date(1571961951000+0800)/,0
2889420,非常愉快的一次旅行参观，博物馆距离总统府非常近，可以一并参观，然后再去1912街走走逛逛，吃点东西，很有特色，网上购票方便快捷,/Date(1571699743000+0800)/,0
158499814,总体还行吧，住在边上就去玩了一下，了解提花织布,/Date(1566129457000+0800)/,0
1288630,这个博物馆竟然周一不闭馆哦。馆内的两条主线是关于云锦和红楼梦。博物馆由吴良镛先生主持，很美。门票20元，携程订17元，省3元。,/Date(1476193279000+0800)/,2
9088265,馆藏了从海外征集的中国古代的龙袍和旗袍等文物,/Date(1586402313000+0800)/,0
4828559,这个博物馆很好玩。里面介绍了江宁织造府的前世今生。非常有教育意义。算一个极好的爱国主义教育基地。就是票价小贵。离总统府极近。,/Date(1576938419000+0800)/,0
37108867,还可以四点多去的人不多里面东西分三部分如果喜欢红楼梦的会觉得很好没兴趣的人就会觉得一般了。票价20会有和总统府的联票不过它是九点开门总统府是八点开门,/Date(1438252604000+0800)/,0
13429634,性价比不高。性价比低，可玩性低，景色一般，,/Date(1619536743000+0800)/,0
50899278,"红楼梦中人，两架织机很震撼，文创方面有点遗憾，&#x0A;这么大的一个ap,没有好好的动动脑筋。可惜了，可惜了，可惜了，可惜了，可惜了",/Date(1579643084000+0800)/,0
51454152,就在总统府隔壁一栋大楼里，里面很大，展品有的不错，比如明清的仿制朝服，有的居然是织物的照片，红楼梦展除了曹雪芹生平部分，关于小说部分展示了一些人物绣像和书中诗词就意义不大了。一楼是一些移来的园林建筑还挺有意思，不过没有全部开放。,/Date(1572006486000+0800)/,0
55042543,一个很不错的地方，主要介绍红楼梦作者曹雪芹的家世。从外看似很小，内在别有洞天。提前携程订了一老一成面票很划算，30都不要。现场买票的话直接收现金而且还要30一张,/Date(1525222819000+0800)/,0
64169969,这个景点很近，一出地铁口就看到了。还没进去就被门外的建筑所吸引了，真的很有民国的味道。&#x0A;我们第一个去的馆是旗袍馆，里面珍藏了许许多多各式各样的旗袍，道尽了旗袍的今生前世，详情就不剧透了，留给大家去探索吧。&#x0A;接着是云锦馆。之前真的不知道南京的传统手艺是云锦，但看了图案，纺织机之后觉得真的很震撼。手艺非常棒！不枉此行哈哈。,/Date(1515895460000+0800)/,0
56081331,总统府对面，1912街区的对角就是江宁织造博物馆，这里据考究是江宁织造署的旧址所在地。这里不仅是“织造”、“云锦”的博物馆，也是一个可以走一走，看一看的江南园林。从园中往北看，设计有些中国山水画的意境。据说是吴良镛先生根据“三山半落青山外，二水中分白鹭洲”化形出来的风格。整个织造博物馆既有历史文化又有山水田园意境。,/Date(1508392218000+0800)/,4
62507671,趣味性不大，但是因为红楼梦里边提到过江宁织造，于是就很想去看看，瞻仰一下当时背景下的纺织业，兴衰史，里边比较适当拍照，人也不多，可能是因为我们中午去的，今天有点小雨，，感觉挺好的，就是没有太多的东西可以看，就是看建筑，感受江南风情,/Date(1475421960000+0800)/,2
2248782,完全打破我对博物馆的认知，整个博物馆就是一座典型的江南宅院，有池塘，有花园，有假山，有绿植，无法想象这样一座古朴的建筑置身于喧嚣的城市中心，但与周围鳞次栉比的高楼又毫无违和。成人价20元，物超所值！,/Date(1485869460000+0800)/,2
32458613,位于总统府不远、馆子很大、设计很好。清朝康熙六下江南、有四次就住在江宁织造府内、这里的地名大行宫的称呼即由于康熙、乾隆两个皇帝在此住过而得名。馆内资料、文物、景象反映当时的兴衰、荣辱。值得前往参观。,/Date(1443750503000+0800)/,2
9088265,海外征集的中国古代的龙袍和旗袍等文物,/Date(1578472696000+0800)/,0
52293906,地点在市中心，离新街口不远的地方。非常好的市口，交通方便。离总统府也很近。是比较新的新建博物馆。但是园林的设计比较用心。里面也有关红楼梦的一些展览，总面积不算大。体验感觉除了比较新，但说不上新鲜。,/Date(1459046918000+0800)/,2
173129855,可以学习学习的，织造过程，红楼梦管,/Date(1566747533000+0800)/,0
219873273,非常好，游玩很开心，下次还会去玩。,/Date(1562509215000+0800)/,0
3135256,携程购票真的很方便，这个景点也值得一看。推荐大家来看看。了解一些历史。江宁织造博物馆，修的也很好。只是南京的天热。,/Date(1560681255000+0800)/,0
