88164751,总统府还有南京图书馆都在这附近，不推荐它作为主要来观赏的景点。博物馆中庭的感觉还是蛮好的&#x20;很有层次感的感觉，但是可能是冬天的原因，感觉它里面还是蛮萧瑟的。然后里面维护比较一般，还有很多地方未开放，三四层均不是博物馆的范围。然后里面展品很多是展板，感觉有点给我对博物馆的印象打折。感觉如果花三十专门来看这个其实我觉得不是很值。（最后，感觉模型比实物好看）,/Date(1546938580000+0800)/,0
17006545,景区离总统府很近，建筑风格很不错，可惜二楼不允许上去参观，所以景区总体感觉很小！,/Date(1517751603000+0800)/,0
49854562,不错&#x0A;里面内容丰富&#x0A;可以观赏内容很多&#x0A;建议导游讲解&#x0A;这样可以丰富你所看到的一切&#x0A;,/Date(1517582275000+0800)/,0
21555901,博物馆主要分江宁织造，红楼梦，旗袍，云锦几个展区，展品本身不是特别突出，但是博物馆的建筑很值得一看，西式建筑和中式园林亭台楼阁结合相得益彰。可惜三四楼不能参观。,/Date(1516533504000+0800)/,0
73429419,里面用了很多中式古书做造型来设计，很不错，多媒体相对较少，内容显示太多，容易枯燥,/Date(1516085444000+0800)/,0
60059099,有点儿失望，感觉博物馆的设计、内容都不是很走心，没有什么实质内容，门票还不便宜。,/Date(1507645061000+0800)/,0
13644642,上午去完六朝博物馆，感觉很好，下午来到江宁织造博物馆，本来很期待，略有失望。标识指示不是很清晰，居然还有旗袍馆。内容上有些江宁织造相关有些红楼梦相关，但是都不够精彩。因为是孕妇，进门安检的时候希望能够手捡不过安检门，工作人员装作没听懂…,/Date(1507171613000+0800)/,2
70765124,是关于红楼梦的博物馆&#x20;里面有很多电子交互的设备&#x20;喜欢红楼的人一定不要错过&#x20;棒棒的！！！,/Date(1477742807000+0800)/,0
20721867,古时的皇帝专供布料，气势恢宏，组织机构分工严谨，让人了解了古时皇帝的布料生产过程,/Date(1412462735000+0800)/,0
148783475,主要是看地下一层啦，上面更适合拍照……,/Date(1513501587000+0800)/,2
113100893,因为红楼梦，爱上南京城。在曹先生的古宅，近距离的了解小说的前世今生，收获满满。,/Date(1511061457000+0800)/,0
25633357,还行吧，感觉没啥看点，就是花园漂亮点。,/Date(1507254487000+0800)/,0
56916333,很好的博物馆，有个小花园，拍照不错～～,/Date(1505097439000+0800)/,0
8404017,在室内开了几个展馆，还有类似红楼梦里的意境。意外的看到了一个小公园，创意很好。,/Date(1502762401000+0800)/,0
933596,姑娘是红楼粉丝，声光电结合的视觉感受很好，参观人不多，看看87版红楼梦挺惬意！,/Date(1500676135000+0800)/,0
6616476,江宁织造博物馆里，外景部分展现了康熙时期江宁织造署的园林建筑及曹家的家园，内部讲述了清朝时期江宁织造府的历史及红楼梦的故事，建议对红楼梦感兴趣的人士去参观。。,/Date(1480895936000+0800)/,0
91794975,红学圣地，值得去看看，了解更多曹雪芹,/Date(1552996092000+0800)/,0
176266807,很不错的博物馆，了解了云锦，就负一层的云锦部分就逛了快2个小时（因人而异）。,/Date(1530253210000+0800)/,0
171327353,还不错，很漂亮，门票也不贵，挺值的，,/Date(1523715932000+0800)/,0
34105975,好好好好好好好好好好好好好好好好好好,/Date(1493652033000+0800)/,0
33262938,很失望，初二带着孩子先参观了六朝博物馆，再去了该织造博物馆。同样的价位但比六朝博物馆差很多，里面就像一个私家花园而已，上面铁将军把门，估计五分钟就看完了。,/Date(1613224769000+0800)/,0
65685801,说是博物馆，更像是一个园林，假期去人也不多，二楼旗袍馆的装修很民国风，不错,/Date(1556749628000+0800)/,0
158229655,取个票相当简单，而且没什么人参观。但个人觉得，对清代文化还有红楼梦、云锦的,/Date(1519201612000+0800)/,0
18683777,不错，实物展览和图片资料还有数字展览很多，很大的一个专业博物馆，值得一去。,/Date(1519172446000+0800)/,0
18323195,很不错啊，里面展现了清朝和民国的很多文物，很有历史气息，建议大家来参观参观,/Date(1516517710000+0800)/,0
4456765,学生票可以有折扣&#x20;里面有很多关于丝绸旗袍的展品但是数量不是很多&#x20;就在总统府附近,/Date(1445239522000+0800)/,0
8307122,不错的一个博物馆，建筑风格、藏品、介绍都很值得一看，就是指路牌不太明显。,/Date(1557312894000+0800)/,0
163418118,古时候的好聪明，那个织布机好好啊,/Date(1548432680000+0800)/,0
24982376,票价有点贵，但还是值得看一看的。,/Date(1548423431000+0800)/,0
55594790,一圈逛下来，了解不少历史知识，文物不多，四点到的，地下一层的临时展馆和红楼梦馆没来得及看，旗袍馆的展品比较丰富，值得一看。门票小贵，以后有空再去慢慢看。,/Date(1538915007000+0800)/,0
58483838,建筑很有韵味，展览也很棒，很喜欢,/Date(1533711792000+0800)/,0
65886272,很好，涨知识了，和小说里好多场景对上了，但是里边东西不太多，地理位置好。,/Date(1532585054000+0800)/,0
1851696,去时正好赶上下雪，太美了太美了！,/Date(1517621716000+0800)/,0
71772606,很值得去看看，有关红楼梦的很多！,/Date(1502204019000+0800)/,0
100562587,不错，入园方便，景点有趣，很好的,/Date(1499754151000+0800)/,0
104901408,离新街口和总统府，还有1912街都很近，里面详细介绍了江南织造的历史～,/Date(1557665600000+0800)/,0
1112285,虽然馆藏还在补充中，但比较充实，以红楼梦为引子，确有不少题材有待挖掘。,/Date(1551086519000+0800)/,0
4850463,当场在携程上买票即可进馆，需要在售票处出示二维码或6位数的预订号换票。,/Date(1550043101000+0800)/,0
95445550,博物馆人很少&#x20;，也算不错&#x20;，喜欢红楼的可以去看看&#x20;因为就在酒店旁边&#x20;就去参观了,/Date(1534236117000+0800)/,0
1529387,博物馆的设计很有特色，现代与古典相结合，特别是整个布局有特殊的立体感。,/Date(1527428741000+0800)/,0
61584878,携程网定票真的很方便，门口出示短信即可换票进入，免费讲解器，值得一游！,/Date(1517214473000+0800)/,0
84893489,值得一去，世界非物质文化遗产，五彩云章，天工织就。,/Date(1513985023000+0800)/,1
98746480,很喜欢，有红楼馆，还有江南织造总局的介绍，还有云锦，内容挺多，挺喜欢的,/Date(1505746762000+0800)/,0
47859485,女儿正在看红楼梦，去的很值啊！,/Date(1503110379000+0800)/,0
11452558,展览内容为江宁织造衙署历史图片文字介绍、《红楼梦》名著陈列和云锦展示。,/Date(1477325706000+0800)/,0
8060793,到南京值得一起去的博物馆，特别是底楼有红楼梦的主题展，很有回忆感。。,/Date(1541565723000+0800)/,0
857082,带小朋友去看看不错的，涨知识。&#x0A;走出展馆，园子也挺好看。逛逛也挺不错。,/Date(1535468520000+0800)/,0
154906909,还挺不错的，尤其是喜欢红楼梦的人，可以来看一下。,/Date(1512309671000+0800)/,1
2804138,闹中取静的所在，感受一下这个城过去的显贵，回去翻翻红楼梦，又有收获哩,/Date(1510026436000+0800)/,0
85855940,古色古香的古城，感觉真的特别不一样，整个城市的韵味让人不得不沉浸其中,/Date(1491445677000+0800)/,0
11575574,在高楼大厦之间，挺有意思的，里面有个展厅专门展示红楼梦的，还有动画。,/Date(1417780049000+0800)/,0
217952643,里面的文化真的很吸引人，一点也不枯燥，感觉比总统府还好看，值得一看,/Date(1555128857000+0800)/,0
1675049,很好，在携程订票方便又便宜，推荐大家到这个博物馆看看，建的非常好！,/Date(1539665986000+0800)/,0
46221053,非常好非常好，比隔壁的总统府好多了，人还尤其少，估计因为旅游团不来,/Date(1525227331000+0800)/,0
79738125,一共三层。-1层红楼，1层室外，2层旗袍。就是虚拟旗袍试穿不会玩。,/Date(1511671487000+0800)/,0
9141551,和曹雪芹家有着重大关系的江宁织造局，博物馆是后建设，园林设计很漂亮,/Date(1510082245000+0800)/,0
4869535,这个博物馆主要展览的是红楼梦和其作者曹雪芹&#x20;地下室的红楼梦展厅很不错,/Date(1508099640000+0800)/,0
974685,来过又来，还是值得一看再看，面积小了点，再扩一点展馆就更好了！哈哈,/Date(1498468803000+0800)/,0
8066143,离总统府非常近，顺路就都逛逛，还可以购买这两个地方的联票，挺合算的,/Date(1453100027000+0800)/,0
35258486,非常值得一去&#x20;建筑外观气势恢宏&#x20;内部别有洞天&#x20;展厅里的内容丰富&#x20;值得一去,/Date(1538639669000+0800)/,0
5717414,通过携程购票比较方便，节约时间，免去景点排队购票，且还有点优惠。,/Date(1534569025000+0800)/,0
17623127,绕一圈，一个对这块领域不怎么感兴趣的，感觉票价较贵，性价比不高。,/Date(1532521293000+0800)/,0
11769584,就在总统府对面，轨交大行宫站旁，交通方便。尤其适合喜欢红楼梦的人,/Date(1519371473000+0800)/,0
50392230,很棒。但是因为行程安排太满了，有点匆忙。是个了解红楼梦的好地方。,/Date(1518080276000+0800)/,0
50640175,认真的观看了每一件藏品，体会那个年代，那段岁月，那段沧桑的历史。,/Date(1511875425000+0800)/,0
67788365,旗袍很精美，很精致，博物馆布局很好，这次来南京之旅这一站挺值得的,/Date(1511580626000+0800)/,0
23571426,房子不是很懂，但是博物馆是喜欢的，可以来参观了一下增长的很多知识,/Date(1508744211000+0800)/,0
3678521,原来的江宁织造衙门早就没有了，里面的古建都是近年建的，展品丰富。,/Date(1501336177000+0800)/,0
15370146,这个地方还真是值得一去的，很有历史文化底蕴，走马观花也要两小时。,/Date(1490192141000+0800)/,0
24670813,值得去&#x20;里面亭台楼阁&#x20;仿佛进入了园林。红楼梦展览&#x20;一定要花时间慢慢看,/Date(1534046712000+0800)/,0
10334720,园子不大，藏品不少，少一星给换票的售票员，我问了他句：是给你二维码还是数字码？他瞪着我气冲冲的：短信拿来！我愣了一下他又朝我吼了一遍，莫名其妙,/Date(1525359221000+0800)/,0
55932135,挺不错的&#x20;&#x20;里边把曹雪芹一家祖上的历史呈现的很详细连续性很好很详细,/Date(1493690755000+0800)/,0
,造在江宁织造府原址上&#x20;一楼有关于发掘的记录&#x20;其上新盖的建筑很有特色,/Date(1482587620000+0800)/,0
17542630,感受历史，值得一看。感受历史，值得一看。感受历史，值得一看的,/Date(1552874147000+0800)/,0
84893489,值得一游，非物质文化遗产，了解中国文化。,/Date(1522038989000+0800)/,1
363083,人非常少，可以了解云锦的知识，建筑也很漂亮，就是展品有点少。,/Date(1515132308000+0800)/,0
53437981,江宁织造体现了中国丝织水平，曹雪芹家族的兴衰造就了一代文豪！,/Date(1507302438000+0800)/,0
16132316,看了大家在网上的点评，都貌似说不错，但对红楼有所了解的人，觉得里面陈设的颇为小儿科，要么是纸质介绍，要么就是视频说故事，里面有一段归彼大荒的视频值得一看。其他没有太大亮点，对江宁织造本身的描述不是特别多，就是对曹氏家族的介绍着墨较多。,/Date(1506695387000+0800)/,1
21119218,非常好，相比总统府之类的热门景点，在这个博物馆真的是逛的舒心。尤其是对于红楼迷来说更是必须要去的，坐着安安静静看了几出62年的越剧，非常好。,/Date(1491278263000+0800)/,0
4137420,刚开业的时候去的，人很多，里面很多很多旗袍，还有红楼梦展厅。,/Date(1473727677000+0800)/,0
36659868,交通便利，坐地铁公交都方便。喜欢红楼梦的游客一定要去看看。,/Date(1551084196000+0800)/,0
188072772,正赶上志愿者导览讲解，运气真好！曹雪芹家真乃钟鸣鼎食之家！,/Date(1533531414000+0800)/,0
2688448,非常好，价格便宜，优惠多多，即买即用，信赖携程，继续支持！,/Date(1529157187000+0800)/,0
63614843,就在总统府的附近，1912街也在这边，所以自由行值得一去！,/Date(1517640353000+0800)/,0
27174740,讲了江宁制造局、曹雪芹家族兴衰史、旗袍、云锦发展史。广泛运用数字化媒体，可以试穿电子旗袍.....,/Date(1517577826000+0800)/,0
161531032,喜欢红楼文化。馆内布置有身临其境的感觉。特别适合领着孩子去,/Date(1517218982000+0800)/,0
159666181,保安竟然主动帮忙扔垃圾！一定要点赞！馆里的藏品很值得称道！,/Date(1516886212000+0800)/,0
18575686,位于大行宫地铁站旁，购票取票方便，喜欢丝绸的不妨可以去看看,/Date(1496266775000+0800)/,0
171444195,您还有一些高科技的展馆，体现了清朝时期江宁织造府的繁华。,/Date(1533517889000+0800)/,0
24719902,博物馆建筑本身很耐看，详细介绍了江南织造的历史及清朝的兴衰史，结合红楼梦浓墨重笔叙述了曹家三代四任主管江南织造的股市，还是挺值的看一看的,/Date(1522834057000+0800)/,0
167840962,特别好，内容丰富，对曹雪芹家道有了清楚的了解，值得一看。,/Date(1521382124000+0800)/,0
42713200,织造的兴起与发展，里面有多处动态屏，犹如置身其中值得一看,/Date(1515313898000+0800)/,0
38431451,人不多，展厅也不太大，两个小时之内能逛完。织造府历史展厅不错，红楼梦馆有点鸡肋了，可以做得更好些,/Date(1514089336000+0800)/,0
65261566,博物馆陈列着许许多多的展品，一趟参观下来给了我不少见识。,/Date(1507786304000+0800)/,0
3673789,一般，十一期间人也不是很多，如果行程来得及的话可以一看，行程紧张的话，就可以pass了。对红楼梦感兴趣的也可以去看，有专门的红楼梦展厅。,/Date(1507138821000+0800)/,0
96121067,非常有意思的地方，核式的设计也很新颖,/Date(1499100365000+0800)/,1
14456011,江宁织造府位于南京市大行宫地区，清朝康熙皇帝6次下江南，有5次就驻于江宁织造府内，可见当年江宁织造府的地位之高。是值得一去了解历史的地方,/Date(1432735313000+0800)/,0
8402068,很棒的地，让孩子学到很多历史文化，地方虽然不大但很精致,/Date(1534903207000+0800)/,0
4166133,对云锦制作工艺和红楼梦有兴趣的人们，值得一去的3地方。,/Date(1523179472000+0800)/,0
156566746,这次南京游玩最有感觉的地方，里面的讲解和设施都非常棒！,/Date(1514806093000+0800)/,0
13639518,喜欢红楼的可以仔细看一看，我比较喜欢云锦和旗袍的部分。,/Date(1497057162000+0800)/,0
18569493,当初建的时候晓得这个项目叫做江宁织造府，不过随着工程的深入，感觉越来越不伦不类，怎么外面看着像现代建筑，里面小桥流水亭台楼阁，很古典呢,/Date(1412064663000+0800)/,0
91531368,博物馆设计是来自于红楼梦，从馆内和馆外都看起来特别棒,/Date(1549025462000+0800)/,0
163293870,是个不错的景点，挨着总统府很近，可以考虑去一下，值得,/Date(1519102900000+0800)/,0
886345,很现代的布展水准，很独特的建筑风格，人也不多，很喜欢,/Date(1516244011000+0800)/,0
34700719,总体不错，庭院一般，但是藏品丰富，历史感强！值得推荐,/Date(1514897528000+0800)/,0
15322361,非常漂亮，惊叹于古代人的智慧，博物馆的格局也很有底蕴,/Date(1511158150000+0800)/,0
13333351,红楼梦馆很有看点，特别是太虚幻境，很有身临其境的感觉,/Date(1510964450000+0800)/,0
58671573,真心不错，是我出生长大的地方，看了以后增长了很多知识,/Date(1489803310000+0800)/,0
88273488,值得去，里面有很多关于曹雪芹和红楼梦鲜为人知的故事,/Date(1551770113000+0800)/,0
103715077,值得一游，世界非物质文化遗产，五彩云章，天工织就。,/Date(1512904828000+0800)/,0
66235028,值得一去，有江南特色，交通方便,/Date(1512333676000+0800)/,1
154906909,挺不错的，尤其喜欢红楼梦的要去看一下，交通很方便。,/Date(1512291445000+0800)/,0
44829351,总体不错，馆内看点多，景色宜人，文化典籍的&#x20;适合了解,/Date(1510558451000+0800)/,0
18329603,时间不够，可惜没有参观完全。如果有三个小时比较合适,/Date(1501058338000+0800)/,0
184883960,有专门的红楼展馆，江宁织造史就是明清宫用丝绸史。,/Date(1557057256000+0800)/,0
45344129,仔细看看，可以了解曹雪芹家族的兴衰史，让人兴叹！,/Date(1556978171000+0800)/,0
3712916,很值得的博物馆哦，后面的院子挺好看的，旗袍很漂亮,/Date(1553165538000+0800)/,0
2456868,网上订票便宜一点，到门口买票处说验证码打印电子票,/Date(1549969899000+0800)/,0
189401879,感受历史与科技融合的魅力&#x20;棒！&#x0A;,/Date(1543308250000+0800)/,1
17110858,我感觉还是挺有针对性的一个博物馆，展览很有意思。,/Date(1542924986000+0800)/,0
516423,博物馆不大&#x20;但是很有特色&#x20;尤其是真人织锦表演&#x20;值得一看,/Date(1542467198000+0800)/,0
66945301,儿童免票，成人30，重点参观地下一层的红楼梦馆。,/Date(1538701379000+0800)/,0
3697203,设计很棒，人也不多，红楼以及丝织博物馆都很特别。,/Date(1525093253000+0800)/,0
101403834,非常值得去的景点，去的时候人好少，安静，适合漫游,/Date(1524731986000+0800)/,0
12742111,江宁织造博物馆距离南京总统府，不太远。值得参观。,/Date(1517631635000+0800)/,0
58101215,第二次来了，很值得去看的地方，介绍很详细也很系统,/Date(1516373647000+0800)/,0
157144462,两个人去的，进去以后有热心的志愿者帮忙讲解，了解了江宁织造的历史和红楼梦的渊源，长知识啦,/Date(1514101037000+0800)/,0
152813278,景色还是很不错的。有免费讲解，都是大学生志愿者，这是他们的一次锻炼的机会，支持一下。江宁织造和曹雪芹还有渊源。看完回家补红楼梦～,/Date(1512186888000+0800)/,0
116234097,很好啊，有好看的风景，有旗袍博物馆，还有红楼梦馆,/Date(1512127853000+0800)/,0
57224293,有三层，分别展示了云锦工艺、江宁织造与曹家的兴衰还有旗袍的演变过程，逛逛还不错，就是标识不是很清楚，里面的安保人员挺热情的，赞！,/Date(1511235711000+0800)/,0
106680426,周围环境保护很好，有很强并且还具有5的历史意义，,/Date(1509765493000+0800)/,0
13819992,里面的视频特值得一看，看的很有感触。制作很用心。,/Date(1508999163000+0800)/,0
96227225,园子不大，但立体有型且闹中取静，很是雅致，喜欢!,/Date(1506662288000+0800)/,0
39819157,展品很多，历史氛围也很浓学习了解江南织造的好地方,/Date(1497347023000+0800)/,0
90862153,还不错，主要看了旗袍，因为时间问题没来得及看影片,/Date(1493639341000+0800)/,0
49310461,交通方便，取票方便，不用排队，闹市中的一份宁静。没去过的，想了解红楼梦的，值得去看看。小朋友特别喜欢旗袍馆的灯光，来回跑了好几趟,/Date(1452423290000+0800)/,0
9231990,挺好的，很有文化气息，很好展现了江宁的文化历史！,/Date(1406444051000+0800)/,0
176111421,价格不贵，内容却很值得欣赏，有意义的一次学习。,/Date(1529482828000+0800)/,0
74143265,环境很好，感受中国古人的伟大！劳动人民最伟大！,/Date(1525168610000+0800)/,0
23241590,便捷，优惠，现场购票，即买即用，很好，下次还用,/Date(1523681994000+0800)/,0
32619271,非常好的地方，感受曹雪芹的魅力，感受织造的美丽,/Date(1517472191000+0800)/,0
59296529,非常好的红楼梦周边景点，并且也很好的介绍了云锦,/Date(1515683946000+0800)/,0
1636335,很早就想去了，一直没机会，这次国外朋友来带着一起去了，建筑做的还可以，但是内部陈列稍嫌粗糙，展区也不多，希望可以做的再精致点。,/Date(1515586057000+0800)/,0
6866572,家门口，第一次去，还行吧，带小朋友感受历史文化,/Date(1512213860000+0800)/,0
85211914,挺不错的，比想象中的好，人也不多，可以慢慢游赏,/Date(1509360660000+0800)/,0
294555,总体还不错，但是大观园没开，没机会走进园林部分，一个遗憾。人很少，保安比游人还多，过程中碰到个志愿者，提供了一些讲解，还不错。,/Date(1507977259000+0800)/,0
1529387,原江宁织造局旧址，里面的红楼梦博物馆很值得一看,/Date(1507367029000+0800)/,0
94875563,冲着红楼梦馆去的，结果发现不止红楼梦馆值得一观,/Date(1500739311000+0800)/,0
20705285,人很少，内容不是太丰富，好多东西坏了，有点影响,/Date(1498657837000+0800)/,0
80400714,非常棒的一次参观，带孩子了解了红楼梦的故事背景,/Date(1490798568000+0800)/,0
84893489,值得一去，了解了江宁织造府的兴衰，下次再去。,/Date(1553327924000+0800)/,0
197211147,二次游览&#x20;位置好&#x20;出地铁就是&#x20;人不多&#x20;人文历史的景点,/Date(1549617313000+0800)/,0
1481251,值得一去！建筑设计很赞！馆内流线合理！推荐！,/Date(1548554559000+0800)/,0
1924404,出票很快&#x20;取票方便，比现场买票便宜一些，不错。,/Date(1538144124000+0800)/,0
185237216,还是很值得一去的地方，就是讲解员多一些就好了,/Date(1533130364000+0800)/,0
156749690,方便快捷，实惠实用！携程旅行网购买票就是好！,/Date(1514096645000+0800)/,0
36524834,超有趣的冷门博物馆&#x0A;值得一去&#x0A;喜欢人文的必去,/Date(1507286377000+0800)/,0
111491465,馆内地方挺大的，儿子是红迷，在馆内流连忘返。,/Date(1506895905000+0800)/,0
107644948,到了江宁织造博物馆门口，现场网上订票，很方便,/Date(1505606719000+0800)/,0
2642332,网络购票非常方便，馆内陈列非常精美，环境优雅,/Date(1503881707000+0800)/,0
60936905,很值得来&#x20;红楼文化&#x20;丝绸锦缎&#x20;还有好看的小园林&#x20;精致,/Date(1501771937000+0800)/,0
6709988,不错，值得一去。记得到游客中心租一台讲解器。,/Date(1500762030000+0800)/,0
86444404,还好，没有实体票，景点很小，一个小时不到逛完,/Date(1496119172000+0800)/,0
2762607,挺有意思的一个博物馆，里面展品很多，主要是一些丝绸和苏绣，非常精致美丽，喜欢这个博物馆，可以让我们领略到古代织品的独特魅力。,/Date(1417674309000+0800)/,0
29535690,里面有锦缎的详细织造过程介绍，很好很喜欢。,/Date(1556408636000+0800)/,0
177991607,值得去的，知道了曹雪芹三代四人当过江宁织造,/Date(1550313379000+0800)/,0
13391947,随买随用，方便快捷，要是能再优惠点就好了。,/Date(1549784858000+0800)/,0
15821023,一进大厅，气势恢宏！带孩子来好好了解一下。,/Date(1549718365000+0800)/,0
71766297,挺好里面的还原当年怎么织布，就是景点有点少,/Date(1536545302000+0800)/,0
36547161,匠心独具&#x20;一步一景&#x20;就在路口&#x20;出了地铁站就能看见,/Date(1535471976000+0800)/,0
180505561,值得一看。捞物馆内园林也很好，云锦很漂亮。,/Date(1529137846000+0800)/,0
154101202,作为辉煌了几百年的江宁织造府，这里人气很旺,/Date(1528869050000+0800)/,0
39203959,这家博物馆就在总统府的附近，是近几年才修建的。里面介绍了南京织造方面的历史，陈列了不少文物，是一个主题博物馆，总体还好吧。,/Date(1526786226000+0800)/,0
1537119,还好吧，文物不多，主要是了解一下历史文化。,/Date(1520392240000+0800)/,0
163824828,不错的景点，要想好好玩下来建议三到四个小时,/Date(1518951848000+0800)/,0
82851789,感受织造的艺术，传承织造的手艺，给织造点赞,/Date(1516234658000+0800)/,0
597440,在南京图书馆旁边，设计大师很用心，值得一去,/Date(1513824426000+0800)/,0
156072229,文化气息浓厚很值得去看，最好看的是红楼梦馆,/Date(1513164703000+0800)/,0
82119878,挺好的，就是三楼和四楼不能上去，只能到二楼,/Date(1510581463000+0800)/,0
27990223,满意。第一次来这里，感觉不错，全五分好评。,/Date(1509828513000+0800)/,0
40081091,非常好，等儿子大了看了红楼梦以后还会带他来,/Date(1507105780000+0800)/,0
19322253,还可以看看，红楼内容很多，没有游到大观园。,/Date(1506655486000+0800)/,0
73554874,非常值得一看！里面还有关于曹雪芹家的历史！,/Date(1505547303000+0800)/,0
57177463,没漂亮，见识到了丝织文化，很爱里面的红楼馆,/Date(1491912413000+0800)/,0
4525853,非常好，方便快捷，儿童不用买儿童票，免费。,/Date(1489805688000+0800)/,0
1044668,就在南京总统府对面，一个很有特色的博物馆。,/Date(1484170044000+0800)/,0
