27288233,很好的地方，水好风景好。心情舒畅,/Date(1652080377000+0800)/,0
257709,博物馆不大，游览一圈时间也不长。,/Date(1642124095000+0800)/,0
229547556,百家湖是江宁区第一大湖，也是南京巿区内仅次于玄武湖的第二大湖。水面积约为2500亩。相传为明洪武年间所挖，至今己有600多年的历史，因当时有百多人家，故名曰：百家湖。,/Date(1593947963000+0800)/,0
204191553,隶属于利源集团，是一家房地产开发公司，有空可以看一看。,/Date(1624235935000+0800)/,0
204191553,位于利源路上，隶属于利源集团（民营企业）,/Date(1632375708000+0800)/,0
44659727,地方不错！非常好的地方，值得去看看,/Date(1637453490000+0800)/,0
204191553,隶属于利源集团旗下，有空可以看一看。,/Date(1606179249000+0800)/,0
204191553,隶属于南京利源集团，一家民营企业。,/Date(1615807076000+0800)/,0
38236374,好评。。。。。。。。。。。。。,/Date(1620660205000+0800)/,0
159863716,花园式的小区小区环境优雅管理严肃周边配套设施齐全.交通方便此小区属于底层楼小区.采光充足无无高楼遮挡光线.绿化常青.空气新鲜,/Date(1577193925000+0800)/,0
293000764,算是在家门口，看上去很壮观，以前一直以为是小区的门头,/Date(1613397480000+0800)/,0
70058452,大气又美丽的百家湖，风景优美！,/Date(1576130663000+0800)/,1
39954956,很不错的地方，里面有很多好玩的，下次还会再来,/Date(1590672662000+0800)/,0
8939380,总体还不错吧，是小区的大门，看上去挺好,/Date(1565521066000+0800)/,1
20721867,长知识，长见识，展品种类繁多，即陶冶了自己的精神世界又让自己在参观游玩中学习了文物鉴定知识，受益匪浅…,/Date(1415687932000+0800)/,7
1652598,百家湖博物馆是南京目前注册的7家民营博物馆之一。已经开放了10年，在业内颇有名，但公众知道的少。博物馆上面一层主要是字画作品，进门左边墙上有张大千的多幅作品。“有侍女，还有山水。”博物馆工作人员孟迎春介绍，他们馆收藏的都是张大千早期的作品。而吴冠中的作品在右边墙上，尺幅不算大，画的是一片林子，最下方写着“新叶留人看，当年小池畔”。这幅作品，是2005年左右，百家湖博物馆的馆长从香港苏富比拍卖会上拍来的。这里宝贝很多，还有徐悲鸿、钱松岩等人的作品，以及陈逸飞的《大提琴手》。此外还有信札、象牙雕、瓷器等等。其中展出的一封信，是胡适写给徐志摩的，胡适打算辞去新月书店董事长的职位，并交代徐志摩一些事情。孟迎春说，再过两个月左右，百家湖博物馆就要搬家了，就在马路对面。新馆的条件会更好，场地大，保存条件也更好。,/Date(1491271768000+0800)/,2
35561089,一个小区的门头，建的很宏伟，还不错，,/Date(1569680375000+0800)/,0
12224973,就在家门口，以前尽然多不知道，开发商搞的，好坏你懂的,/Date(1452344525000+0800)/,1
45845367,非常高大上，神圣的地方，不虚此行的骄傲感,/Date(1447987099000+0800)/,1
37196058,带孩子去，还是蛮好的，东西很多，有随机教育，值得去,/Date(1437740998000+0800)/,0
29686501,门头大气，穿过去就是百家湖，晚上很美，空气不错,/Date(1428331804000+0800)/,0
44275680,这里虽然偏僻一点，但是湖景美不胜收，值得去,/Date(1447640524000+0800)/,0
36037936,真不错，南京文化传递，展品很吸引人，不错,/Date(1435861342000+0800)/,0
12716746,湖面很大，周边都是别墅，来这边走走散散步挺好的，还可以在这边划船，人气一般，湖面很大，很舒服。是个休息散步的好地方。,/Date(1417580967000+0800)/,0
5961138,还行，白家湖还有就是百家湖那三个的标志,/Date(1476366708000+0800)/,2
2751717,里面的展品不少，但有点太抽象。,/Date(1496540005000+0800)/,2
6405637,一把般的等不及份，嗯湖底大堡礁附近，悲剧的巨额北京,/Date(1448258028000+0800)/,1
2847142,基本上天天路过，这个博物馆是对外开放的吗，这不是开发商搞的吗,/Date(1479943072000+0800)/,0
262078661,差评，因为百家湖博物馆改成了百家湖花园，进不去，旁边有个美术馆，也不开放。,/Date(1597710960000+0800)/,3
76112992,珍藏了很多有价值的物品，值得去的。,/Date(1482330679000+0800)/,1
32783472,感受中国大美河山，自豪感油然而生,/Date(1524797662000+0800)/,1
51198630,挺好的，地方很有特色，值得我们到这里看看玩玩,/Date(1455718243000+0800)/,0
32861959,没有好看的，就是几座公寓，欧式得建筑，就这样,/Date(1448696470000+0800)/,0
41558883,很有历史感，太好玩了，不去都要后悔一辈子的,/Date(1455090512000+0800)/,0
26846037,非常的不错，感觉里面的展物也是非常不错的。,/Date(1420223679000+0800)/,0
8939380,挺气派的，顺道看看还行，没有专程考的必要,/Date(1472482078000+0800)/,0
82851789,来这里很有感觉，有湖有树，可以过来春游,/Date(1517642583000+0800)/,0
34998501,百家湖风景不错，很还少，江宁最美的地,/Date(1484694504000+0800)/,0
8939380,"一般般，就一个大门头,没什么玩的，",/Date(1481726528000+0800)/,0
165267220,就在家门口，交通便利，门庭开阔。,/Date(1519860013000+0800)/,0
8939380,就在家门口，建的很宏伟，值得看看,/Date(1469631689000+0800)/,0
49227403,景色优美，附近小吃，购物商场比较多，,/Date(1458728231000+0800)/,0
50620927,推荐去下，值得看，周围景色好。,/Date(1454981571000+0800)/,0
35561089,一般般，没什么可玩的，只是一个小区的大门而已,/Date(1516710582000+0800)/,1
8939380,总体一般般，就是一小区的大门，没啥值得看的,/Date(1518362538000+0800)/,1
8939380,总体还不错，顺便可以去看看，性价比一般,/Date(1500913331000+0800)/,1
4205897,百家湖是江宁比较有名的湖，博物馆位于江宁中心地带，不错,/Date(1481548702000+0800)/,0
25715613,大门很像凯旋门。名字也是这个，在利源中路上面。,/Date(1417616505000+0800)/,0
9481070,一般吧，不值得特地去，顺路可以去看看。,/Date(1483055629000+0800)/,0
38343588,可以去看看，乘地铁3号线，交通很方便。,/Date(1472405414000+0800)/,0
8939380,总体一般般，顺道可以看看，没什么意义,/Date(1510408662000+0800)/,0
38343588,"可以去看看哦,尤其是住在百家湖地区的",/Date(1456189278000+0800)/,0
8939380,总体还行，性价比高，顺便可以去看看,/Date(1492788702000+0800)/,0
8939380,一般般，就一个大门头，性价比不高，,/Date(1484406604000+0800)/,0
8939380,挺壮观的，就是很单调，路过看看还行,/Date(1475252201000+0800)/,0
35561089,一般般，规模不大，没什么可看的，,/Date(1507674851000+0800)/,0
152014573,这个旅游没必要来吧都是小区，旁边有百家湖，1912各种商场可以逛逛,/Date(1556097230000+0800)/,1
5432321,如果路过，可以看看凯旋门式的建筑，里面有少量收藏，无参观的必要。,/Date(1475014451000+0800)/,0
925532,里面有一些很有价值的藏品，值得看看。,/Date(1493896524000+0800)/,1
,周末去的居然不开放，白跑一趟，不开放干嘛还上携程，不是忽悠人吗？,/Date(1440401305000+0800)/,4
