266155660,在明孝陵景区里的一个小景点，以纪念曹雪芹为主而设的人造园林，小桥流水，亭台楼阁，配上梅花，从不同造型的窗和门里观景，各有不同，很有意境。,/Date(1611921628000+0800)/,0
179075834,春天，百花次第地开，明孝陵景区内的梅花开罢，樱花开的正盛，红楼艺文苑的海棠灿烂地开，艺文苑里仿红楼梦大观园的小楼小亭也多了几分色彩,/Date(1616680622000+0800)/,0
13705259,红楼艺文苑在南京的明孝陵景区内，明孝陵门口樱花小径一直向前就到了，景区内梅花开罢，海棠花盛开，曹雪芹雕像掩映在重重海棠花中,/Date(1616680115000+0800)/,0
30229255,红楼艺文苑位于明孝陵景区附近，节选《红楼梦》前八十回中最精彩的章节为园内的意境单元，是一处古朴自然、体现红楼文化和江南风格的园林景观。,/Date(1593590250000+0800)/,0
1520371,雪后的红楼艺文苑，充满了金陵古韵！,/Date(1609390503000+0800)/,0
6508139,红楼艺文苑整个布局是比较优雅的来这里度过悠闲时光吧。,/Date(1609925877000+0800)/,0
252038185,性价比很高，蛮不错的，趣味性很强,/Date(1600218902000+0800)/,0
4841881,明孝陵景区中的一个园子，因为道路指示不大完善，我们是出了明孝陵才找到正门进去的，还好工作人员验证后承认是当日票，可以进。非常漂亮的一个园区，江南水乡的独特魅力在这里得以展现。因为游客很少，所以可以拍出美美的纯景色相片。,/Date(1459766725000+0800)/,5
45728970,就在明孝陵里面新开发的一个园子，很漂亮。因为整个景区特别大，能走到这里的游客已经少了很多很多，所以景美人少，非常难得。园子里有亭台楼阁、假山流水，可以找到一些红楼梦的典故痕迹。,/Date(1520050229000+0800)/,4
35064924,红楼梦中的一些地域文化在这里清晰可见,/Date(1588079622000+0800)/,0
42231529,包含在明孝陵内，需要买70块的明孝陵门票入内。一副园林景观，但与苏州园林不同的是，景致更为开阔大气，非常有意境，值得一去！,/Date(1499855558000+0800)/,4
109670404,就在梅花山边上，门外的小吃有点煞风景，但进得门来却是如进红楼大观园一般赏心悦目。楼台亭阁，一个个黛瓦白墙的建筑古朴自然，门窗都有造型，透过来的梅花朵朵别有情致，惹得摄影爱好者流连忘返。是个非常值得拍摄的地方。,/Date(1520253705000+0800)/,2
41325773,不知不觉中，走到了红楼艺文苑景区，这是参照红楼梦中的场景修建的一处呈现浓郁江南风格的仿古园林。&#x0A;园中的亭台楼阁、轩榭廊舫、假山流水各自成景，又遥相呼应，来到这里，仿佛进入了苏州园林，清新秀丽、古朴典雅。尽管这里的梅花不像梅花山那样成片分布，但那一株株梅花与长廊、青瓦、白墙、花窗、池水相互印衬，更显清幽雅致，别有意境。&#x20;&#x0A;尽管这里的梅花不像梅花山那样成片分布，但那一株株梅花与长廊、青瓦、白墙、花窗、池水相互印衬，更显清幽雅致，别有意境。&#x0A;园林不大，但满园的春色美景，流连其中，仿若人在画中游。,/Date(1456941391000+0800)/,0
179824111,这里也不多见哦……不想和好自己朋友去吃点饭早点回来的第一件老婆回来我,/Date(1566732960000+0800)/,0
121371075,红楼艺文苑位于明孝陵景区内，内部景色优美，有多个景点，周围就是梅花山，梅花开了，现在看梅花的人很大，梅花品种很多，有些还开着。,/Date(1521446619000+0800)/,4
109670404,按照《红楼梦》中大观园建的，在梅花山里，亭台楼阁，梅花飘香，还有曹雪芹，林黛玉的塑像，每个拱门，每扇雕窗，都极其讲究，框中皆能自成一景。和大观园还真的十分相似！精巧的布景特别适合摄影创作。,/Date(1519336823000+0800)/,2
13705259,在南京明孝陵景区内，明孝陵景区相当的大，明孝陵，梅花山，梅花谷湿地公园，春天，梅花盛开那美的……紅楼艺文苑在梅花山边，很安静的美,/Date(1543400123000+0800)/,0
1783028,一个小型的园林，属于梅花山明孝陵景区。目前里面比较的陈旧，进去参观的人不太多，也许这个季节游客们的目标都是梅花山上的梅花吧。从其门口出来，就是梅花山景区内的美食一条街，游人们可以尽情的享受当地的美食。,/Date(1457253484000+0800)/,0
26044843,明孝陵景区内的一个园子，不是很大，但是景色宜人，曲径通幽，池塘亭台，蛮有古韵的，据说是参照大观园来修建的，不少新人在此拍婚纱。,/Date(1504242160000+0800)/,2
1783028,红楼艺文苑是依照《红楼梦》中的大观园来建的，但目前里面比较陈旧，进去参观的人不太多，也许这个季节游客们的目标都是梅花山上的梅花吧。从其门口出来，就是梅花山景区内的美食一条街，游人们可以尽情的享受当地的美食。,/Date(1461064635000+0800)/,0
12716746,去梅花山顺便去的。。&#x0A;总体还行吧，满安静的，梅花开的时候映着粉墙黛瓦&#x0A;但是对于见惯园林的苏州人来说也没什么惊艳的&#x0A;而且感觉跟红楼梦没啥大关系啊。。就两个雕像。。,/Date(1417581051000+0800)/,0
32458613,在钟山风景区、走进红楼艺文苑就像进入典型的江南水乡园林、园内以红楼梦前八十回为意境、分为十二个意境单元、是一个享受园林休闲和读红楼实景的好景点。,/Date(1445734571000+0800)/,0
111902947,红楼艺文苑以植物造景为主，选取《红楼梦》中有代表性的人物和景观点缀其间，以期能将《红楼梦》中所叙意境复现人间，达到赏心悦目的艺术效果。,/Date(1513471901000+0800)/,0
36591704,红楼艺文苑以植物造景为主，选取《红楼梦》中有代表性的人物和景观点缀其间，以期能将《红楼梦》中所叙意境复现人间，达到赏心悦目的艺术效果,/Date(1522278084000+0800)/,0
111111085,石后水池中遍设喷泉。喷水时，条条水柱直射空中，水珠散落后，水面上雾气弥漫，远看如云里雾里，正可谓一处天上人间的“太虚幻境”。,/Date(1501896504000+0800)/,0
41202089,就在明孝陵景区里，梅花山边上，是以红楼梦的一些元素搞起来的一片区域，有房子和雕塑，不过我不懂，所以也没看出什么名堂,/Date(1519703018000+0800)/,0
70759307,南京是国民革命的政府，这里有历史的见证，有文化的遗留，有人民的声音。让我们一起看看吧！,/Date(1511592968000+0800)/,0
52293906,是依照红楼梦里的大观园来建的。有潇湘馆，怡红院等等景点。不过园林还是不够精巧。有名，但是细节不见得经得起推敲。不过，公园整体还不错。有一年去赏过月。感觉不错。,/Date(1457957970000+0800)/,0
96019107,红楼艺文苑整体风景很棒，在明孝陵景区内，是一个拍照的好地方，挺棒的,/Date(1496294259000+0800)/,0
97608714,这个地方极其不错哦，有机会一定要尝试一下，五星推荐,/Date(1513560813000+0800)/,0
15105360,太虚仙境，环境很美，正逢梅花盛开期，真的犹如仙境,/Date(1520471833000+0800)/,0
65261566,第一次进来，增长了不少知识，普及了我历史文化。,/Date(1509080832000+0800)/,0
4040561,有次去朋友家玩，正好在朋友家附近，就去转了转,/Date(1408581232000+0800)/,0
77008654,喝茶听戏，聊天约友，是一个不错的休闲场所。,/Date(1504394368000+0800)/,0
6198715,很好的，和朋友一起去的，玩的很开心,/Date(1503798163000+0800)/,0
91234142,景点很美，人很多很热闹，很不错哦,/Date(1506571351000+0800)/,0
111059488,很漂亮的景点，人很多很热闹，赞,/Date(1505871419000+0800)/,0
19225437,这里一进去就很有江南的风格还有红楼梦的那种文艺范，整体看起来很不错的，这里的人并不是很多。,/Date(1409553897000+0800)/,0
15773203,不错的地方呢，有空的时候可以去的哦！！！,/Date(1416237496000+0800)/,2
1723148,好像没多少人去，不是紫金山风景区的主要景点，后建的人文景点。,/Date(1489212161000+0800)/,0
