43987728,离家不远，门口停车不太方便，就是一座山，三面环水，吃东西不是很方便。半天足够了。到处都是采石矶茶干，随便买了点，味道都还算可以,/Date(1569047231000+0800)/,0
150612082,这里去过四次了，很不错哦。有李太白纪念馆等。,/Date(1580756228000+0800)/,0
17758886,马鞍山市著名景点，李白投江处，内有李白纪念堂,/Date(1576650401000+0800)/,0
156463453,风景优美，尤其是江边的景色特别好，在古栈道边很迷人。登上三台阁可以俯视全城，让人心旷神怡。只是票价太贵，网上62元，现场85元。如果开听证会，我建议票价定为50元。,/Date(1513585999000+0800)/,0
5079705,三元洞没开，缆车没有顶棚热死人了体验不佳，,/Date(1597554435000+0800)/,0
94678671,非常好的风景，:到此一游值。采石矶仍长江三矶之一，此处观长江滾滚长江向东流，非常优美。太白祠也在这里，很多点故，故事很多。,/Date(1571749928000+0800)/,0
26278533,长江上的采石矶，相传李白到访，风景秀丽。,/Date(1578673385000+0800)/,0
25434537,景色还不错，走走逛逛要一天时间，有些地方封了，不过还是值得一玩的，最好自备干粮，里面吃的不多。停车场很大，停车费也便宜。,/Date(1560339110000+0800)/,0
79892012,采石矶是长江三矶之首，有山有水，风景秀美。太白楼是采石矶最重要的景点，山上有三元阁、三元洞，山上风景独好，登山或下山路上有沿江栈道可以观赏长江风光。如体力不大好的驴友们推荐购买观光车和索道票，可以节省不少体力。,/Date(1556706655000+0800)/,2
12337743,采石矶历来为江南名胜，古往今来，吸引着许多文人名士，像白居易、王安石、苏东坡、陆游、文天祥等都曾来此题诗咏唱，特别是唐代大诗人李白在这里饮酒赋诗，相传最后因酒醉赴水中捉月而淹死，更增添了神秘的色彩。采石矶是国家重点风景名胜的核心景区，与南京燕子矶、岳阳城陵矶并称&amp;quot;长江三大名矶&amp;quot;。,/Date(1556246608000+0800)/,2
2751229,非常好的景点，因为传说李白在采石矶醉酒捞月而坠江溺亡。景点有很多李白元素，李白祠堂、李白纪念馆等地方。乘缆车上山顶，登三台阁看长江，很宏伟，可惜流经山下的是长江的支流，离主航道还有3~4公里路。三元洞非常棒，窗外就是滚滚长江，0距离感受母亲河的流淌，可惜游客稀少，也没有服务员，没有凳子、靠椅可以静静感受。,/Date(1535276276000+0800)/,0
93148365,本地人，五年没去了。听说票也很贵了，念大学后更不会有时间来这里了。但这里注定让我印象深刻，小时候和家人经常来这里，我家和这里有五六公里，那时不过十二三岁，那段岁月里每逢周末或者小长假就会和我妈外公外婆和小姨一家一起来这里玩上一天，逛逛园林建筑爬爬翠螺山，每次去都必定要做一下缆车，做一下江里的游船，外婆则必去一座小庙里拜拜佛。最后大家找一块干净的草坪买一些茶干一起边吃边聊天，真的非常惬意，一天就这么下来了，然后逛逛采石老街就到外婆家吃个饭。当时感觉非常平庸无奇的事情现在却无比怀念！可能因为这几年运气不佳，学业上也不顺利，家人也因为各种繁杂原因很难经常团聚，甚至还会有矛盾！。哎！现在想多了都想哭！我宁愿少活五年换那段年少游园的时光！！,/Date(1530015731000+0800)/,8
78757218,采石矶很值得大家去一趟，在这里可以感受李白当年得心境，感受他的浪漫主义情怀，对我们的自身修养还是不错的。采石矶风景名胜区&#x20;　　以采石矶为主体，以长江为纽带，以诗人李白活动贯穿其中的风景名胜区，是安徽省首批省级风景名胜区，因山水风光，绝壁矶石而名闻天下，列为长江三矶之首。学生票是40元一人，非学生票是80元一人。,/Date(1509373772000+0800)/,2
63226749,真的很好玩，和女朋友一起去的，就是蚊子有点多要注意防蚊，三元洞大脚印要去看看，学生票半价一天都可以玩的下来，还可以看长江,/Date(1470568298000+0800)/,4
68671749,整个景点玩下来，没有让人印象深刻的景。,/Date(1594507472000+0800)/,0
53704737,采石矶很大，除了沿江仿古栈道外就是个可以爬山的公园。沿江的风景很好，也凉爽。园内爬山累了可以休息，延园和圆梦园的收藏值得一看，只是展品单薄些。李白纪念园很赞。,/Date(1523587467000+0800)/,0
5424736,这里可以说是马鞍山最值得去的地方了，自然风景和人文景观相得益彰。其中的太白楼和林散之艺术馆应是许多文艺青年的喜爱之地。登上翠螺山，临江凭栏远眺的感觉也非常好！,/Date(1490577154000+0800)/,2
5643486,很好的一个旅游景点，宣传力度需要加强,/Date(1588659238000+0800)/,0
26278533,长江之上，采石之矶，李太白仙踪之地。,/Date(1587087842000+0800)/,0
117929954,今天公园里人好多，天气正好，不冷不热著名景点三台阁，三元洞，林散之艺术馆，太白楼等，在欣赏了优美景色的同时，也感受到浓浓的文化底蕴，真是一个值得游玩的好去处,/Date(1507287052000+0800)/,4
21762881,采石矶的景色非常不错，山下山顶的风光都很好，仔细要逛的话，需要大半天的时间，值得向大家推荐。不仅是景色好，人文的文物也非常耐看，带小朋友的不错选择旅游点。,/Date(1507457815000+0800)/,0
76614538,本来是冲着虞允文采石矶书生抗金的故事去的。但是并没有太多宋朝的影子。但是小典故很多很值得一去，比如常胜春的大脚印，东吴赤乌井。景物很多很有意思。很好很好。美中不足的是山上道路众多，地图标注不清。,/Date(1504179268000+0800)/,2
81454743,如果喜欢李白或者古典诗词，就更值得去看看。&#x0A;景区管理规范，环境整洁，属于文明旅游景点。如果能在用活李白诗词作品方面加把劲，就锦上添花了,/Date(1486078607000+0800)/,5
150612082,很喜欢的地方，有李白纪念馆及雕像,/Date(1588571169000+0800)/,0
246126126,为什么在买票的时候，卖票不注明年满70周岁不要购买门票呢，希望你们做整改,/Date(1572949836000+0800)/,0
81032898,采石矶风景区环境清幽，绿树成荫，走在林荫小道上，空气清新，美景怡人。特别是江边临空栈道、三元洞和三台阁景点，美景如画，非常值得一游！,/Date(1492859044000+0800)/,3
13036430,没啥意思，全是爬山，没啥风景。,/Date(1620559717000+0800)/,0
2485409,很不错的地方，长江边上凭吊古人,/Date(1578958947000+0800)/,0
155326934,已很多年没有去过采石公园了，如今新整改的采石公园及周边街道，让人耳目一新，慢慢品味眼前的美景，不禁想起忆江南的诗句，美哉，乐哉！,/Date(1557113579000+0800)/,1
112932025,深秋来到这里，景色很难说很好了。但是也还不错，但是里面文化的东西真的很少，即使携程55元的门票也显得比较贵，同类的很多城市价格比这个低，甚至免票。,/Date(1573220268000+0800)/,0
96242370,十几年前来过，再一次游玩，感觉还是很好，李白大鹏展翅的雕像，三元洞的曲径通幽，还是以前的影子，重回旧地喜悦,/Date(1567484369000+0800)/,0
15952433,采石矶景色优美，古栈道依山而建，面朝长江，险峻而奇丽。三元洞、太白楼富有历史底蕴，春天尤其是在阳光明媚时，百花齐放，令人陶醉。,/Date(1491143264000+0800)/,5
110867797,没啥景色，就是一个大公园,/Date(1603263902000+0800)/,0
252277569,总体还行，就是路标有时候指的不明确，江景很美，爬山很累，哈哈哈。,/Date(1589205528000+0800)/,0
1467234,国庆节同家人去玩，人不多，有山有水有故事，还有李白的生平介绍，是马鞍山人的假日首选之地，唯一觉得门票太贵,/Date(1585520015000+0800)/,0
5097845,景点以看长江景色和李白文化为主，有关于李白的展览，看到了李白的手迹，很难得。长江景色也很美，还有一些古迹,/Date(1565250024000+0800)/,0
6491844,一个以李白为主的景区，感觉还可以，值得一游，自驾也可以把车直接开进去，挺方便，沿着长江栈道走一圈，虽说风景没有多好，但也还行,/Date(1486327557000+0800)/,3
5647174,携程的门票还是划算的，而且到景点定也来得及，景色美，有收获，出来到大浴场，绝对享受生活，在马鞍山不想走了,/Date(1412767389000+0800)/,2
26818310,还算可以，但不值得再来,/Date(1602295325000+0800)/,0
168326343,景色一般，门票有点贵,/Date(1594303021000+0800)/,0
3807156,不错，挺好，已经去了很多次。当地人不用买票的。景区挺大，可以玩一天，有索道。爬山也就是一两个小时吧。,/Date(1562587156000+0800)/,0
198212705,第一次在国庆期间出来游玩，真的是人挤人，站在三台阁上视野开阔，美景尽收眼底，还能看到长江，采石矶是马鞍山必去的景点之一。,/Date(1539061177000+0800)/,1
1811622,风景绝佳，不算拥挤，雨后的高楼仿佛仙境一般云雾缭绕，美极了！,/Date(1443918588000+0800)/,0
221809868,采石矶自然风景优美，景色漂亮，建筑古色古香，古树较多，牡丹园牡丹品种较多，工作人员服务态度好，自驾游停车方便，停车费便宜，只需5元，好评！,/Date(1555134061000+0800)/,0
121284917,节日一家人旅游，景色好，环境好，文化底蕴深厚。值得一去。虽然烟雨蒙蒙，但更增一份意境。明明白白消费，快快乐乐游玩，既锻炼身体，又陶冶情操。,/Date(1507214895000+0800)/,4
42120260,园林大，景色美。难怪无数文人骚客，在此留下了许多墨宝。李白的诗句随处可见，相传&quot;诗仙&quot;在这里醉酒后赴江中捉月，溺死于此，采石矶因此而闻名。,/Date(1492422839000+0800)/,2
90477960,很不错的一个地方，风景很好看。尤其是三台阁上往下眺望，真的有“一览众山小”的感觉，除了缆车有点贵之外，其他都很满意，会考虑下次再去玩的。,/Date(1493481131000+0800)/,0
21986859,雨后的采石矶很纯净，一片片绿色印入眼睛，就只有美的感觉。,/Date(1429026843000+0800)/,0
95274757,门票在网上买要便宜很多！景区其实很大！不是节假日的话应该没那么多人的！如果自驾出行还是走新建的北门交通方便！停车场好大的！取票也方便！,/Date(1538811654000+0800)/,0
45894928,环境挺好的，就是门票好像稍微或许可能大概差不多有点贵了,/Date(1450361444000+0800)/,0
41372590,"风景很不错，爬的路程不算很多,高300多米左右吧～所以不会很累，但也不轻松噢，爬到山顶还是很自豪的！一览众山小的赶脚很好！吼吼，里面还有李白纪念馆，蛮有意思的，值得去玩玩的。",/Date(1444133480000+0800)/,2
17918402,不错不错(*๓´╰╯`๓)♡666666666666,/Date(1568629343000+0800)/,0
149966736,采石矶是马鞍山人的骄傲，优美的风景，深厚的文化底蕴！林散之文化馆，太白楼，三元洞，三台阁，处处都让人感受马鞍山的悠久历史感触良多！一,/Date(1507183244000+0800)/,4
120076344,带着两岁的宝宝去爬山，我也是佩服自己了，环境很好，厕所非常多很人性化，也干净，爬山一开始走错了从右边走的，其实景点主要在大门的左边，只是团购60个人觉得应该更便宜些，挺好的,/Date(1505539531000+0800)/,0
4233383,景区打造的还可以，但是在票价和坐缆车的费用上还是让人有点不舒服。缆车居然连小宝宝还要半价。,/Date(1570288466000+0800)/,0
64914718,值得一去的景点，我们去时游人不是很多，可以在园中悠闲游览。看林散之书法，太白楼凭吊诗仙李白，观江水涛涛。人文自然的融合，值得一去。,/Date(1512379401000+0800)/,0
41051965,长江边上烟波袅袅，登上主峰马鞍山市一览无余，风光无限好，唯一缺点是旁边马钢的烟囱排污严重。,/Date(1441972778000+0800)/,2
412812,期望挺高的一景点，看似门票不贵，一进去就是电瓶车30，索道又30，里面的工作人员还指错路，误导我们去什么南门，结果我们6个孩子走的脚都断了。很多景点都封住了，有点可惜。,/Date(1570144753000+0800)/,0
65776996,星期天在公园里坐坐，感受一下氧吧，大树环抱，江边风景值得走一走，就是价格能再便宜些就更好,/Date(1569228599000+0800)/,0
16889409,风景不错，像私家园林，遵循着李白的足迹，索道一定要坐，第一次坐没有门的，脚下空空的，坐了两次，一口气爬到塔顶，一览长江的风景……,/Date(1559532032000+0800)/,0
2193168,景区挺大，最好安排半天时间。门票55元，好像不便宜哦～希望能降价✌&#x20;&#x20;登三台阁，看长江水，滚滚而去，莫名惆怅。,/Date(1557266615000+0800)/,1
1571030,采石矶让易让人联想起的历史名人当属李白了，但这里的风光确实值得留连。那些说两小时结束的朋友大约是只上了山顶三台阁看看了事的吧，强烈建议走沿江栈道，尤其是三元洞到蜗牛尾。印杉湖那里也漂亮的,/Date(1522025638000+0800)/,3
59625686,山水人文集中在一起的一个景点，景区还是很大的，就是新大门绕的有点远，带动电动车的生意,/Date(1559958240000+0800)/,0
97394493,景点很干净，有自然景色也有人文景点，对于来马鞍山的旅人来说，还是值得一游的。年满65岁的老年人免票，景点里的缆车票需要另购。,/Date(1538491274000+0800)/,0
16593291,5月12号自驾去马鞍山采石矶景区，应为有李白的典故，使得景点的门票价格稍贵。公园的绿化非常好，最为一座公园还是可以得满分的。,/Date(1526206826000+0800)/,0
214640,长江三大名矶，古时候就很出名。这里是景区，可以开车进去，也不算太大，但风景漂亮，周围古迹也不少，走走看看，很舒服，随意看看。,/Date(1505352074000+0800)/,4
236565734,景点不错，既有自然景观也有人文景观。景区游玩需要一定体力，全部游完大约五六个小时。,/Date(1570339927000+0800)/,0
26367949,景区里面很大，主要特色就是李白有关的几个地方，李白文化园不错，去的时候春暖花开的景色很漂亮，另外江边栈道因为长江水位的关系不是很好玩，爬爬山呼吸新鲜空气还是不错的,/Date(1522918809000+0800)/,0
8984116,风景如画…家里人一起去看看挺好的…赞一个…,/Date(1434974697000+0800)/,0
7097955,除了天气热，景色还是很美的，缆车很怀旧。,/Date(1570090164000+0800)/,0
121288624,走进采石矶就像走进了一幅山水画卷，江水环绕着名山流传诗仙李白醉酒捉月，坠入江中驾鹤成仙的传说，更有文学家郭沫若的亲笔提字,/Date(1556798170000+0800)/,0
92650798,爬山很累，在爬山的路边多设置些休息的凳子就好啦。景点外面停车不方便，最好在景点外面有些提醒景区内有停车场。一路爬山就是路边有些景点爬到山顶爬上高楼风景不错，就是天气太冷。山下的梅花不错，有的开啦，有的还是花骨朵。值得点赞。,/Date(1549888174000+0800)/,0
161125890,第一次来安徽采石矶，按照当地人来说就是一个公园，停车场需要开五分钟不到一点到，大门口收五元停车费，检门票就可以驱车进入停车场，下面有太白楼，李白纪念馆，往上走有大脚印，三元洞，最往上是三台阁，三台阁可以仰望长江，全程走马观花的爬了一圈花了三个小时～总体来说就是来看看古迹,/Date(1549707209000+0800)/,0
85616323,周末带孩子一起来采石矶参观游览，虽然已经进入冬天，不是来游玩的最佳季节，但是淡季游人很少，反而多了一份清净。空气真得很清新可游玩的范围很大，拍了很多美照。年纪越大越喜欢游山玩水的地方，越来越渴望亲近大自然，渴望远离尘嚣。今天的天气阴沉沉的，仿佛在诉说着青莲居士跌宕起伏的一生……,/Date(1543732887000+0800)/,0
39137811,提前在携程网上订了门票，便宜又方便。景区游客不是太多，园内植被很好，空气清新；古树参天，丹桂飘香；漫步竹林小径，感觉舒适惬意。沿途纪念馆里有好多古迹，身处其中，感受到了深厚的文化底蕴。顺着临江栈道，吹吹江风，然后拾级而上，登山三台阁，俯瞰长江，江景尽收眼底，乐哉！美哉！可谓是一个假期休闲的好去处！总得来说还不错，要说的是景区内指示牌少了，游客容易绕路，管理人员较少，服务有点跟不上。,/Date(1507470997000+0800)/,0
88573108,采石矶长江三大矶之首！相传李白于此醉酒捞月不慎坠江溺水而亡！景区内樱花盛开自然景观非常漂亮！太白楼为景区的精华所在建筑非常具有徽派建筑风格。进入景区让人眼前一亮！建造的非常精致奇石异草遍布其中，亭台楼阁错落有致！三台阁为采石矶的最高处从这里可以眺望一望无际的长江！与佛教名山小九华山遥遥相望！其他还有三元洞，仿古栈道，大脚印等等,/Date(1490774354000+0800)/,0
18596584,采石矶是长江流域三大名矶之一，傲然挺立于长江之上。是马鞍山市最有名的旅游目的地，也是国家重点级风景名胜区。采石矶自古以来，就是长江尤其是南京的门户，在古代发生过多次战役，如今还有遗迹保留了下来。它有名的原因，是来自于唐代大诗人李白，传说他醉酒葬身采石。采石矶的水上公园蛮不错的，环境清幽，秀丽宜人。,/Date(1474274274000+0800)/,4
47943817,冬季假期到采石矶一游，虽说这里是因李白在此揽月这一传说而闻名，但游览下来觉得自然风光也是不错的。景区内每处景点都有指示牌，可以跟着指示方向游览。三台阁在采石矶的最高处，可以步行也可乘缆车上山。徒步上山，大概要二十分钟左右。爬山的途中可能有点累，好在林间风景不赖，沿着山间的，周围形态不同颜色各异的树木和谐共生，空气当中沁着草木的芳香，能听到不远处传来的啾啾鸟鸣和和鸟儿穿梭于林间的声音。,/Date(1455384543000+0800)/,4
13632226,景区很大，山山水水，说是李白晚年生活的地方，有些诗情画意的那点意境，游山玩水谈不上，就当散散心还是可以的。景区外的古镇是新建的，没有人气，说是国庆节对外开放。,/Date(1566659274000+0800)/,0
109147012,虽然离家很近，但是一直没有机会去，这次带孩子去了，真的不错，从山下一直爬到三台阁，40分钟，孩子很给力，风景也很给力。,/Date(1493520399000+0800)/,0
220026665,马鞍山非差漂亮的一个公园景区，有很大的历史故事，绿色植物很多，双休可呀玩玩。,/Date(1581485571000+0800)/,0
3368782,总得来说还是可以的，性价比比较高。家人觉得都还蛮满意的，地理位置也比较好找。,/Date(1567166104000+0800)/,0
208482897,地方不是特别大，但是别有一番风味，特别是靠近长江，悬崖峭壁，激流浊水，特别棒,/Date(1566911017000+0800)/,0
156463453,去是值得去的，毕竟沾了李谪仙的仙气嘛。长江岸边的风景的确迷人，登上三台阁，可以俯瞰钢城全貌，心旷神怡。只是票价如果让我定价，最多50元。,/Date(1513502241000+0800)/,3
12868140,还是不错的地方，三台阁上风景不错，喝喝茶挺惬意，就是景区的指示牌还不够明确,/Date(1570244974000+0800)/,0
5778891,采石矶景色不错，只是节假日游玩人太多了。景点配套设施还有待提升，优化服务。,/Date(1562750677000+0800)/,0
10686830,景色宜人，山水相连，是长江三大名矶之一。自然景观和人文历史景观相辅相成，值得一游。有个很大的梅园，期待下次来赏梅。,/Date(1506406530000+0800)/,4
1137624,位于长江边的很漂亮的一个景点，山不高，还有缆车，风景优美，人文景观也好看,/Date(1570875391000+0800)/,0
235907886,非常好的经典，推荐天气不热的时候慢慢玩，真心不错，我去的时候实在太热了。,/Date(1570194759000+0800)/,0
150386895,景区里面好大，建议用一整天的时间；风景不错，也不是很累；拍了很多照片，五月三日去的，人太多了，也说明值得一游。,/Date(1556928138000+0800)/,0
185444358,人很少，算是比较精致的景点了。风景很好，就是景区太大了，带娃有点累。,/Date(1570109089000+0800)/,0
82714329,售票中心賣68元，攜程買便宜一點，但是要提前下單，不然要等一個小時。,/Date(1569132621000+0800)/,0
31970486,风景如画，空气清新。以后双休日会经常过来。采石的江鱼美味也值得品尝。,/Date(1567822122000+0800)/,0
246034408,好去处，建议游玩时不慌不忙，慢慢的玩！山不算太高，阁顶上风景不错。,/Date(1569975875000+0800)/,0
2452450,应该属于马鞍山的第一景点了吧？有典故，有风景；有山有水。登gaao,/Date(1561718371000+0800)/,0
49119077,风景不错，和南京的燕子矶差不多，但是各有特色。景区可以游玩半天，较为适宜。有山，有江，有亭，有阁。是一处不错的休闲及文化场所。,/Date(1504748416000+0800)/,3
47651938,团建活动去过……锻炼身体去过……陪家人一起去过……陪朋友去过……,/Date(1580226103000+0800)/,0
66434528,风景不错，下次再来，带上女朋友登高远望。心吖抻怡，体闲健身好去处,/Date(1571330737000+0800)/,0
489191,不错的体验，指示牌做的一般，周边环境也一般。乱扔垃圾的现象比较严重。美食区的体验比较差，人多量少又价高。,/Date(1570533851000+0800)/,0
4058986,感觉挺好，景点不大，螺狮湾很美，江景一般了，山上虫子太多了，哈哈,/Date(1560739241000+0800)/,0
84379710,风景很好，就是爬山有点累，有可以搭帐篷的草坪，很适合全家一起出,/Date(1570158342000+0800)/,0
239728854,景色很美，但因为赶高铁，没能好好玩。希望下次能蹭到免费的活动。,/Date(1566740160000+0800)/,0
27765007,很大的景点，环境不错，在长江边，可以沿着沿江栈道欣赏长江的美景,/Date(1566117903000+0800)/,0
22268461,这里是传说中李白骑鲸追月的地方，又是历史上著名的采石矶之战的发生地，景色宜人，富有文化底蕴，值得一游。,/Date(1539349361000+0800)/,0
4055511,自然景观，加人文典故，值得一游，景色不错，还有李白，虞允文，林散之等古今名人留下的足迹和事迹，漫步大江岸边，山间小道，置身天然氧吧，缅怀先贤。,/Date(1497235895000+0800)/,2
16314490,主要是冲着长江去的，太白楼没什么看头，三元洞和索道还不错。景色的确很好，花都开了。采石矶茶干也挺好吃的。去的那天有点雾霾，长江看的不是太清楚。,/Date(1488100744000+0800)/,2
240424070,不是太值得，68的门票，但是对本地人免费，里面也没什么东西，性价比真不高，可能山顶的三台阁和江边的三元洞还有点可以看的，其他的都是什么呀，学生建议借个本地同学的校园卡，可以免费😂,/Date(1618798788000+0800)/,0
65760805,不错，很好玩，值得一去是个很好玩的地方，停车方便景色优美好美,/Date(1570361929000+0800)/,0
247151518,爬山很累，但是江景很壮观，一家人玩的很开心，我们一行人小的8个月大老的也有83岁了，都坚持爬上山顶了,/Date(1570192473000+0800)/,0
2337257,很不错，比以前好多了，就是太大了，累人，最好请个导游！！！！,/Date(1570082886000+0800)/,0
71549565,和女朋友一起去的，玩了一下午，感觉很不错，江边的景色超级美。,/Date(1564537217000+0800)/,0
94108020,好好好好好好好好好好好好好好好好好好好好好好好好好好好好好好,/Date(1563844845000+0800)/,0
4067953,非常方便，景区总体环境还不错，值得游玩一下，大概需要5个小时,/Date(1561294540000+0800)/,0
38854654,景区不小，半天慢慢逛。林间小路不热，能适应。累了有电瓶车坐。,/Date(1560782227000+0800)/,0
99227318,景区风景很好，环境不错，十一来人气适中，不多。但有两点感觉不好，各种收费较之这样的景区来讲太贵了，景区里面的游览指示牌太少了，走走就会迷路。另外为什么网络购票要两个小时后才能用呢？,/Date(1507302608000+0800)/,4
15952433,春天的采石矶，景色更加宜人古栈道、三元洞、太白楼等，让人同时感受到深厚的历史文化底蕴，真的不虚此行。,/Date(1491145851000+0800)/,0
