27394450,景点算是很大，风景还算秀丽，但是感觉景点服务不是太到位，下雨天地面非常湿滑，手机屏幕都摔坏了。门票也很贵，本地人30元可以买年票玩一年，外地人却要80元一张。,/Date(1503301904000+0800)/,0
3424953,采石矶是突出子长江面的一块巨石，应为在三国时挖出五彩石头故名采石矶。背靠翠螺山，山上有李白衣冠冢，常遇春大脚印，望江阁太白楼，三元洞，金牛洞等景点，挺好玩的。,/Date(1476751699000+0800)/,0
25583195,十二年后再次来到这里，景点发现的很好。在导游的介绍下，更加了解了李白的晚年。,/Date(1419165228000+0800)/,0
78106402,空气好，人挺少，很漂亮空气好，人挺少，很漂亮空气好，人挺少，很漂亮空气好，人挺少，很漂亮空气好，人挺少，很漂亮空气好，人挺少，很漂亮空气好，人挺少，很漂亮,/Date(1508479913000+0800)/,0
18420085,环境清幽，长江旁4大石矶之首，不错，景区很大停车方便，可以直接开车进去，很好的地方，值得一去，沿江边有一条沿江栈道，总体还是不错的。。,/Date(1494647634000+0800)/,1
84324289,春日畅玩&#x20;吟诗作对&#x20;有意境美，非常不错,/Date(1493044347000+0800)/,0
22682793,马鞍山没什么好玩的，就一个釆石矶还不错。采石矶有个大青山可以没事来爬爬。茶干大概是马鞍山最有名的小吃吧，小地方你懂的，没什么大问题，适合居住，发展就算了。,/Date(1410989632000+0800)/,0
149363023,采石矶风景不错，地方很大，人不多,/Date(1556431336000+0800)/,0
51428895,没优惠的话票价80一张&#x20;说实在的&#x20;80块爬一座山&#x20;不太值&#x20;里面风景不错&#x20;就是山上路标太少&#x20;山上迷路好多回,/Date(1522140011000+0800)/,1
94669064,去的时候天气不错，感觉风景还可以,/Date(1509105616000+0800)/,0
34185583,没曾想这儿有李白的故事，本想看看长江，却意外收获了许多的历史，不枉此行也,/Date(1507207979000+0800)/,0
16176359,山涧有溪流，树木郁郁葱葱。有几处老建筑，值得一看。坐索道上山，登亭可看到长江的支流。下山时可以走下去，沿途有李白的衣冠冢，三元洞，沿江栈道，都可以看看。,/Date(1507044450000+0800)/,0
1506031,垂丝海棠满开；凭栏远望，回忆了不少李白的诗；缆车上山，慢慢走下来，不累。,/Date(1491311446000+0800)/,0
55109385,景点非常好！非常适合这个季节游玩,/Date(1491145359000+0800)/,0
56883218,采石矶边上就是长江，山顶建有三台阁，可以坐缆车上去，三台阁上远眺长江和群山，视野很好，江风吹着也很舒服，游览结束后可以买点当地特产采石矶茶干送亲朋好友。,/Date(1465468953000+0800)/,0
11879319,作为马鞍山人，采石矶还是比较不错的一个景点。临长江，植被丰茂。里面景点典故也比较多，多小孩的历史教育还是挺好的。,/Date(1421214271000+0800)/,0
197510443,总体来说还可以吧，就是太累了，,/Date(1537703908000+0800)/,0
7274191,风景还不错，导游图希望再丰富点,/Date(1507436816000+0800)/,0
150204540,很不错偶&#x20;&#x20;&#x20;&#x20;很有文化底蕴&#x20;&#x20;非常的划算,/Date(1507308875000+0800)/,0
20938073,景区很大，景色秀丽，值得一游。,/Date(1507285562000+0800)/,0
53389051,没什么玩的，但景色还是不错的。,/Date(1459097892000+0800)/,0
51475163,感受人文气息，感受大自然美景。,/Date(1456048371000+0800)/,0
44755131,门票是团的61，但是觉得不值得。园区内还在装修有点凌乱，标示也不清楚。院内草木也不修剪，唯一的亮点是沿江的栈道，适合喜欢徒步的人。,/Date(1445686135000+0800)/,1
21690221,很好的地方，有山、有水、有景、有文化底蕴，只是宣传不够，非常值得一玩。,/Date(1442714957000+0800)/,0
943183,十一长假去的没有其它热门景点的人山人海很值得一游，采石矶因李白而名声在外又因地理位置的独特，风景秀丽人文气息浓郁再者我是故地重游感觉很好，取票也很方便,/Date(1413084729000+0800)/,0
59945532,景色可以。人还不是很多。路线规划不是很好的人没有导游图。其他还可以。,/Date(1507362028000+0800)/,0
18905028,不错，就是价格有点小贵，开车交5元停车费可开到太白楼，游船还没有开。,/Date(1493457263000+0800)/,0
7999291,长江三大矶之首&#x20;值得一去的地方,/Date(1491662198000+0800)/,2
44583254,去的时候在建，景色挺美的，临江还能看江景，有烧烤，学生办了年卡就三十,/Date(1445484535000+0800)/,0
41059117,值得一游，景区内有三元洞，是建在长江上的，洞下就是长江水，很是奇趣。,/Date(1441942145000+0800)/,0
60490798,马鞍山最有名的景点，从东站坐四路公交车到采石下，步行五百米就到。百度地图可能不准。不过没什么意思，就是一个沿着水边的公园。唯一值得一提的是网购便宜，但要提前一天订票。,/Date(1529717355000+0800)/,1
16164977,里面真大，开车去的话进去前先提前换票，然后再买一张5元的停车票就可以把车开到景区里面；缆车来回40一人到顶，联系第一次去买单程到顶，然后走栈道回来,/Date(1508735360000+0800)/,0
38714908,携程上买的票，取票很快，景区很大，我们中午到的，只玩了一小部分。不过我们也爬了山，总体感觉还不错。里面的指示也比较明确。采石的茶干也不错。下次再来,/Date(1508466956000+0800)/,0
18780882,沿江的公园，适合休闲旅游，偶尔坐坐也不错。携程订单提示2小时以后有效，我1小时多一点就取到了。不足是门票贵,/Date(1507096332000+0800)/,0
18780756,来这里玩一定要看季节，冬天没什么可看，春天有梅花，桃花，海棠，牡丹，芍药什么的，晚一点还有八仙花，还有竹笋（但禁止采墒的），3月中旬以后都有看头！,/Date(1404920858000+0800)/,0
5497617,赶上五一，又遇马鞍山本地市民免费游采石矶，人数，可以想象了吧。丝毫没有想玩的心思了。路上参观了李白衣冠冢，三台阁，很多被暂时封闭了。下次再来吧。,/Date(1556858487000+0800)/,0
452322,景色还不错吧，不过80元的门票还是定价太高了，这样的公园应该10-20元的样子才比较的合理。。。。。。。。。。。。。。。。。,/Date(1538277540000+0800)/,1
4215775,采石矶是国家级风景名胜区，也是长江三大名叽之一，有很多著名诗人来此题诗咏唱，历史上的采石之战也是发生在这里，景区有很多景点，如翠螺山，太白楼等。,/Date(1534387698000+0800)/,0
5106975,去的那天天气格外好，暖暖的，空气润润的，作为旅游二线城市，难得的在春节期间那么少的人，清幽宁静，很是喜欢,/Date(1455592684000+0800)/,2
43511697,采石矶挺好玩的虽然都是爬山但总比每天都在宿舍里好风景很不错很喜欢,/Date(1452359163000+0800)/,0
51078012,有机会的话还是值得一去，特别是古栈道和天一阁。整个景区都很棒！,/Date(1461451043000+0800)/,2
25676046,非常不错很好，下次还去，景色很美就在长江边，能感受到滚滚长江的魅力。跟长江可以亲密接触。给人的感觉非常好。风也很大。铁索桥给人一种飞度的感觉。,/Date(1435760817000+0800)/,0
1316628,上学时，可是没少去，风景很美，临江而建，还有隧道，索道，古道，都是古时候打仗用的，里面还有李白博物馆，山上还有衣guanjiong就是他的墓。,/Date(1399688863000+0800)/,0
94539589,两张票分开买了，之前点评写过了，参见那一条，谢谢。不会再去了,/Date(1570170336000+0800)/,0
189119317,《三伏出梅游徽界采石矶有感》日上三竿游采石，汗蒸自洒敬诗仙，风骚墨客不再有，伟人心境荡无存，只留青山伴栈道，滔滔江水书春秋，风流人物数今朝。,/Date(1533170667000+0800)/,0
31749666,非常好玩，已经来过两次啦，尤其是长江古栈道。有文化气息，山上的风景也很好，非常的阴凉，适合两个人一起漫步在这里，空气也很好，是吸氧的好地方。,/Date(1508676652000+0800)/,0
4296138,休闲、散步、旅游的好地方，李白故居的花园如诗如画，沿江长廊、长江风光....多很有特色，真是好地方。,/Date(1445666887000+0800)/,0
1820922,采石景点很有人文气息，值得一游！感觉美中不足的就是宣传力度和包装不够，从高速进马鞍山市区竟然没有明显的标志物或指示牌，景区服务和包装不够完善。&#x0D;&#x0A;相比浙江许多小地方，采石的文化底蕴和历史典故要强的多，但旅游人气比起浙江差不少，期待旅游设施和服务能包装的更好！在这方面政府有义不容辞的义务。。&#x0D;&#x0A;http:&#x2F;&#x2F;photo.niwota.com&#x2F;personal_photo.jsp?dirid=248748&amp;id=36401639&#x0D;&#x0A;摘录的图片。,/Date(1200296057000+0800)/,1
53960760,订票很方便，几乎马上完成。取票顺利，给窗口看过数字验证码后马上出票。初七景区人比较少，玩得很开心。,/Date(1519305399000+0800)/,0
2820834,凭心而论，是个风景优美的所在，大江蜿蜒而过，一览无余，不过马鞍山的雾霾妨碍了视线，大大影响了心情！,/Date(1518168092000+0800)/,0
72037351,4月3日自驾去的，取票很方便，自然景光不错，很适合一日游。,/Date(1491438331000+0800)/,0
57600055,还可以，一开始觉得秋天去肯定是没啥景色，没抱任何期望的。,/Date(1510559373000+0800)/,0
43866496,采石矶风景还可以&#x20;&#x20;&#x20;&#x20;景区卫生环境一般&#x20;&#x20;服务一般&#x20;&#x20;&#x20;&#x20;景区工作人员懒散,/Date(1507206939000+0800)/,0
31747715,环境和景色真心不错，南京，芜湖等周边的游客纷至沓来。既有人文气息又有自然景观。景区很大，虽然假期很多游客，景区里也不拥挤。很适合休闲游。,/Date(1491528868000+0800)/,0
27110572,国庆陪父母去的，从芜湖出发，开车1个多小时。景点就是个大公园，特色是李白的太白楼与沿江的仿古栈道。适合附近的去玩玩，外地人特意去没必要。,/Date(1475843684000+0800)/,0
169950004,网上买门票，为啥&#x20;要等一小时之后&#x20;，&#x20;才能进？有点不理解！️,/Date(1567005498000+0800)/,0
61585885,文人古迹！值得一游，可是只能从北门进，东门出，不太放便,/Date(1557122561000+0800)/,0
167411826,风景还不错，就是感觉游客设施太少还有那些精品超市太少。,/Date(1521337429000+0800)/,0
3561273,采石矶门票80了吧，现在作为4A级旅游景点来说，建设得还可以，建议请一名导游讲解一下，不然光看景太没意思了，要听听历史故事才不算白来。,/Date(1470637765000+0800)/,0
26171884,怎么说也是4A级别的风景，在马鞍山来朋友是必要去的几个地方之一，出门带个背包，带点吃的和水也不要太多。也就在上山4-5个小时就完全够了,/Date(1443086797000+0800)/,0
557432,虽然我们去的那天天气不是特别好，所以看上去有些灰蒙蒙的，但是还是挺美的。原来这里还与李白有渊源，这倒是来了才知道。这个也算长知识了。,/Date(1558438586000+0800)/,0
4351060,采石矶景区面积较小，主要是围绕诗仙李白的人文资源，自然风光较普通。太白楼是全国重点文保单位。,/Date(1552179256000+0800)/,0
200962707,很好，由于时间关系，今天只是走马观花，天气也不是很好,/Date(1539610129000+0800)/,0
103116179,许多年没去采石公园了，今天陪同远方来的亲戚游览采石公园了，真的很惊讶，变化很大，景色优美，环境幽静，卫生干净，是马鞍山旅游的好去处。,/Date(1512259512000+0800)/,0
76389484,景区看似不大，但也要走上半天，人不多可以很好的拍照，秋天的景色很好哦，适合带孩子和老人游玩。,/Date(1511924426000+0800)/,0
13524355,门票虚高，不值得，十分之一的票价还算合理。南京很多景点都比它好，都不收门票，反而吸引大家一起去玩，消费的花销比门票要贵多了，不会算账,/Date(1467124491000+0800)/,0
31738783,非常不错的自然风景，没什么商业化氛围，出乎意料的好！,/Date(1443167604000+0800)/,0
1082651,小而美的好地方，露营的好去处，长江一览无遗，眼界大开,/Date(1439015594000+0800)/,0
19052590,早日仰慕采石矶这个地方，开始绕道去看一看的，风光不错，只是空气不怎么好，若是晴好天气，登高望远，无限风光会尽收眼底，有机会还会再去！,/Date(1427595715000+0800)/,0
955312,景色很美，自然景观相当宏伟又有些小情调。票价凭什么这么贵啊，故宫才60！,/Date(1419001241000+0800)/,1
18792433,景色秀丽，特别是水中有树的那一片景色，真是让人留恋忘返。古践道成了儿子探险的场所，江边的景色真美。可能是旅游淡季，景区内没几位游客。,/Date(1403341888000+0800)/,0
5772325,采石矶是江中一个小岛，小岛上矗立着巨石，俯瞰长江。随着城市建设，大门已是好酒不怕巷子深了！,/Date(1529470840000+0800)/,0
35360389,记得初三时，家里条件不好，学校组织春游去采石矶，家人没上去，一直是心里的一个梗，一直念叨着一定要去一次，里面了景色不错，有文化底蕴,/Date(1515735241000+0800)/,0
11739396,没想到小马居然还有这么好的地方！环境优美，风景秀丽，特别是在三元洞旁看长江，大江东去浪淘尽！心情沉淀下来了，是个放松心情的好地方！,/Date(1507981815000+0800)/,0
81335012,风景不错，管理上有欠缺。游人不是很多，适合休闲游。,/Date(1506662218000+0800)/,0
3678136,一般般一擦擦擦擦擦擦擦擦擦擦擦擦擦擦擦擦擦擦擦擦擦擦擦擦擦擦擦啊擦擦擦擦擦擦擦擦擦擦擦擦啊,/Date(1479380321000+0800)/,2
50133271,采石机我从小对它就有好感.因我非常爱吃釆石干子.因为釆石干的来厉可能和采石机有关吧.我又是南京人.离釆石机景区又不算太远.故此一游,/Date(1467412250000+0800)/,0
33009376,很好的一个地方，下次还要来。哈哈哈哈，带着家人来。,/Date(1450668691000+0800)/,0
13305823,风景如画，但是门票有点贵，比北京的皇家公园贵上许多,/Date(1447196007000+0800)/,0
2530364,环境很好，文化底蕴好。适合休闲，周末游，也不算远，,/Date(1442307651000+0800)/,0
41489232,非常值得去的地方，不光景色优美，而且小吃也很实惠。,/Date(1442177850000+0800)/,0
6780928,采石矶应该是最小的国家级重点风景名胜区了吧，面积只有一平方公里。不过里面的景色很棒，很丰富，既有秀丽的园林景观又有壮阔的长江水色，人文景观也十分丰富，总体来说像是一个巨大的江南园林，很漂亮。,/Date(1409901085000+0800)/,1
174723348,2018年10月4日去的采石矶，景点不拥挤，景色一般，作为休闲爬爬山还是不错的。门票价格贵了点，55元，还是网络价格，有点不值。,/Date(1538650126000+0800)/,0
71215942,总体行程很愉快，景点还是比较大的，可以爬山，可以看看园林，可以在制高点的楼上一览马鞍山的全貌，可以一览江心洲，还可以看涛涛的江水,/Date(1507248253000+0800)/,0
3437479,公园很大&#x20;李白纪念馆后面的花园很美&#x20;山上看长江很漂亮,/Date(1507124656000+0800)/,0
1310572,路标应该再丰富些！很多岔路口没有指示牌；门票太贵。我下午4点入园，还收全价80，不太合理！太白楼的讲解都下班了，3台阁也关门了。,/Date(1467866108000+0800)/,0
39813788,竹海林立，风景优美，空气清新，是踏青游玩的好地方,/Date(1445261706000+0800)/,0
20715897,亲子游，上山遇到大雾，有点遗憾。亲子游，上山遇到大雾，有点遗憾。亲子游，上山遇到大雾，有点遗憾。亲子游，上山遇到大雾，有点遗憾。,/Date(1444277451000+0800)/,0
21964825,基本是自然景观，景区的指示牌系统还是需要加强的。,/Date(1443963358000+0800)/,0
37343530,马鞍山首屈一指的文化景观区域，景色宜人，风光无限,/Date(1441262748000+0800)/,0
6037890,不错江边的景色很漂亮三元阁顶上看到的风景赏心悦目,/Date(1424616274000+0800)/,0
12980554,采石矶以前是个不起眼的小公园，不需要门票，现在修建后要门票了，还不便宜。以诗仙李白为灵魂打造的文化公园，还有我国书法艺术一代宗师&#x20;林散之先生的书法挂在书法馆内，供人欣赏。,/Date(1415953004000+0800)/,0
20653277,作为三大名矶的采石矶风景还是不错的，不过作为携程订票的客户去换票觉得不是很方便，问了几个窗口才问到换票的地方，希望有醒目的标记。,/Date(1412809720000+0800)/,0
11979201,环境优美空气清新门票也比较实惠，很适合春游出行，爬山虽然很累但真的是放松身心的好去处。尽量避免节假日高峰期，驱车前往需排队进门。,/Date(1396660949000+0800)/,0
63915812,带爸爸爸妈妈一起去的，他们很高兴，景色很漂亮！,/Date(1507967974000+0800)/,0
1683526,长江三矶之首，名不虚传。李白文化悠久。翠螺山下郁郁葱葱，空气清晰。三元洞紧贴长江，很壮观。在山顶可以俯瞰马鞍山及长江。值得一去,/Date(1507525018000+0800)/,0
8885933,穿一双好走的鞋，带一个好使的女朋友，准备足够喝的水。不要跟着熊孩子，不然吃不到冰棍。&#x0A;竹园那儿挺不错，尤其是林散之艺术馆附近。,/Date(1471093450000+0800)/,0
35807786,团购的票还比较格算，80元一张略显贵，风景一般,/Date(1444191846000+0800)/,0
16680157,一如既往的好，记得十几年前去过，现在去还是很好,/Date(1442712221000+0800)/,0
2941675,蛮有特色的景点，门票不贵，地方好找，风景非常佳,/Date(1425047784000+0800)/,0
217834679,一般般，没什么特别的印象,/Date(1574737990000+0800)/,1
41872515,里面很大，带着孩子就没来得及转了，如果有空闲时间，在里面玩玩是很不错的，外面的茶干买了，感觉不是很好吃，吃饭的地方也不咋的！,/Date(1556869412000+0800)/,0
46235929,这个景点古树参天，遮天蔽日。黄金周里人不是很多，很幽静。栈道很值得一走。印象最深的是林散之纪念馆，可惜没有导游讲解，看不懂。,/Date(1507293266000+0800)/,0
121245596,没想到十一长假竟然人少，空气特别好，环境干净，江景不错，吹吹江风很爽，周边有采石矶干子特产，景区门口有饭店吃饭，总体还不错。,/Date(1507022706000+0800)/,0
8073182,门票就写个小纸条，交5元停车费可以开进去1.2公里停车，进去有个小花园还不错，然后滨江栈道走走吹吹江风，天气太热没有去爬山。,/Date(1501421114000+0800)/,0
50811058,网上购票真的很方便。&#x0A;&#x0A;不过说实话，这样的景点，收取这样的门票，价格真的显得高了。园区虽然扩大了，但大部分都是常见人造景观。,/Date(1490532047000+0800)/,0
42495003,采石矶风景优美，，，三台阁爬的还是比较累的。,/Date(1443579335000+0800)/,0
40440736,小城市挺好的。安静舒服。很方便的。真心不错。,/Date(1440909802000+0800)/,0
25829862,年轻人不推荐坐缆车，会失去很多风光，推荐检票后南向逐个游览景点，比较全面，注意景点指示，我最后爬的三台阁，马鞍山市一览无余。,/Date(1414666439000+0800)/,0
1937197,大年初六去的，人不多，景色还不错，空气很好,/Date(1519210866000+0800)/,0
3396415,景点很一般，山路不好走，不建议带小孩游玩。,/Date(1507342825000+0800)/,0
27682722,风景秀美，三台阁壮丽，太白楼古朴，值得一游,/Date(1494033127000+0800)/,0
12057581,马鞍山比较小，采石矶风景不错，离南京也近！,/Date(1449191865000+0800)/,0
44104126,很漂亮，风景很好，而且干净卫生，门票也便宜,/Date(1444819589000+0800)/,0
23593895,是一座自然景观和人文景观相结合的天然公园。绝壁临江，水湍石奇，历来又以其山水之险、风物之秀独领风骚，被誉为“天下第一矶”。,/Date(1415842370000+0800)/,0
69115505,景点一般，没啥特色，没事逛逛还是可以的。,/Date(1570521600000+0800)/,0
28084427,很休闲的公园，地方很大，可以逛一整天。江边的景色很美，太白楼后面的花园也建的很好看。市价68，网订还是很划算的，取票快。,/Date(1557371240000+0800)/,0
4845076,景色好，人文景观几乎没有，就看看江，还要这么贵的门票和索道，有点不值。&#x0A;江水还是不错的，除此以外，几乎没有看的。李白纪念馆就是以前地主家改的，问题是这个地主家的房子也就剩余了十间左右。&#x0A;门票上的那些景点都是可去可不去的。,/Date(1545749351000+0800)/,0
197665538,风景还是不错的，门票要是再优惠些就更好了,/Date(1537704702000+0800)/,0
1571030,马鞍山必去景点，里面非常大，可以逛上一整天。最重要的景点包括山下的太白楼、山顶的三台阁和江边的三元洞，沿江栈道一定要走走，虽然比较长，但风景很好而且坡缓路好。上山顶普通人根本无须坐缆车，从中间山道走上去也就半小时。另外印衫湖那里的夕阳很美，一座新大门就开在湖边。,/Date(1526026684000+0800)/,0
92331530,小时候春游去过的地方，若干年后重游采石矶。喜欢在沿江栈道边走边观赏长江风光。现在是冬天尚且惬意十足，如果是夏天走在树荫下，吹着江风一定更舒服。登上三台阁远眺四处尽收眼底。看着江中的船儿在眼前缓缓驶过，心情也跟着放缓许多。李白衣冠冢似乎被遗忘在了角落里。大脚印旁边居然有几个管子，真的很破坏风景。小时候我还上过大脚印的,/Date(1514119525000+0800)/,0
156398874,采石矶风景区是国家4A景区，是一处以诗仙李白为中心，以深厚的历史文化内涵为底蕴，以高山丛林自然景观为特色，以文化欣赏，自然景观和休闲为一体的综合性风景名胜区！&#x20;冬天的采石矶也特别美，因为去时已经下午3点多了，这个点游人少，停车场空位很多！先去了李白故居、纪念馆，然后信步&#x20;走台阶，两边的树木已经被染上了各种颜色，从高处眺望，层林尽染。&#x0A;,/Date(1513429816000+0800)/,0
1274203,上午去人比较少，先向左走到李白衣冠冢那条路，一路向上，到顶登上楼，看长江气势恢宏,/Date(1507450495000+0800)/,0
60496633,2017年10月6日，一行五人到采石矶赏景，尽管全国许多景点都报道人山人海，但是采石矶却依然风清云淡，既没有人潮拥挤，也不幽暗冷情，一切都恰到好处，尽在不言中，景区内有李白祠堂、林散之纪念馆等人文景点、也有临江栈道、山顶塔楼等历史景色。我们登顶爬上高楼观望长江，顿觉得江山如画、美不胜收。唏嘘感慨不已，登高远眺比之武汉黄鹤楼更有过之而无不及。值得向各位携程游客推荐,/Date(1507436462000+0800)/,0
2617278,景区外面有个山门，自驾只能开到那里，当地维护景区秩序的人讲可以把车停到外面一个停车场（10元），呵呵。步行500米到了大门口。门票是在携程上提前买的，取票进门。景区基本属于公园性质，园林景观收拾的很好，这个季节都是桂花香味。走了一段不算短的路（后来知道可以做大门口的电瓶车）来到太白楼，此楼基本可以忽略不计，因为除了一片徽派建筑之外，几无他物。继续走，是缆车。上下四十块。下雨，我选择缆车，到了山顶看了看长江（如图），然后就下来了。整个景区内外都让我有种：这就是个街心公园的感觉。门票大几十块实在是有些贵。建议当地旅游部门好好想想办法，要么调价要么加强服务。安徽本地人很和善，就是景区显得“空”，也许跟天气有关（下雨）。希望以后改进，不辜负长江三矶的名声。,/Date(1506938103000+0800)/,0
94119365,我们提前一天买的票，第二天到柜台取很方便。景区里面很凉快，人不多，孩子们很开心。,/Date(1503841626000+0800)/,0
3371988,离南京很近，开车可以直接到景区。&#x0A;与大诗人李白的佳话让采石矶多了浪漫气息。事实上江边本来就极壮美。林散之馆也颇值得参观。,/Date(1496111237000+0800)/,0
81798959,景区内很适合拍婚纱照哦。（昨天正好碰上）,/Date(1493543945000+0800)/,0
