43246152,国庆放假第五天去的，人不是很多。天气很舒服，登三台阁可以很清楚的看到长江和长江大桥。在太白楼了解李白的生平，对孩子来说挺有意义。是个值得一去的地方。,/Date(1538745019000+0800)/,0
19266049,非常不错，值得好好闲逛一天，有江景，有山，有塔，有河，有人文书法等！,/Date(1519904835000+0800)/,0
14369058,门票比年卡还贵，里面的山不高，建议别坐缆车，比较适合夏天一个人来避暑,/Date(1506385644000+0800)/,0
15949311,山上虫子太多。周末去爬爬山锻炼锻炼还是不错的选择，环境还可以。山下的采石矶镇感觉较乱，没治理好，很破旧。山上树木长了数不清的毛毛虫，看得起鸡皮疙瘩。,/Date(1481612623000+0800)/,0
36478908,值得一去的地方，风景优美，吹吹江风，吟诵一下李白的诗词别有一番风味！,/Date(1479116965000+0800)/,2
863002,很不错的景点，慢慢都是回忆，但是好像还在建设，希望下次去的时候建好了,/Date(1465859855000+0800)/,0
199847823,很方便，景区也很不错，可惜去得有点晚，没游览全，下次可以再去一次！,/Date(1548577356000+0800)/,0
84151836,景区非常美，就是门票贵&#x20;&#x20;&#x20;&#x20;最近才知道可以办年票&#x20;&#x20;一年才30。。。。。。。,/Date(1542582596000+0800)/,0
10525829,很好，爬山或游园都很适合，值得各个年龄段的去。,/Date(1519083325000+0800)/,1
95140645,一行三人，里面比南京的燕子矶大一些，风景还是不错的，就是价格有点贵,/Date(1515968858000+0800)/,0
19687223,环境很不错，空气比较新鲜，节假日人也比较少，是个旅游休闲的好地方。,/Date(1507348789000+0800)/,0
61925436,景区很大，登上山顶，山风吹着很舒服。下山路上蚊子较多，叮了不少包。,/Date(1503236653000+0800)/,0
1141246,网上订票方便快捷，景点中规中矩自驾车可以开入景区內，适合家庭出游。,/Date(1494988796000+0800)/,0
28842424,不错啊，办的年卡。山清水秀，空气清新。端午去的还有龙舟比赛，不错。,/Date(1482658077000+0800)/,0
187228,长江最著名的矶，风景优美，并有着诗仙李白的文化背景，马鞍山的标志。,/Date(1462194351000+0800)/,0
,以前在马鞍山上学的时候，20块钱办年票，一年去N次，感觉还不错。山不高，从山脚沿小路跑上去，10分钟就能到三台阁。长江边的古栈道不错，值得一游。。,/Date(1259823638000+0800)/,0
1486024,很舒服的景区，虽然没有惊艳的华丽，但文人墨客喜欢它不是没有道理的。,/Date(1158991105000+0800)/,0
67596932,景区很多人，好多人在里面露营，有循环电瓶车，往返需要费用三十元，但是人太多，车又太少，排队需要很长时间。,/Date(1557012917000+0800)/,0
35995467,采石江边一捧土，李白之名高千古，来的去的写两行，鲁班门前弄大斧。,/Date(1554030124000+0800)/,0
154814689,风景比燕子矶好，不虚此行，但门票太贵了，当地人身份证办年卡才30,/Date(1512349480000+0800)/,0
6365313,能看到长江，公园里景色也不错，不太高，建议可以不用坐缆车上去的。,/Date(1507511405000+0800)/,0
39605449,风景不错。请了导游，讲解很专业。总体来说，采石矶是值的一去的景点,/Date(1507465368000+0800)/,0
40086139,采石矶还是不错的，爬爬山&#x20;乘乘缆车&#x20;对于休闲游的我们来说是个好去处。,/Date(1507287915000+0800)/,0
43620564,很好dfggxxdfghhjhgffffff,/Date(1502860563000+0800)/,1
3283501,这个景点集中了自然、历史、人文景观，值得一游,/Date(1475815299000+0800)/,1
2681874,很漂亮的地方，是诗仙李白故老之地。希望再增加一些有娱乐性的项目。,/Date(1474150630000+0800)/,0
43818544,整个景区很大，风景很不错，山也不高，很适合一家老少攀爬，抱着一岁半的宝宝也不是特别累。下山缆车有些简陋，有点怕怕。整体不错。山顶卫生间不太干净。,/Date(1444199534000+0800)/,0
21784696,马鞍山采石矶风景可以，景区订单确认很麻烦，电话联系好几次携程客服才帮助解决。在景区门口耽误半小时才进去，还好，风景还可以的，半天游，时间足够了。,/Date(1439794875000+0800)/,0
541112,交通不便，環境很好，陽光很充足，週末全家人做個聚餐還是不錯的選擇,/Date(1424773314000+0800)/,0
9370299,从合肥归途中前去游览，没想到真不错，坐缆车上山，长江一览无余，,/Date(1545455423000+0800)/,0
9370299,"站在江边山顶塔上了望长江心旷神怡，长江在这儿1分为2，船儿在滚滚江水上慢慢行走，回首望去,马鞍山城尽在眼前。远处的山峰时隐时现，这儿风光无限。",/Date(1515295545000+0800)/,0
53433528,挺不错的，人不多，适合随时过来走走，竹林尤其好看，去时梅花初绽,/Date(1514709498000+0800)/,0
37840846,园内指示牌有点乱，全园的地图应该多放一些，不然容易错过很多景点,/Date(1510373339000+0800)/,0
88759012,服务很好，本来要等2个小时，服务员帮忙核实信息后，就让进去了。,/Date(1508303354000+0800)/,0
24528019,国庆假期去的，上午人不多，看到大江东去。登上三台阁，看到了江心州。马鞍山长江大桥。小九华。站在古人作诗的地方，感受当时的状况景色！心情很流畅！,/Date(1507538479000+0800)/,0
16963219,景区不错，挺漂亮的，太白楼，三元洞，三台阁，都不错，值得游玩。,/Date(1507344626000+0800)/,0
3713193,就在长江边上，风景很不错，缆车很好玩，交通很方便，离市区很近。,/Date(1507342988000+0800)/,0
25639508,景致还是不错的，特别是在雨中游玩。李白纪念堂也是值得去的地方。,/Date(1507245122000+0800)/,0
1751124,这个景区非常不错！景色好，景点大，还能学到很多李白的诗歌和生平事迹。对上学孩子来说，是一个绝佳的去处。,/Date(1507038249000+0800)/,0
76660822,风景宜人，讲解很差，就讲了太白楼，和三个小景点，收费150元！,/Date(1499468484000+0800)/,0
85023681,最美还是家乡，在春光明媚的季节回家乡的景点散散心，感觉真不错。,/Date(1495085199000+0800)/,0
104189275,景点还是不错的，绿化很好，景区很大，还算精致，适合一家老小踏青,/Date(1492238745000+0800)/,0
3693382,赞，去出差刚好有空去玩，提前买好门票，到景点验好很快就进去了。,/Date(1489207603000+0800)/,0
29317546,可以吧。人文自然都有。但马鞍山只有这一处景点，专门去有点无聊。,/Date(1444044827000+0800)/,0
7494444,去年十二月，一个人去了采石矶，因为是冬天，所以所见之景只能说一般般。但是当时游客很少，确是我想要的，一个人马鞍山采石矶，来这儿有些非凡的意义！,/Date(1440073221000+0800)/,0
6809656,长江三矶之一，总体感觉不错。车子可以开进去，李白衣冠冢太白楼。,/Date(1420257262000+0800)/,0
174984806,这里是国家著名的风景名胜区之一，景色秀美无比，极具观赏价值！,/Date(1554271784000+0800)/,0
48211775,还不错吧，春秋更好玩，差不多三个小时。就是索道下班时间比较长,/Date(1549171647000+0800)/,0
89926238,古栈道没体力真不行，带娃的走两步返回就行，没有任何景观。。。,/Date(1519300808000+0800)/,0
45361130,江边景色还不错，人不算多，就是电子票取票时间8：30，有点晚,/Date(1514262827000+0800)/,0
156463453,非常好，比实地购买门票省了20多元，方便快捷又实惠，全好评。,/Date(1513501794000+0800)/,0
58751164,总体感觉还不错，爬到山顶上看四处的风景很美，还可以看到长江。,/Date(1507125275000+0800)/,0
1920411,很方便。在景区购票处换票入景区。提醒，需要提前两个小时购买。,/Date(1507089905000+0800)/,0
53545428,去过之后，感觉山上的偏太多，看了恶心。带着父亲去玩的，总体印象还行，就是价格小贵,/Date(1504277462000+0800)/,1
104231144,风景还是不错的。适合拍拍照片，随便走走。,/Date(1502942237000+0800)/,1
43330166,白完之地，李白失足，千古之恨。景色宜人，环境优美，值得一游！,/Date(1496038085000+0800)/,0
92285701,来到采石矶，看到了广阔的长江，太白楼，三元洞等，不虚此行了！,/Date(1494727312000+0800)/,0
18484169,外公的家乡。李太白的衣冠冢在那里。那里的干子也是非常出名的。,/Date(1402461203000+0800)/,0
1520562,但停车的票交钱是在售票处，门票的换票是在客服中心，跑了两趟。,/Date(1402362213000+0800)/,0
7498202,大约十年前来过，这次重邮故地，变化很大，景观作了修缮，不错。,/Date(1399861530000+0800)/,0
7498202,大约十年前来过，这次重邮故地，变化很大，景观作了修缮，不错。,/Date(1399043072000+0800)/,0
40617577,马鞍山是个有历史的城市，采石矶很值得去,/Date(1546917824000+0800)/,1
186578021,马鞍山的品牌，马鞍山的名片。希望越来越好，加强维护、建设!,/Date(1533357930000+0800)/,0
51078012,位于马鞍山的一处景区，风景极好，景区面积很大，细细逛下来需要一天的时间。特别是临江栈道，一定要去。,/Date(1528106944000+0800)/,0
3817299,主要是围绕着李白的景区。对于采石矶的历史相对介绍少了很多。,/Date(1510736980000+0800)/,0
494111,停车场离景点好远，景点人不算很多，景区很大，走路挺累，还好有观光车，还有索道。可惜标示不够清楚，有几个想去点景点没找到，有的问了人才找到。,/Date(1509355525000+0800)/,0
14946585,从定票到取票都极为方便，如果有半票可以直接购买那就更方便了,/Date(1507172795000+0800)/,0
9174131,很美，开阔的大面积草坪，小桥流水树荫花卉。。。&#x0A;&#x0A;途中遇到某某婚纱摄影在拍外景，联想到哈尔滨森林植物园里有一片空地开发出来专供摄影的基地。,/Date(1503456070000+0800)/,0
635370,采石矶临江而立，景色秀美，值得来游玩！,/Date(1491689422000+0800)/,1
42113962,儿时和爸妈一起来，多年后和新婚老公一起来。寻找童年的记忆～,/Date(1490236250000+0800)/,0
71789712,李白衣冠冢，博物馆，项羽的马鞍大脚印等，以及江南美景，相当不错，就是门票不便宜，一般办年票最划算。,/Date(1475738404000+0800)/,0
37453191,还算可以只是像这种一般的旅游景点应该是开放型的不应该收费～,/Date(1438129957000+0800)/,0
59906660,风景不错，停车比较困难，可以慢慢逛一天，里面有缆车到山顶,/Date(1551513843000+0800)/,0
86921014,主要有李白的祠和纪念园，也许阴天的关系，蹬楼眺望长江，一片雾茫茫。景区内停车收费5元不算贵，但敞开式的缆车单程30元，上下同价有些贵且不合理。55元门票价也稍贵。景区服务一般。,/Date(1549719902000+0800)/,0
5813628,不错的，基本上包山了，年前玩的人不多,/Date(1549010971000+0800)/,1
8990366,景区挺大的，植物很多，空气很好，最后爬上顶峰的感觉很爽。,/Date(1535786826000+0800)/,0
25811201,有山有水，栈道也很漂亮，休闲很不错的去处，门票略低更好。,/Date(1522631808000+0800)/,0
112547176,在马鞍山很多年都没有去过，最近专程去了一次，意外的惊喜。,/Date(1514704780000+0800)/,0
105318960,长江三矶之一，历史悠久，是传说中诗仙李白跳江捉月的地方。,/Date(1512140598000+0800)/,0
4689587,比想象得大多了，依山傍水，感受诗人得气息，适合全家游玩。,/Date(1508659963000+0800)/,0
149504440,不错啊，我们带孩子一点进门，5点出来，玩得一点压力都没有,/Date(1507037539000+0800)/,0
53170106,马鞍山采石矶不愧为长江三大名矶之一！风景秀丽，景色宜人。,/Date(1493464303000+0800)/,0
3483938,"江边公园很美.给人遐想.只是绿化太少,刚种下的树,太小.",/Date(1444389951000+0800)/,0
2197509,"很久没去了，变化挺大的。携程网上预订的票,非常方便,而且价格还便宜。自驾出游，车也能进景区,节假日陪亲戚一块去转转真是很不错,推荐出行!",/Date(1432104244000+0800)/,0
17419992,诗城&#x20;李白据说就投江葬身于此地&#x20;还蛮值得来看一下的&#x20;人文景观多,/Date(1401950529000+0800)/,0
198357532,景区还可以，爬山比较累，三个小朋友和我们一起爬上山顶。,/Date(1556790696000+0800)/,0
17841985,性价比不高，景点指示标志少。只有江边栈道还有点可观赏性,/Date(1549613938000+0800)/,0
2173970,这个景点不错，干净卫生，服务态度好,/Date(1542532842000+0800)/,1
67295227,自然景观很不错，就当森林氧吧吧，景点啥的不值一提，确实门票是不值的，不过反正没去过去一次就罢了,/Date(1534032296000+0800)/,0
52953875,比我想象的好玩，真的不错有山有水有树林，还有历史文化。,/Date(1523840897000+0800)/,0
168532729,景色非常的美丽，花儿开的也很茂盛。还能看到长江的风采。,/Date(1521888914000+0800)/,0
153855140,雪景很美&#x20;遗憾的是因为天气原因好多景光木有看到&#x20;下次再去啦,/Date(1517378820000+0800)/,0
150236908,假期游玩，人很多比较热闹，环境很好，没事可以带家人游玩,/Date(1507369094000+0800)/,0
149822183,其实就是马鞍山市区北边临江的大公园！山坡不高但有积水路滑。公园内厕所与指示牌较少……绿化和公园方面不错，整体来说适合家人散步好去处……,/Date(1507275071000+0800)/,0
4486169,很好的景点，提前买票真的划算。景区很大，仔细玩要多半天,/Date(1507198473000+0800)/,0
39756039,文化历史还需加深挖掘力度，不要守着前任的遗&#x0D;产吃老本。,/Date(1507164088000+0800)/,0
70450622,不错的地方，景色很美！车程也不远，是周末休闲的好地方。,/Date(1506158305000+0800)/,0
29507757,景色秀丽，有文化底蕴，特别是江边三元洞景区照相特别好看,/Date(1504271264000+0800)/,0
45902474,这里非常知得去的地方，诗城马鞍山，成就了一代数诗仙李白,/Date(1494025261000+0800)/,0
82551283,值得游玩，风景美极了，山美，水美，,/Date(1487082297000+0800)/,1
22686950,买年票比较划算，单独买票的话比较贵,/Date(1475720532000+0800)/,1
31121710,小景点很多，但不是很有特色，山顶的三台阁可能是我们去的时候快下班了，工作人员把看风景的门都关了，在拖地，所以看不到城市远景，有点小遗憾,/Date(1465953505000+0800)/,0
5158430,不错，空气非常好，景色美，与十年前比好很多，值得一玩。,/Date(1403421255000+0800)/,0
17559066,李白诗仙都留恋的地方，还能不美？？？？？？？？？？？？,/Date(1399695723000+0800)/,0
10621109,在景区工作人员的指引下很顺利拿到三张门票，价格很优惠，,/Date(1399300297000+0800)/,0
2599451,青山绿水，鸟语虫鸣。且远离尘嚣，是个非常非常美丽的地方,/Date(1092223691000+0800)/,0
209151229,门卫老头态度恶劣，言语使用不文明不尊重游客，建议专门培训一下检票口接待游客的大爷，态度不好！,/Date(1590996579000+0800)/,2
39443767,去年来时阴雨，今年来时晴天。只因李白情节，感触多多。,/Date(1540421971000+0800)/,0
11019862,与李白有关的文化景点，园林建设的还不错，可以去看看。,/Date(1526888318000+0800)/,0
877447,非常值得去玩，只是要提前定。要玩整个景区需要好的体力,/Date(1525611459000+0800)/,0
153260766,一路走着静静欣赏这江边风景，无人干扰，心很踏实。实，,/Date(1521720196000+0800)/,0
115158337,环境风景还不错，就是周围饭店较少，吃的东西选择不多！,/Date(1517752944000+0800)/,0
10373194,江边看不出什么特色，李白纪念馆等可以学到很多历史知识。如果从大门步行游玩，整个游程还是很累的，但孩子玩得很高兴。,/Date(1514122107000+0800)/,1
21502105,方便、价格比现场买要便宜一些，只是希望能快一点取票。,/Date(1511873104000+0800)/,0
110250857,不错，比想象中的要累些，带孩子去玩的，孩子爬山很开心,/Date(1509604217000+0800)/,0
1369408,风景很好，可走的路很多，走上峰顶，索道下来还满好玩的,/Date(1495902218000+0800)/,0
27388594,不错。一日游还行。在旁边吃点江鲜,/Date(1478059462000+0800)/,1
2202274,非常好的地方，是李白的飞升之地。有着江南第一矶的美誉,/Date(1465723230000+0800)/,0
2296855,虽然路途插曲多多，火车挡道时间长很闹心，但总体不错。,/Date(1403837102000+0800)/,0
2296855,虽然路途插曲多多，火车挡道时间长很闹心，但总体不错。,/Date(1402976447000+0800)/,0
4805482,景点不错，值得一游，要能提供景区游览略图就更好了。,/Date(1535638022000+0800)/,0
60457274,很幽静的地方，靠江边，适宜游玩，放松心情的好去处！,/Date(1506262991000+0800)/,0
933143,天热，人少去，景色秀丽。值得去,/Date(1502291876000+0800)/,1
1520608,风景好，有人文气息，景区环境干净，是休闲的好去处。,/Date(1494027666000+0800)/,0
3128543,很好很好，公园很大很漂亮，去的时候人不多，五星感受,/Date(1489318835000+0800)/,0
1288630,一个大公园，是长江三大名矶之一，因为李白名声大噪。,/Date(1453893114000+0800)/,0
30239985,一般般把，没什么可玩性。建议一家人游玩，增加互动性,/Date(1451692341000+0800)/,0
34105778,门票不便宜，但是网上订了便宜不少，原来有游船，现在好像找不到了，那么美好的地方，设施却又破又旧。索道太贵了。单程就三十，就两百多米,/Date(1434339557000+0800)/,0
4476961,特意选择下雨天出行，旅途人际稀少，非符合预想的意境,/Date(1398916261000+0800)/,0
4476961,特意选择下雨天出行，旅途人际稀少，非符合预想的意境,/Date(1398084524000+0800)/,0
,在商业气息充斥在风景中的今天，采石矶还是那样的怀古,/Date(1121997218000+0800)/,0
35724993,采石肌历史悠久，公园绿树成荫，值得一去的好地方。,/Date(1527896218000+0800)/,0
12005614,还是不错的地方，可以欣赏江景，可以参观李白故居。,/Date(1524704583000+0800)/,0
96326199,只要不去那些官方推荐的店铺，就一切都好。很安静。,/Date(1519773325000+0800)/,0
2956225,太棒了，山下就可以玩上大半天，环境很适合举家出游,/Date(1514335961000+0800)/,0
16818328,景区很大，也整洁，江边的一处纪念李白的标志性景区,/Date(1510994300000+0800)/,0
5543933,景区不大，周末带小朋友去的，人很少，走走逛逛挺好,/Date(1509932898000+0800)/,0
150311017,"景点总体来讲还可以,就是爬山太累了！树木蛮多的。",/Date(1507387146000+0800)/,0
148505068,离市区不远，有公交直达，取票方便，江边风景不错。,/Date(1507186770000+0800)/,0
149951582,带小孩出去玩，看到了许多美丽的风景，不枉次此行。,/Date(1507176688000+0800)/,0
149818864,空气清新，风景如画，诗仙的传说，非常不错，好地方,/Date(1507101647000+0800)/,0
39443767,雨中呼青莲，江畔思古今。阁巅瞰城郭，楼中梦酒樽。,/Date(1500679570000+0800)/,0
48142584,很棒！采石矶的茶干很美味，坐敞开式的缆车很刺激！,/Date(1498049033000+0800)/,0
77425025,这里风景秀美，环境也不错，大家没事赶快来玩一玩哦,/Date(1497395905000+0800)/,0
19869297,风景秀丽，人文底蕴丰厚。网上订票方便，取票迅速。,/Date(1489180394000+0800)/,0
436836,带着韩国客户一起去的。客户很满意。很好的一个景点,/Date(1473496385000+0800)/,0
7986747,大气上档次，风景优美，李白墓碑在此不妨欣赏一番。,/Date(1461297911000+0800)/,0
596897,在长江边上，江景非常漂亮，与南京的燕子矶等齐名。,/Date(1451570526000+0800)/,0
15840413,门票贵，山上看长江不错，有李白墓，建议借张年卡。,/Date(1409763947000+0800)/,0
,采石矶景点不错，最好在8、9月份雨后最好，氧气充足，舒适。205国道不要走，要20元路费，红灯多。宁马高速最好，南京到马20元。,/Date(1348466695000+0800)/,0
3309508,上学的时候经常去的景点，16年后重游，感觉不错,/Date(1552280510000+0800)/,0
19976387,太好了。人真少，有个李白衣冠墓，还是值得去的。,/Date(1543479025000+0800)/,0
12941435,景区整体还可以，消费不是很高。还是比较舒适的。,/Date(1538575747000+0800)/,0
120720836,有点累，虽然不大，景色还不错，就是爬山比较累。,/Date(1537755684000+0800)/,0
183441423,带朋友去的，江边的景色还可以，以后有机会再去。,/Date(1536244625000+0800)/,0
182635884,非常值得一去的地方，特别是江边栈道的景色很美。,/Date(1534906305000+0800)/,0
2421045,挺大，历史悠久，里面的都是古树，整体感觉不错！,/Date(1532867768000+0800)/,0
173804382,好，还不错，总体可以，就是景点很少，没什么玩的,/Date(1530439423000+0800)/,0
3990432,静下心来可以玩一天，体力和历史都可以得到熏陶！&#x0A;,/Date(1525175801000+0800)/,0
16873620,景区安静，环境很好，适合漫步闲逛，指示牌少一些,/Date(1519557466000+0800)/,0
5148025,就在长江沿岸，风景优美，大诗人李白也留下佳诗。,/Date(1513732996000+0800)/,0
71448892,非常不错，景点不错，上山做索道，惊涛拍岸的感觉,/Date(1510894026000+0800)/,0
3303290,携程购票方便，优惠多，国庆节游人不多，停车免费,/Date(1507902270000+0800)/,0
21894011,风景不错，山不太高，小孩爬的也不累，玩的很开心,/Date(1505205305000+0800)/,0
16959745,取票方便，比当场买票便宜不少，携程依旧那么好用,/Date(1505142275000+0800)/,0
11019862,很有文化内涵的地方，地方不大，但很有一份味道。,/Date(1502929841000+0800)/,0
16234397,非常好的景点，可以让人安静，一切烦恼都没有了！,/Date(1494835686000+0800)/,0
90045161,江边景色，有看点，古栈道，有特色。游玩很愉快。,/Date(1494327458000+0800)/,0
32822801,里面很大，环境不错，登三台阁，观长江，一览无余,/Date(1493638024000+0800)/,0
83929517,马鞍山最好的景点，开发的越来越好，值得一去！！,/Date(1491834398000+0800)/,0
57725391,还不错，去的时候门票比较便宜，感觉性价比挺高的,/Date(1490445958000+0800)/,0
34154287,很适合去的地方&#x20;水清山美的&#x20;我和朋友一起去了几次呢,/Date(1469424137000+0800)/,0
41835833,如果你爬到山顶还是很好看的，路上的风景也很美丽,/Date(1465460718000+0800)/,0
2338500,环境还不错，各种植被。山顶眺望长江，心旷神怡。,/Date(1431264626000+0800)/,0
26851306,上山路有几段往下走&#x20;然后再往上，就像人生&#x20;有点感悟,/Date(1430551708000+0800)/,0
15605996,50元的门票价格太贵了，没什么人就是爬山看长江,/Date(1420288956000+0800)/,0
6107861,很漂亮的地方，地理位置也很好，只是没有发展好。,/Date(1419762226000+0800)/,0
1531921,比南京的燕子矶要雄伟得多，且更有诗仙的遗风在。,/Date(1224494037000+0800)/,0
877513,可能因为宣传力度不大，采石矶游客不多，少了很多喧嚣，景色很美，环境很好，景区硬件还可以，值得游玩，不过工作人员的态度还需改进。,/Date(1220855578000+0800)/,0
23339086,很好，很方便，很快捷，下次还会继续使用携程！,/Date(1543384002000+0800)/,0
200114080,挺不错的风景，空气好好，了解了不少李白的故事,/Date(1538744424000+0800)/,0
24689240,采石矶相当不错，性价比也高，平时很少打字评论,/Date(1528094410000+0800)/,0
117394929,进景区很方便，里面的风景很优美。古栈道不错。,/Date(1525409403000+0800)/,0
73892616,每年都会去的，每季的花都不一样，适合家人一起,/Date(1522485046000+0800)/,0
78645157,总体环境还行，去的可能有些早，人不是特别多，下午2点离开时人流开始渐多，江边景色一般，风大吹着有些冷，门票62，性价比一般！,/Date(1520822147000+0800)/,0
54429803,江边景色很好，可以好好看看，就是冬天有点冷。,/Date(1517750382000+0800)/,0
157323953,带着外地朋友来玩的，逛了一圈感受一下诗城文化,/Date(1514861681000+0800)/,0
4578836,总体来说满意，主要是性价比高，其他的能接受吧,/Date(1509352755000+0800)/,0
150786842,酒店住宿真的很不错，大床，还提供两人的早餐。,/Date(1507810248000+0800)/,0
11808012,整体来说很好，价格比现场买便宜很多，很实惠的,/Date(1507339501000+0800)/,0
34828848,总体可以，5元停车费，可以开车进去，少走很多路。三元洞水淹了，10月以后才能看到。有敞开索道上山，额外收费，40一个人上下。,/Date(1503834647000+0800)/,0
34830034,冬天去的&#x20;&#x20;不错&#x20;很舒服&#x20;人不多&#x20;&#x20;春天或者秋天应该不错,/Date(1499519713000+0800)/,0
87711677,依山傍水人文景观和自然景观都相当好，值得去！,/Date(1499517869000+0800)/,0
